102132871;Piso en Calle de Villajimena;Piso;Oportunidad. Vivienda para reformar junto a la Universidad Juan Carlos I. Zona Vicalvaro. Vivienda de 75 m2 construidos, para reformar. Todo exterior y muy soleada por su orientación. Por un lado encontramos un hall de entrada, donde accedemos al salón comedor y la cocina amueblada. Dispone de 3 dormitorios y 1 baño completo. Suelos en tarima flotante y gres cerámico. Tiene armario empotrado en dormitorio principal y carpintería exterior en aluminio. Dispone de agua caliente sanitaria por termo eléctrico. Aire acondicionado. La vivienda cuenta con plaza de garaje y la finca con ascensor. Ubicado en zona muy tranquila, con colegios, zonas ajardinadas, parques, centro culturales y de salud, polideportivo cerca, centros comerciales y comercio tradicional, ocio y restauración en entorno. Bien comunicado: Metro Vicalvaro/San Cipriano (Línea 9). Autobuses (4, 100, 159, N6) y fácil acceso M30 y M40. Próximo a las calles Villablanca, Villacarlos, Pso. de Los Artilleros, Anillo Verde. Póngase en contacto con Grupo Mejocasa Asesores para solicitar una visita o información sobre cualquiera de nuestros inmuebles. Le informamos que contamos con servicios financieros propios y externalizados para ayudarle a conseguir las mejores condiciones del mercado para su hipoteca. No dude en llamarnos, puede contactarnos si lo prefiere, en nuestra oficina de Avda. Canillejas a Vicalvaro 111 - le atenderemos con mucho gusto.;919387305;Calle de Villajimena;168000;3;Ambroz, Madrid;Mejocasa;Profesional;Ambroz;Madrid;Vicálvaro;-;2240;75;1;5;Sí;No;No;No;Sí;Sí;Sí;No;Sí
100717048;Chalet adosado;Chalet;En construcción 2 viviendas unifamiliares nuevas, situadas en la Calle Matadero Viejo. Fecha de entrega estimada para diciembre 2023 Fachada en monocapa, en total consonancia con el entorno, haciendo que se integre en el carácter histórico de la Plaza de Vicálvaro. Garaje cerrado con acceso directo a la vivienda, al que se accede por las calles peatonales del centro de Vicálvaro. Compuesto por 3 dormitorios, salón, cocina amplia con comedor, baño y aseo, garaje, buhardilla con terraza de 16m² y jardín trasero de 55m² con piscina privada. Carpintería exterior en PVC blanco, con rotura de puente térmico, persianas acústicas y térmicas. Climatización mediante Aerotermia, con suelo radiante refrescante, que actualmente supone una excelente opción a la hora de lograr eficiencia energética en el hogar. Calificación energética B Suelos en Gres porcelánico de primera calidad, y carpintería interior lacado en blanco. Precio por cada vivienda 449.000€ + iva A escasos metros de la Plaza de Vicálvaro, Plaza de Don Antonio de Andrés, donde se encuentra la Junta Municipal de Vicálvaro. a 300 metros del Metro Vicálvaro y a 500m de la Universidad Rey Juan Carlos. A menos de 200 m² del Parque Natural de Valdebernardo, con amplias zonas verdes y lago artificial. En el encantador entorno del Centro Histórico de Vicálvaro, donde destacamos la cercanías a la joya del Barroco, la Iglesia de Santa Maria la Antigua, del S. XVI y la Junta Municipal de Vicálvaro que se encuentra a 50 metros.;919383794;barrio Casco Histórico de Vicálvaro;449000;4;Casco Histórico de Vicálvaro, Madrid;Look and find moratalaz;Profesional;Casco Histórico de Vicálvaro;Madrid;Vicálvaro;-;2721;165;3;-;No;No;Sí;Sí;Sí;Sí;Sí;No;Sí
101994745;Piso en Calle de Villajimena;Piso;Excelente vivienda en inmejorable ubicación en las Mil Viviendas. C/ Villajimena, 3ª planta con ascensor, 66 m2 distribuidos en 3 dormitorios, salón, cocina, baño y amplia terraza abierta. Baño con plato de ducha y puerta blindada. Excelentes posibilidades de reforma. Inmejorable ubicación, a 1 minuto de la Universidad y del metro Vicálvaro. Muy próximo a paradas de autobús, centro de salud y todo tipo de comercios, a 2 minutos andando del parque forestal de Vicálvaro, fácil aparcamiento en superficie. Buena comunicación con m-40, m-30, m-23, A-3, R-3. Solicite visita sin compromiso: Calle Villalmanzo 14, Local TECNOCASA.;919382750;Calle de Villajimena;165000;3;Ambroz, Madrid;Tecnocasa Vicálvaro;Profesional;Ambroz;Madrid;Vicálvaro;-;2500;66;1;3;Sí;No;No;Sí;No;No;No;No;No
101523705;Piso;Piso;SOLAMENTE DISPONIBLES VIVIENDAS PARA PERSONAS CON MOVILIDAD REDUCIDA  RESIDENCIAL ALBALI S. COOP. MAD. ES LA GANADORA DE LA PARCELA 2.4. 1 EN LA REÑIDA SUBASTA ORGANIZADA POR LA JUNTA DE COMPENSACIÓN DEL ÁMBITO DE LOS BERROCALES Cooperativa ya constituida. ¡Ya ha llegado tu momento de ser propietario, elige tu vivienda! Viviendas Protegida de Precio Limitado (VPPL) en Los Berrocales Se ha destinado el 4% del total de las viviendas, así como sus anejos vinculados, para personas con movilidad reducida. ¡Se abren nuevas oportunidades en Los Berrocales! Grupo Ibosa quiere llegar a ti con este magnífico proyecto de Vivienda Protegida de Precio Limitado en unos de los ámbitos de mayor proyección de la Comunidad de Madrid, Los Berrocales. Tu vivienda Residencial Albali II albergará viviendas de 2, 3 y 4 dormitorios con amplias terrazas integradas en un nuevo desarrollo urbanístico basado en la sostenibilidad y rodeado de zonas verdes. Para tus momentos de ocio, podrás disfrutar de zonas verdes, piscina para que puedas disfrutar de un buen baño en tus tardes de verano, local comunitario para reuniones y celebraciones y zona infantil para los más peques de la casa. Localización Tiene una ubicación estratégica al este de Madrid, muy cerca de Ensanche de Vallecas y el C. C. La Gavia destacando la gran conectividad a las redes de transporte público dada su cercanía al metro y paradas de autobuses. Delimita al sur por la A3, al este por la M-50, al oeste por la M-45 y por el norte la línea 9 de metro.  ¡Tus sueños empieza en Los Berrocales!  Aviso importante: Este proyecto se gestiona en régimen de Cooperativa, Residencial Albali S. Coop. Mad. , ya está constituida y se ha proclamado adjudicataria de la parcela 2.4. 1, una de las mejores parcelas del nuevo plan urbanístico de Los Berrocales.  Durante el desarrollo del proyecto, la dirección facultativa por motivos técnicos o administrativos se reserva el derecho de efectuar algunas modificaciones en distribuciones, dimensiones, superficies y materiales, sin que ello suponga disminución en la calidad de los materiales.;919382241;barrio Los Berrocales;190744;2;Los Berrocales, Madrid;Grupo Ibosa;Profesional;Los Berrocales;Madrid;Vicálvaro;-;2271;84;2;1;Sí;Sí;Sí;Sí;Sí;Sí;No;Sí;No
102248984;Dúplex;Duplex;GRUPO GISA ALQUILER CON OPCION A COMPRA DÚPLEX en el distrito de Vicálvaro, zona inmejorable próximo a todos servicios y prestaciones ( hostelería, supermercados, médicos, polideportivos, parques, linea de autobuses EMT, Metro Puerta de Arganda, Renfe, salida a carretera M40-M45-R3). Dúplex reformado de 90m2, salón amplio con balcón, cocina totalmente amueblada y equipada, 2 dormitorios amplios, 2 baños (1 baño y 1 aseo), armarios empotrados, calefacción individual, aire acondicionado, persianas eléctricas y suelos porcelánicos. El dúplex es exterior y muy luminoso, sin amueblar, finca con ascensor, jardines, portería 24 horas y plaza de garaje. ¡ Ven a visitarlo! GRUPO GISA TE AYUDA A FINANCIAR HASTA EL 100% CONSULTANOS SIN COMPROMISO.;919388634;barrio Ambroz;200000;2;Ambroz, Madrid;Inmobiliaria Grupo Gisa;Profesional;Ambroz;Madrid;Vicálvaro;210000;2222;90;2;1;Sí;No;No;No;Sí;Sí;Sí;No;No
100201182;Piso;Piso;VIVIENDA PROTEGIDA EN LOS BERROCALES SOLAMENTE DISPONIBLES VIVIENDAS PARA PERSONAS CON MOVILIDAD REDUCIDA  TU OPORTUNIDAD PARA SER PROPIETARIO DE UNA VIVIENDA EN MADRID, A UN PRECIO MUY ASEQUIBLE.  Grupo Ibosa presenta este nuevo proyecto de Vivienda de Protección Pública Básica en uno de los nuevos desarrollos urbanísticos con mayor proyección ubicado en el sureste de Madrid, en Los Berrocales.  Proyecto Residencial Sextans es un singular proyecto redactado por el prestigioso estudio de arquitectura Cano&Escario. Tras una elegante arquitectura se albergan 74 viviendas de 2 y 3 dormitorios donde la luminosidad, distribuciones bien pensadas y sus amplias terrazas, adquieren un gran protagonismo. La sostenibilidad, calidad y diseño son los elementos principales en esta promoción de viviendas con un precio muy asequible.  En Sextans se da gran importancia al tiempo libre de sus propietarios sin salir de casa, por eso, el residencial ofrecerá una estupenda piscina, sala comunitaria donde celebrar momentos especiales, zonas verdes y para los pequeños de la casa, un área infantil donde poder jugar con sus amiguitos. Se ha destinado el 4% del total de las viviendas, así como sus anejos vinculados, para personas con movilidad reducida. Sostenibilidad y ahorro energético Residencial Sextans se encuentra en un nuevo desarrollo urbanístico basado en la sostenibilidad y rodeado de zonas verdes.  Grupo Ibosa está tomando las medidas necesarias para que el proyecto obtenga una alta calificación energética que se traducirá en una mejora del medio ambiente y ahorro económico en los suministros.  Localización Tiene una ubicación estratégica al este de Madrid, muy cerca de Ensanche de Vallecas y el C. C. La Gavia destacando la gran conectividad a las redes de transporte público dada su cercanía al metro y paradas de autobuses. Delimita al sur por la A3, al este por la M-50, al oeste por la M-45 y por el norte la línea 9 de metro. ¡Ha llegado tu momento, elige tu vivienda en Los Berrocales! Aviso importante: Este proyecto se gestiona en régimen de Cooperativa. Residencial Sextans S. Coop. Mad., ya está constituida. La Cooperativa no ostenta propiedad alguna sobre el solar sobre el que se desarrollaría el proyecto, pretendiendo presentar una oferta competitiva para la adquisición del mismo.  Durante el desarrollo del proyecto, la Dirección Facultativa se reserva el derecho de efectuar modificaciones que viniesen motivadas por exigencias de orden técnico o jurídico por parte de las Administraciones competentes, así como aquellas que pudieran suponer cambios del proyecto o en la memoria de calidades que en ningún caso supondrán minoración de las calidades previstas. Las imágenes mostradas pertenecen al anteproyecto teniendo carácter orientativo y no contractual.;919389836;barrio Los Berrocales;179481;2;Los Berrocales, Madrid;Grupo Ibosa;Profesional;Los Berrocales;Madrid;Vicálvaro;-;2991;60;1;1;Sí;Sí;No;Sí;No;No;No;No;No
102101071;Piso en Calle de Mercurio;Piso;Piso de 92 m2, consta de 3 dormitorios, salón- comedor, cocina totalmente equipada y amueblada, baño con plato de ducha, terraza, y piscina comunitaria, con zonas de jardines y parques.  Suelos de tarima, paredes de gotelé, aire acondicionado en salón y dormitorio, con bomba de calor, termo de agua caliente, ventanas de climalit blanco en toda la vivienda. Calefacción central. Para entrar a vivir. Vicálvaro es uno de los distritos de Madrid mejor comunicado por carretera y transporte público. Frente a parada de AUTOBUSES 4 – 106 – E3 - N7 y METRO L 9. Comunicaciones por carretera: M-40: salida 12: carretera de Vicálvaro. Salida 14: avenida del Doctor García Tapia – Vicålvaro. A-3: salida 7: Vicálvaro – Valdebernardo. M-45: salida 20 ABC: Vallecas – Mejorada del Campo – Vicálvaro. M-203: carretera de Madrid a Mejorada del Campo y Alcalá de Henares. R-3: salida 1: San Blas – Vicálvaro. M-23- Prolongación de O’Donnell: salida Vicálvaro. Carretera de Vicálvaro a la Estación de O’Donnell: comunica Vicálvaro con la carretera M-201, el oeste de Coslada y el barrio de Rejas (San Blas-Canillejas). Para más información no dude en ponerse en contacto con nosotros en el correo  o en los teléfonos:     ó    Comentarte que contamos con un alianzas estratégicas para la intermediación Financiera en el cual puedes obtener un asesoramiento sin compromiso/sin coste para conocer tus posibilidades y tener mejores opciones y garantías a la hora de comprar. Vivienda Madrid nace cuando las circunstancias, del mercado y la intuición empresarial se juntan en un mismo momento y espacio. Es así, como en 2010 un grupo de profesionales con un trayectoria de más de diez años en el sector inmobiliario, deciden lanzarse al mercado con su propia marca. M-23- Prolongación de O’Donnell: salida Vicálvaro. Carretera de Vicálvaro a la Estación de O’Donnell: comunica Vicálvaro con la carretera M-201, el oeste de Coslada y el barrio de Rejas (San Blas-Canillejas).  .;919380131;Calle de Mercurio;250000;3;Casco Histórico de Vicálvaro, Madrid;VIVIENDA MADRID VICALVARO VALDEBERNARDO;Profesional;Casco Histórico de Vicálvaro;Madrid;Vicálvaro;-;2717;92;1;3;No;No;Sí;Sí;No;No;No;No;No
101525005;Piso;Piso;SOLAMENTE DISPONIBLES VIVIENDAS PARA PERSONAS CON MOVILIDAD REDUCIDA  RESIDENCIAL ALBALI S. COOP. MAD. ES LA GANADORA DE LA PARCELA 2.3. 1EN LA SUBASTA ORGANIZADA POR LA JUNTA DE COMPENSACIÓNDEL ÁMBITO DE LOS BERROCALES Cooperativa ya constituida. ¡Ya llegado tu momento, elige tu vivienda! No pierdas la oportunidad. Viviendas de Protección Pública Básica (VPPB) en Los Berrocales. SOLAMENTE DISPONIBLE EL 4% DEL TOTAL DE VIVIENDAS QUE SON DESTINADAS A PERSONAS CON MOVILIDAD REDUCIDA, ASÍ COMO SUS ANEJOS VINCULADOS. Residencial Albali es una promoción de 168 viviendas de 2 y 3 dormitorios con plaza de garaje y trastero incluido en el precio. Viviendas con amplias terrazas integradas en un nuevo desarrollo urbanístico basado en la sostenibilidad y rodeado de zonas verdes. Calidad, diseño y sostenibilidad en viviendas protegidas. Para disfrutar de tu tiempo libre sin salir de casa, Residencial Albali dispondrá de unas estupendas zonas comunes con piscina, zonas verdes y un local comunitario para disfrutar con la familia y amigos. Residencial Albali S. Coop. Mad. , cooperativa ya constituida, se ha proclamado adjudicataria de la parcela 2.3. 1. una de las mejores parcelas del nuevo plan urbanístico de Los Berrocales.;919385464;barrio Los Berrocales;184290;2;Los Berrocales, Madrid;Grupo Ibosa;Profesional;Los Berrocales;Madrid;Vicálvaro;-;2925;63;2;2;Sí;Sí;Sí;Sí;Sí;Sí;Sí;Sí;No
101523714;Piso;Piso;SOLAMENTE DISPONIBLES VIVIENDAS PARA PERSONAS CON MOVILIDAD REDUCIDA  RESIDENCIAL ALBALI S. COOP. MAD. ES LA GANADORA DE LA PARCELA 2.4. 1 EN LA REÑIDA SUBASTA ORGANIZADA POR LA JUNTA DE COMPENSACIÓN DEL ÁMBITO DE LOS BERROCALES Cooperativa ya constituida. ¡Ya ha llegado tu momento de ser propietario, elige tu vivienda! Viviendas Protegida de Precio Limitado (VPPL) en Los Berrocales Se ha destinado el 4% del total de las viviendas, así como sus anejos vinculados, para personas con movilidad reducida. ¡Se abren nuevas oportunidades en Los Berrocales! Grupo Ibosa quiere llegar a ti con este magnífico proyecto de Vivienda Protegida de Precio Limitado en unos de los ámbitos de mayor proyección de la Comunidad de Madrid, Los Berrocales. Tu vivienda Residencial Albali II albergará viviendas de 2, 3 y 4 dormitorios con amplias terrazas integradas en un nuevo desarrollo urbanístico basado en la sostenibilidad y rodeado de zonas verdes. Para tus momentos de ocio, podrás disfrutar de zonas verdes, piscina para que puedas disfrutar de un buen baño en tus tardes de verano, local comunitario para reuniones y celebraciones y zona infantil para los más peques de la casa. Localización Tiene una ubicación estratégica al este de Madrid, muy cerca de Ensanche de Vallecas y el C. C. La Gavia destacando la gran conectividad a las redes de transporte público dada su cercanía al metro y paradas de autobuses. Delimita al sur por la A3, al este por la M-50, al oeste por la M-45 y por el norte la línea 9 de metro.  ¡Tus sueños empieza en Los Berrocales!  Aviso importante: Este proyecto se gestiona en régimen de Cooperativa, Residencial Albali S. Coop. Mad. , ya está constituida y se ha proclamado adjudicataria de la parcela 2.4. 1, una de las mejores parcelas del nuevo plan urbanístico de Los Berrocales.  Durante el desarrollo del proyecto, la dirección facultativa por motivos técnicos o administrativos se reserva el derecho de efectuar algunas modificaciones en distribuciones, dimensiones, superficies y materiales, sin que ello suponga disminución en la calidad de los materiales.;919382241;barrio Los Berrocales;225626;3;Los Berrocales, Madrid;Grupo Ibosa;Profesional;Los Berrocales;Madrid;Vicálvaro;-;2169;104;2;2;Sí;Sí;Sí;Sí;Sí;Sí;No;Sí;No
101525948;Piso;Piso;VIVIENDA PROTEGIDA EN LOS BERROCALES SOLAMENTE DISPONIBLES VIVIENDAS PARA PERSONAS CON MOVILIDAD REDUCIDA  TU OPORTUNIDAD PARA SER PROPIETARIO DE UNA VIVIENDA EN MADRID, A UN PRECIO MUY ASEQUIBLE.  Grupo Ibosa presenta este nuevo proyecto de Vivienda de Protección Pública Básica en uno de los nuevos desarrollos urbanísticos con mayor proyección ubicado en el sureste de Madrid, en Los Berrocales.  Proyecto Residencial Sextans es un singular proyecto redactado por el prestigioso estudio de arquitectura Cano&Escario. Tras una elegante arquitectura se albergan 74 viviendas de 2 y 3 dormitorios donde la luminosidad, distribuciones bien pensadas y sus amplias terrazas, adquieren un gran protagonismo. La sostenibilidad, calidad y diseño son los elementos principales en esta promoción de viviendas con un precio muy asequible.  En Sextans se da gran importancia al tiempo libre de sus propietarios sin salir de casa, por eso, el residencial ofrecerá una estupenda piscina, sala comunitaria donde celebrar momentos especiales, zonas verdes y para los pequeños de la casa, un área infantil donde poder jugar con sus amiguitos. Se ha destinado el 4% del total de las viviendas, así como sus anejos vinculados, para personas con movilidad reducida. Sostenibilidad y ahorro energético Residencial Sextans se encuentra en un nuevo desarrollo urbanístico basado en la sostenibilidad y rodeado de zonas verdes.  Grupo Ibosa está tomando las medidas necesarias para que el proyecto obtenga una alta calificación energética que se traducirá en una mejora del medio ambiente y ahorro económico en los suministros.  Localización Tiene una ubicación estratégica al este de Madrid, muy cerca de Ensanche de Vallecas y el C. C. La Gavia destacando la gran conectividad a las redes de transporte público dada su cercanía al metro y paradas de autobuses. Delimita al sur por la A3, al este por la M-50, al oeste por la M-45 y por el norte la línea 9 de metro. ¡Ha llegado tu momento, elige tu vivienda en Los Berrocales! Aviso importante: Este proyecto se gestiona en régimen de Cooperativa. Residencial Sextans S. Coop. Mad., ya está constituida. La Cooperativa no ostenta propiedad alguna sobre el solar sobre el que se desarrollaría el proyecto, pretendiendo presentar una oferta competitiva para la adquisición del mismo.  Durante el desarrollo del proyecto, la Dirección Facultativa se reserva el derecho de efectuar modificaciones que viniesen motivadas por exigencias de orden técnico o jurídico por parte de las Administraciones competentes, así como aquellas que pudieran suponer cambios del proyecto o en la memoria de calidades que en ningún caso supondrán minoración de las calidades previstas. Las imágenes mostradas pertenecen al anteproyecto teniendo carácter orientativo y no contractual.;919389836;barrio Los Berrocales;179418;2;Los Berrocales, Madrid;Grupo Ibosa;Profesional;Los Berrocales;Madrid;Vicálvaro;-;2990;60;2;3;Sí;Sí;No;Sí;No;No;No;No;No
101523692;Piso;Piso;SOLAMENTE DISPONIBLES VIVIENDAS PARA PERSONAS CON MOVILIDAD REDUCIDA  RESIDENCIAL ALBALI S. COOP. MAD. ES LA GANADORA DE LA PARCELA 2.4. 1 EN LA REÑIDA SUBASTA ORGANIZADA POR LA JUNTA DE COMPENSACIÓN DEL ÁMBITO DE LOS BERROCALES Cooperativa ya constituida. ¡Ya ha llegado tu momento de ser propietario, elige tu vivienda! Viviendas Protegida de Precio Limitado (VPPL) en Los Berrocales Se ha destinado el 4% del total de las viviendas, así como sus anejos vinculados, para personas con movilidad reducida. ¡Se abren nuevas oportunidades en Los Berrocales! Grupo Ibosa quiere llegar a ti con este magnífico proyecto de Vivienda Protegida de Precio Limitado en unos de los ámbitos de mayor proyección de la Comunidad de Madrid, Los Berrocales. Tu vivienda Residencial Albali II albergará viviendas de 2, 3 y 4 dormitorios con amplias terrazas integradas en un nuevo desarrollo urbanístico basado en la sostenibilidad y rodeado de zonas verdes. Para tus momentos de ocio, podrás disfrutar de zonas verdes, piscina para que puedas disfrutar de un buen baño en tus tardes de verano, local comunitario para reuniones y celebraciones y zona infantil para los más peques de la casa. Localización Tiene una ubicación estratégica al este de Madrid, muy cerca de Ensanche de Vallecas y el C. C. La Gavia destacando la gran conectividad a las redes de transporte público dada su cercanía al metro y paradas de autobuses. Delimita al sur por la A3, al este por la M-50, al oeste por la M-45 y por el norte la línea 9 de metro.  ¡Tus sueños empieza en Los Berrocales!  Aviso importante: Este proyecto se gestiona en régimen de Cooperativa, Residencial Albali S. Coop. Mad. , ya está constituida y se ha proclamado adjudicataria de la parcela 2.4. 1, una de las mejores parcelas del nuevo plan urbanístico de Los Berrocales.  Durante el desarrollo del proyecto, la dirección facultativa por motivos técnicos o administrativos se reserva el derecho de efectuar algunas modificaciones en distribuciones, dimensiones, superficies y materiales, sin que ello suponga disminución en la calidad de los materiales.;919382241;barrio Los Berrocales;226162;3;Los Berrocales, Madrid;Grupo Ibosa;Profesional;Los Berrocales;Madrid;Vicálvaro;-;2175;104;2;1;Sí;Sí;Sí;Sí;Sí;Sí;No;Sí;No
101654022;Ático en Calle Jose Escobar y Saliente;Ático;Espectacular ÁTICO con Gran Terraza de 90m2 en un entorno natural envidiable. La vivienda es a estrenar y se compone de hall, magnífico salón-comedor con diferentes áreas de estar y mucha luminosidad, ventanales que dan acceso a la fabulosa terraza que es un verdadero lujo donde podrá disfrutar y cenar con los amigos y familia, tomar el sol, o simplemente no hacer nada y descansar al aire libre. Extraordinaria cocina con tendedero cubierto. Excepcional Dormitorio Principal con acceso a otra terraza, y dos dormitorios más con mucha luminosidad. Dos cuartos de baño completos (uno en suite). ¡Aerotermia y máximas calidades! Dos Plazas de Garaje y amplio Trastero, incluidos en el precio. Magnífica urbanización con Piscina, Parque Infantil, Video-vigilancia y Portero físico 24h, Pista multideportiva, sala de eventos, 29 vecinos. La propiedad está situada en la zona más nueva, EL CAÑAVERAL. HAUS LIFE Property: La venta de viviendas Premium es una de nuestras líneas de acción. TLF. VISITAS y @ NUESTRA WEB HAUSLIFE. ES ¡Tenemos el mejor asesoramiento financiero!;919383307;Calle Jose Escobar y Saliente;489000;3;El Cañaveral, Madrid;HAUS LIFE Property;Profesional;El Cañaveral;Madrid;Vicálvaro;-;2747;178;2;5;Sí;No;Sí;Sí;Sí;Sí;Sí;Sí;Sí
99501830;Piso en Calle de la Dehesa de Vicalvaro;Piso;"GARANTÍA INMOBILIARIA VENDE fantástica vivienda ubicada en VICÁLVARO, a 15 minutos de la estación de metro SAN CIPRIANO o RENFE VICÁLVARO. El inmueble cuenta con 135 m2 construidos, de los cuales 91 m2 son de vivienda. Se distribuye en:  - Vestíbulo. - Cocina. - Amplio salón. - 3 dormitorios.  - 2 baños completos, uno de ellos en suite. - Aire acondicionado en toda la vivienda. - GARAJE Y TRASTERO INCLUIDOS EN EL PRECIO. - PISCINA Y JARDÍN COMUNITARIOS. Instalaciones: - Suelo Parquet en espiga. - Ventanas Climalit correderas. - Armarios empotrados en todos los dormitorios. - Puerta de entrada acorazada. - Puertas roble. - Paredes lisas. A su alrededor tiene transporte público, polideportivo, zonas de ocio, comercios, colegios, zonas de restauración, farmacias, autoescuelas, parques. Transporte público:  - Estaciones de Metro cercanas: Vicálvaro, San Cipriano.  - Estación de Renfe Vicálvaro.  - Autobuses urbanos 100,71, E3, N7 Comercios cercanos: - Casa Elías ( mercado alimentación), Supermercado Día%. - Centro comercial H2Ocio. - Centro comercial La Gavia. - IKEA Ensanche de Vallecas. Servicios: - Farmacias cercanas. - Hospital Universitario Infanta Leonor. - Hospital Virgen de la Torre. - CaixaBank. - Correos. Centros de educación: - CEIP Pedro Duque. - La Casita de Ro"" Madre de Día. - Universidad Rey Juan Carlos (URJC) Campus de Madrid. - Escuela de Arte. Parques y ocio:  - Laberinto del parque de Valdebernardo. - Pista de patinaje. - Campos de fútbol. - Área canina. - Área infantil. - Faunia. ¡ FINANCIACIÓN HASTA UN 100%! No dude en ponerse en contacto con nosotros y venga a visitarla sin ningún compromiso. GARANTÍA INMOBILIARIA, PROTEGEMOS TU FUTURO.""";919381583;Calle de la Dehesa de Vicalvaro;315000;3;Valdebernardo - Valderrivas, Madrid;Garantía Inmobiliaria;Profesional;Valdebernardo - Valderrivas;Madrid;Vicálvaro;-;2333;135;2;4;Sí;No;Sí;No;Sí;Sí;Sí;Sí;Sí
