100156954;Chalet adosado en Calle Ferenc Puskas esq. Calle Tres Cantos  s/n;Chalet;PALCOS DEL CAÑAVERAL ÚLTIMO CHALET VPPL ADAPTADO A PERSONAS CON DISCAPACIDAD AUDITIVA. REQUISITO 33% DE DISCAPACIDAD MÍNIMA PALCOS DEL CAÑAVERAL. es un atractivo proyecto residencial de vivienda unifamiliar de 43 viviendas en régimen de VPPL, gestionado en promoción tradicional (no es autopromoción, ni cooperativa, ni comunidad de bienes) situada en una de las zonas de mayor expansión de Madrid como es El Cañaveral. Las obras están muy avanzadas, estando prevista su finalización para el otoño de este año 2023. La promoción, dispone de una zona común interior, a la que se accede directamente desde cada uno de los jardines privados de cada vivienda. Está dotada de piscina con un amplio solarium, una zona equipada para juegos infantiles, y zonas de paseo. LA VIVIENDA DISPONIBLE TIENE 3 AMPLIOS DORMITORIOS, CADA UNO DE ELLOS CON CUARTO DE BAÑO INCORPORADO, A MODO DE SUITE. ADEMÁS, EXISTE EN PLANTA BAJA UN ASEO DE CORTESÍA PARA DAR SERVICIO A ESTA PLANTA, JUNTO A ESPACIOSAS SUPERFICIES DE DISTRIBUCIÓN Y DE ESTAR, CON GRANDES ESPACIOS PARA SALÓN Y COCINA. En su sótano existen dos trasteros y dos plazas de garaje en parking subterráneo que están comunicadas directamente desde la vivienda. Las superficies construidas de estas viviendas son de 181 y 183 m2 aproximados respectivamente, además de 22 m2 de ocupación correspondientes a sus dos plazas de garaje. Disponen de dos parcelas privativas, una delantera por donde tiene su entrada y otra trasera conectada con la zona común. ESTA VIVIENDA ADAPTADA A DISCAPACITADOS AUDITIVOS, POSEEN MECANISMOS LUMINOSOS EN CADA ESTANCIA QUE FAVORECEN UNA MAYOR CALIDAD DE VIDA A ESTE TIPO DE PERSONAS. Además de su excelente calidad y diseño, las casas de Palcos del Cañaveral disponen de instalaciones sostenibles como la aerotermia y sistemas de calefacción eficiente como el suelo radiante o suelo refrescante. Si lo desea, para ampliar la información, puede concertar una visita a nuestras oficinas situadas en la calle Alcalá, 96, 5º planta. Indicarle que El Cañaveral es el nuevo barrio residencial del Este de Madrid diseñado para más de 14.000 viviendas. Está situado en el distrito de Vicálvaro, lindando con Coslada, a escasos 15 minutos del Centro en coche, en una ubicación excepcional, al encontrase enclavado entre la M-45 y R-3 y a escasos minutos de la A3 y A2, de la prolongación de O’Donnell y de la M-40, así como de los centros comerciales de La Gavia, Plenilunio y Las Rosas. Como todos los desarrollos de nueva creación, contará con amplios espacios verdes, importantes zonas comerciales y de ocio, incluido un centro comercial propio, y numerosas infraestructuras, tanto deportivas como educativas, sanitarias o culturales. Seguro que es UN LUGAR EN EL QUE SE VA A SENTIR MEJOR Las siglas VPPL (Vivienda de Protección Pública de precio Limitado), se refiere a viviendas construidas en suelo protegido, de promoción privada, cuyo acceso está sujeto a una serie de requisitos y un precio asequible con mismas calidades que una vivienda libre.;917811298;Calle Ferenc Puskas esq. Calle Tres Cantos  s/n;393226;3;El Cañaveral, Madrid;Proel;Profesional;El Cañaveral;Madrid;Vicálvaro;-;2173;181;4;-;No;Sí;Sí;Sí;Sí;Sí;No;No;Sí
102385419;Piso en Calle del Lago Erie;Piso;ALIANZA MADRID vende en exclusiva, vivienda en tercera planta en el distrito de Vicálvaro. Se trata de un inmueble compuesto de salón comedor totalmente independiente, tres dormitorios, cocina amueblada, cuarto de baño completo con plato de ducha y dos terrazas.   Vivienda exterior con luminosidad en todas sus estancias. Puerta blindada, aire acondicionado, suelo de gres, pintura gotelé, ventanas de aluminio, calefacción individual, buen estado en general. Fontanería y la electricidad para actualizar.  Próxima a todo tipo de servicios en su entorno como supermercados, Universidad Rey Juan Carlos I, farmacias, centro comercial, Centro de Salud, parques, colegios, etc. Se encuentra a escasos metros de la parada de metro VICALVARO (línea 9), parada de cercanías PUERTA DE ARGANDA y paradas de autobús 71/100/106/130/N7, E3 y E5. No dudes en llamarnos y concertar una visita. Honorarios intermediarios no incluidos en el precio. Mantenemos protocolo de seguridad sanitaria para todas las visitas. Vendemos y alquilamos la vivienda en todo Madrid. Vicálvaro, Moratalaz, Simancas, Las Rosas, San Blas, Ciudad Lineal, Canillejas, Ventas, El Carmen, Retiro, Goya, Atocha Conde de Casal, Vallecas, Legazpi, Delicias, San Fermín, Ciudad los Ángeles, Villaverde, Carabanchel, Plaza Elíptica, Usera, Almendrales.. . Agencia Inmobiliaria especializada en venta y alquiler de inmuebles situada en Vicálvaro Lo importante es la actitud, actitud de venta. Encuentra más en.;919389118;Calle del Lago Erie;210000;3;Casco Histórico de Vicálvaro, Madrid;ALIANZA MADRID;Profesional;Casco Histórico de Vicálvaro;Madrid;Vicálvaro;-;2658;79;1;3;No;No;No;Sí;No;No;Sí;No;No
100553201;Chalet pareado en Calle Igualdad, 171;Chalet;OBRAS INICIADAS MARZO 2023 13 exclusivos unifamiliares libres de 4 dormitorios en una urbanización privada con piscina comunitaria y zonas ajardinadas pensadas para el entretenimiento y confort de todos los miembros de la familia.  El residencial se sitúa en El Cañaveral, nuevo barrio en desarrollo dentro del distrito de Vicálvaro en Madrid capital, entre la M-45 y la Radial 3, a 5 minutos de Las Rosas. Un barrio innovador en su diseño y concepción, con equipamientos de todo tipo como áreas verdes con itinerarios peatonales y un carril bici de seis kilómetros de longitud. El diseño viene de la mano de MYCC, ganadores de numerosos premios y distinciones en diversos concursos tanto nacionales como internacionales, entre los que destacamos el premio otorgado por la revista Architectural Review para una de las mejores viviendas unifamiliares del año 2012 a nivel internacional así como haber sido seleccionados por la revista Wallpaper como uno de los estudios destacados del mismo año.;919389561;Calle Igualdad, 171;675000;5;El Cañaveral, Madrid;Gestiono;Profesional;El Cañaveral;Madrid;Vicálvaro;-;2129;317;3;-;No;Sí;No;Sí;No;No;No;Sí;Sí
102387270;Piso en Calle Ilusión, 22;Piso;"Descubre Novoveral VIII Parque Novoveral"". Situada en el Cañaveral, a 10 minutos en coche del centro de Madrid. Conjunto residencial privado con instalaciones de primera calidad que ofrece 96 viviendas exclusivas de 1, 2, 3 y 4 dormitorios con terraza y bajos. Las viviendas destacan por su sostenibilidad, arquitectura de la promoción y unas zonas comunes de más de 4000m2. Las áreas contarán con piscina de adultos e infantil de cloración salina, pista de pádel, salón comunitario, zona recreativa para niños y espaciosas zonas verdes y de paseo. La promoción tiene, además, una localización privilegiada y tranquila con acceso a todos los servicios y a las puertas de la capital. Calidad, diseño y confort -Suelo radiante y refrigerante con aerotermia.  Cocina totalmente equipada y con electrodomésticos.  Mueble y espejo en baños  Domótica  Calificación energética A. Entrega prevista Diciembre 2025.""";919386770;Calle Ilusión, 22;347500;3;El Cañaveral, Madrid;NOVOVERAL RESIDENCIAL;Profesional;El Cañaveral;Madrid;Vicálvaro;-;3131;111;2;4;Sí;Sí;Sí;Sí;Sí;Sí;Sí;No;No
100235214;Piso en Calle Alcalde Andrés Madrid Dávila;Piso;Maravilloso bajo de 2 habitaciones y 2 baños, en El Cañaveral. 165 m2 construidos. 89 m2 útiles. Orientación Sur - Este. Salón con salida a jardín de 120 m2. Cocina americana. Suelo radiante y refrigerante. Armarios empotrados, ventanas climalit de aluminio y puertas lacadas. Amueblado negociable. Dispone de 2 plazas de garaje y trastero. Piscina y parque infantil. Portero físico. Ascensor y acceso adaptado a personas con capacidad de movilidad reducida. NO PIERDA ESTA OPORTUNIDAD Y CONTACTE CON NOSOTROS PARA REALIZAR UNA VISITA. Daurum Estate ofrece conseguir la mejor financiación a su medida hasta el 100% del valor de compra – venta sea nuestra la vivienda o no. INFORMACIÓN SIN COMPROMISO en el mismo número de teléfono del anuncio. Además, posibilidad de servicio de reformas para acomodar la vivienda a su gusto.;919382678;Calle ALCALDE ANDRÉS MADRID DÁVILA;399000;2;El Cañaveral, Madrid;DAURUM ESTATE;Profesional;El Cañaveral;Madrid;Vicálvaro;-;2418;165;2;bj;Sí;No;Sí;Sí;Sí;Sí;Sí;Sí;No
102382778;Piso en cerro del campo, 5;Piso;Piso de protección oficial vppb de 110m construidos en el barrio de el cañaveral (Vicálvaro) dispone de 3 habitaciones, 2 baños y terraza, 2 plazas de garaje y trastero, zonas ajardinadas y piscina, tiene tres años de antigüedad y está en perfecto estado.;-;cerro del campo, 5;298000;3;El Cañaveral, Madrid;Oscar;Particular;El Cañaveral;Madrid;Vicálvaro;-;2709;110;2;7;Sí;No;Sí;Sí;Sí;Sí;Sí;Sí;Sí
102388544;Piso en Carretera de Vicálvaro a Estación de O´Donnell;Piso;¡Descubre este espectacular loft de 90m2 en una ubicación privilegiada! Dividido en 2 plantas, este inmueble te ofrece un espacio moderno y funcional. En la planta baja, encontrarás un elegante baño con ducha y una cocina americana que se conecta de manera fluida con un amplio salón, el mismo cuenta con un impresionante ventanal que ofrece vistas panorámicas.  En la primera planta, te espera una acogedora habitación que disfruta de las vistas tanto al salón como al ventanal. Un segundo baño con ducha completa esta planta, brindándote comodidad y privacidad. La vivienda está ubicada en una urbanización cerrada que ofrece una gran cantidad de áreas verdes, y además, cuenta con ascensor y conserje, garantizando tanto comodidad como seguridad. Para hacer esta oferta aún más tentadora, incluimos una plaza de garaje en el precio.  Este impresionante loft de 90m2 no solo te brinda un espacio excepcional, sino que también está estratégicamente ubicado en una zona de gran conveniencia. A pocos minutos de la estación de trenes de Vicálvaro, estarás conectado de manera rápida y eficiente con otras partes de la ciudad. La ubicación cuenta con una amplia gama de comodidades a tu alcance: desde diversos comercios hasta supermercados, pasando por colegios que garantizan la educación de calidad para tus seres queridos. Además, si eres amante de la naturaleza y los espacios al aire libre, estarás encantado de saber que el parque forestal de Vicálvaro está a solo unos minutos de distancia. Aquí, podrás sumergirte en la serenidad de zonas verdes y disfrutar de relajantes paseos. ¡Y para los dueños de mascotas, hay incluso parques caninos para que también ellos disfruten al máximo! Y no olvides que este loft es una inversión de primer nivel, con un potencial de alquiler a través de Airbnb que podría generar una rentabilidad superior al 10%. ¡No pierdas la oportunidad de hacer realidad tus sueños de inversión y comodidad en un mismo lugar! ¡Contáctanos hoy mismo! En resumen, este loft no solo te ofrece un hogar excepcional, sino que también te brinda un estilo de vida completo y conveniente. ¡No dejes pasar la oportunidad de vivir en este maravilloso entorno! ¡Contáctanos ahora para más detalles y para concertar una visita!;919380444;Carretera de Vicálvaro a Estación de O´Donnell;192500;1;Ambroz, Madrid;Inmobiliarias Universal;Profesional;Ambroz;Madrid;Vicálvaro;-;2139;90;2;2;Sí;No;No;No;Sí;Sí;Sí;No;Sí
102379721;Piso en Avenida de la Gran Vía del Este, 9;Piso;Vivienda recién reformada en la mejor zona residencial de Vicálvaro. A un minuto a pie de la estación de Metro (Línea 9) y Cercanías Renfe (conecta en 15 minutos con Atocha). Autobuses, farmacia y dos colegios en la puerta. Todo exterior, muy luminoso y con ventanas nuevas de climalit con rotura de puente térmico. Consta de 3 habitaciones, una de ellas con baño en suite y armarios empotrados. Uno de los baños tiene plato de ducha y el otro bañera. La cocina dispone de primeras calidades tras la reforma, encimera y muebles hechos a medida (que ocultan caldera y lavadora), lavavajillas integrado y placa de inducción de 80 cm. El cerramiento de la cocina le da independencia al espacio, a la vez que comunica a través de una barra con el salón comedor. Iluminación diseñada para crear ambientes diferenciados que dotan de calidez a la casa. El suelo es de parquet, también tratado en la reforma y todas las puertas son nuevas. Hay aire acondicionado con splits en todas las estancias, además de calefacción de gas natural y bomba de frío/calor. La venta del inmueble se realiza con plaza de garaje y trastero. La urbanización cuenta con todas las comodidades: piscina grande e infantil, zona verde, espacio de juego para niños, pista de pádel, cancha de fútbol y sala común para la realización de eventos (ahí mismo se imparten clases de yoga y zumba todas las semanas).;636543576;Avenida de la Gran Vía del Este, 9;375000;3;Valdebernardo - Valderrivas, Madrid;Laura;Particular;Valdebernardo - Valderrivas;Madrid;Vicálvaro;-;2778;135;2;3;Sí;No;Sí;No;Sí;Sí;Sí;Sí;Sí
100084026;Piso en Calle Casa de Tilly, 33;Piso;Descubre Freya, nueva promoción de 131 viviendas en el barrio de El Cañaveral.  Tipologías son de 1, 2, 3 y 4 dormitorios con terraza, áticos y bajos con jardín.  Las viviendas destacan por su sostenibilidad, arquitectura de la promocion y amplias zonas comunes las cuales constan de piscina de adultos e infantil, gimnasio, solarium y zonas ajardinadas.  Desde la ubicación de tu vivienda solo necesitarás 20 minutos para llegar al centro de la capital y podrás desplazarte rápidamente utilizando tanto la R-3 como la M-45. Ambas vías cuentan con un cómodo acceso desde la promoción y te ofrecen conexión con la M-30 en 10 minutos. Además, esta área cuenta con accesos directos mediante transporte público, el cual se verá completado con la futura estación de metro en el propio Cañaveral.;919382394;Calle Casa de Tilly, 33;325000;2;El Cañaveral, Madrid;Aedas Homes;Profesional;El Cañaveral;Madrid;Vicálvaro;-;3652;89;2;7;Sí;Sí;Sí;Sí;Sí;Sí;No;Sí;No
102103865;Piso en Calle Casa de Tilly, 33;Piso;Descubre Freya, nueva promoción de 131 viviendas en el barrio de El Cañaveral.  Tipologías son de 1, 2, 3 y 4 dormitorios con terraza, áticos y bajos con jardín.  Las viviendas destacan por su sostenibilidad, arquitectura de la promocion y amplias zonas comunes las cuales constan de piscina de adultos e infantil, gimnasio, solarium y zonas ajardinadas.  Desde la ubicación de tu vivienda solo necesitarás 20 minutos para llegar al centro de la capital y podrás desplazarte rápidamente utilizando tanto la R-3 como la M-45. Ambas vías cuentan con un cómodo acceso desde la promoción y te ofrecen conexión con la M-30 en 10 minutos. Además, esta área cuenta con accesos directos mediante transporte público, el cual se verá completado con la futura estación de metro en el propio Cañaveral.;919382394;Calle Casa de Tilly, 33;235000;1;El Cañaveral, Madrid;Aedas Homes;Profesional;El Cañaveral;Madrid;Vicálvaro;-;5465;43;1;4;Sí;Sí;Sí;Sí;Sí;Sí;No;Sí;No
102103908;Piso en Calle Casa de Tilly, 33;Piso;Descubre Freya, nueva promoción de 131 viviendas en el barrio de El Cañaveral.  Tipologías son de 1, 2, 3 y 4 dormitorios con terraza, áticos y bajos con jardín.  Las viviendas destacan por su sostenibilidad, arquitectura de la promocion y amplias zonas comunes las cuales constan de piscina de adultos e infantil, gimnasio, solarium y zonas ajardinadas.  Desde la ubicación de tu vivienda solo necesitarás 20 minutos para llegar al centro de la capital y podrás desplazarte rápidamente utilizando tanto la R-3 como la M-45. Ambas vías cuentan con un cómodo acceso desde la promoción y te ofrecen conexión con la M-30 en 10 minutos. Además, esta área cuenta con accesos directos mediante transporte público, el cual se verá completado con la futura estación de metro en el propio Cañaveral.;919382394;Calle Casa de Tilly, 33;240000;1;El Cañaveral, Madrid;Aedas Homes;Profesional;El Cañaveral;Madrid;Vicálvaro;-;5333;45;1;6;Sí;Sí;Sí;Sí;Sí;Sí;No;Sí;No
99291738;Piso en Calle Alto del Esparragal & Juan Carreño de Miranda s/n;Piso;Terraza de 9,69 m2. Dos plazas de garaje incluidas en el precio. ÚLTIMAS VIVIENDAS. PISOS EN EL CAÑAVERAL DE 2, 3 Y 4 DORMITORIOS CON GARAJE Y TRASTERO INCLUIDO.  Son 40 viviendas de obra nueva, entre pisos, áticos y bajos pisos con terrazas. El Cañaveral, Vicálvaro, está comunicado con el centro de la ciudad a través de la M-45, la prolongación de O’Donell, M-50, R-3 y próxima ampliación de la línea 2 de Metro y su conexión con Metro Este-Coslada.  Calificación energética A, Aerotermia y suelo radiante.  Zonas comunes con piscina con sistema de depuración salina, zona de juegos infantiles, gimnasio y biciparking. Libre Elección de calidades.;919386759;Calle Alto del Esparragal & Juan Carreño de Miranda s/n;384900;3;El Cañaveral, Madrid;Premier España;Profesional;El Cañaveral;Madrid;Vicálvaro;-;3234;119;2;5;Sí;Sí;No;Sí;Sí;Sí;Sí;Sí;No
99703497;Piso en Calle Casa de Tilly, 33;Piso;Descubre Freya, nueva promoción de 131 viviendas en el barrio de El Cañaveral.  Tipologías son de 1, 2, 3 y 4 dormitorios con terraza, áticos y bajos con jardín.  Las viviendas destacan por su sostenibilidad, arquitectura de la promocion y amplias zonas comunes las cuales constan de piscina de adultos e infantil, gimnasio, solarium y zonas ajardinadas.  Desde la ubicación de tu vivienda solo necesitarás 20 minutos para llegar al centro de la capital y podrás desplazarte rápidamente utilizando tanto la R-3 como la M-45. Ambas vías cuentan con un cómodo acceso desde la promoción y te ofrecen conexión con la M-30 en 10 minutos. Además, esta área cuenta con accesos directos mediante transporte público, el cual se verá completado con la futura estación de metro en el propio Cañaveral.;919382394;Calle Casa de Tilly, 33;355000;3;El Cañaveral, Madrid;Aedas Homes;Profesional;El Cañaveral;Madrid;Vicálvaro;-;3318;107;2;1;Sí;Sí;Sí;Sí;Sí;Sí;No;Sí;No
99447180;Piso en Calle Casa de Tilly, 33;Piso;Descubre Freya, nueva promoción de 131 viviendas en el barrio de El Cañaveral.  Tipologías son de 1, 2, 3 y 4 dormitorios con terraza, áticos y bajos con jardín.  Las viviendas destacan por su sostenibilidad, arquitectura de la promocion y amplias zonas comunes las cuales constan de piscina de adultos e infantil, gimnasio, solarium y zonas ajardinadas.  Desde la ubicación de tu vivienda solo necesitarás 20 minutos para llegar al centro de la capital y podrás desplazarte rápidamente utilizando tanto la R-3 como la M-45. Ambas vías cuentan con un cómodo acceso desde la promoción y te ofrecen conexión con la M-30 en 10 minutos. Además, esta área cuenta con accesos directos mediante transporte público, el cual se verá completado con la futura estación de metro en el propio Cañaveral.;919382394;Calle Casa de Tilly, 33;376000;3;El Cañaveral, Madrid;Aedas Homes;Profesional;El Cañaveral;Madrid;Vicálvaro;-;3481;108;2;1;Sí;Sí;Sí;Sí;Sí;Sí;No;Sí;No
102097301;Piso en Calle Casa de Tilly, 33;Piso;Descubre Freya, nueva promoción de 131 viviendas en el barrio de El Cañaveral.  Tipologías son de 1, 2, 3 y 4 dormitorios con terraza, áticos y bajos con jardín.  Las viviendas destacan por su sostenibilidad, arquitectura de la promocion y amplias zonas comunes las cuales constan de piscina de adultos e infantil, gimnasio, solarium y zonas ajardinadas.  Desde la ubicación de tu vivienda solo necesitarás 20 minutos para llegar al centro de la capital y podrás desplazarte rápidamente utilizando tanto la R-3 como la M-45. Ambas vías cuentan con un cómodo acceso desde la promoción y te ofrecen conexión con la M-30 en 10 minutos. Además, esta área cuenta con accesos directos mediante transporte público, el cual se verá completado con la futura estación de metro en el propio Cañaveral.;919382394;Calle Casa de Tilly, 33;358000;2;El Cañaveral, Madrid;Aedas Homes;Profesional;El Cañaveral;Madrid;Vicálvaro;-;3809;94;2;bj;Sí;Sí;Sí;Sí;Sí;Sí;No;Sí;Sí
99447181;Piso en Calle Casa de Tilly, 33;Piso;Descubre Freya, nueva promoción de 131 viviendas en el barrio de El Cañaveral.  Tipologías son de 1, 2, 3 y 4 dormitorios con terraza, áticos y bajos con jardín.  Las viviendas destacan por su sostenibilidad, arquitectura de la promocion y amplias zonas comunes las cuales constan de piscina de adultos e infantil, gimnasio, solarium y zonas ajardinadas.  Desde la ubicación de tu vivienda solo necesitarás 20 minutos para llegar al centro de la capital y podrás desplazarte rápidamente utilizando tanto la R-3 como la M-45. Ambas vías cuentan con un cómodo acceso desde la promoción y te ofrecen conexión con la M-30 en 10 minutos. Además, esta área cuenta con accesos directos mediante transporte público, el cual se verá completado con la futura estación de metro en el propio Cañaveral.;919382394;Calle Casa de Tilly, 33;385000;3;El Cañaveral, Madrid;Aedas Homes;Profesional;El Cañaveral;Madrid;Vicálvaro;-;3565;108;2;3;Sí;Sí;Sí;Sí;Sí;Sí;No;Sí;No
98369337;Piso en Calle Cerro del Campo, 22;Piso;*LICENCIA DE OBRAS CONCEDIDA. Obras Iniciadas. Descubre Elion, nueva promoción de 90 viviendas en el barrio de El Cañaveral. Tipologías son de 2, 3 y 4 dormitorios con terraza, áticos y bajos con jardín. Para que disfrutes del máximo confort en tu nueva casa se colocará suelo radiante-refrescante para la climatización, utilizando la aerotermia como sistema generador de energía. Este novedoso sistema destaca por aportar calor en invierno y frescor en verano de manera uniforme, permitiendo altos ahorros energéticos. Las zonas comunes constan de piscina de adultos e infantil, zonas ajardinadas, pista multideporte y parking comunitario.;919383634;Calle Cerro del Campo, 22;348000;3;El Cañaveral, Madrid;Aedas Homes;Profesional;El Cañaveral;Madrid;Vicálvaro;-;3379;103;2;1;Sí;Sí;Sí;Sí;Sí;Sí;No;Sí;No
98369304;Piso en Calle Cerro del Campo, 22;Piso;*LICENCIA DE OBRAS CONCEDIDA. Obras Iniciadas. Descubre Elion, nueva promoción de 90 viviendas en el barrio de El Cañaveral. Tipologías son de 2, 3 y 4 dormitorios con terraza, áticos y bajos con jardín. Para que disfrutes del máximo confort en tu nueva casa se colocará suelo radiante-refrescante para la climatización, utilizando la aerotermia como sistema generador de energía. Este novedoso sistema destaca por aportar calor en invierno y frescor en verano de manera uniforme, permitiendo altos ahorros energéticos. Las zonas comunes constan de piscina de adultos e infantil, zonas ajardinadas, pista multideporte y parking comunitario.;919383634;Calle Cerro del Campo, 22;365000;3;El Cañaveral, Madrid;Aedas Homes;Profesional;El Cañaveral;Madrid;Vicálvaro;-;3544;103;2;3;Sí;Sí;Sí;Sí;Sí;Sí;No;Sí;No
97891296;Piso en Calle Cerro del Campo, 22;Piso;2 plazas de garaje incluidas en el precio. *LICENCIA DE OBRAS CONCEDIDA. Obras Iniciadas. Descubre Elion, nueva promoción de 90 viviendas en el barrio de El Cañaveral. Tipologías son de 2, 3 y 4 dormitorios con terraza, áticos y bajos con jardín. Para que disfrutes del máximo confort en tu nueva casa se colocará suelo radiante-refrescante para la climatización, utilizando la aerotermia como sistema generador de energía. Este novedoso sistema destaca por aportar calor en invierno y frescor en verano de manera uniforme, permitiendo altos ahorros energéticos. Las zonas comunes constan de piscina de adultos e infantil, zonas ajardinadas, pista multideporte y parking comunitario.;919383634;Calle Cerro del Campo, 22;334000;2;El Cañaveral, Madrid;Aedas Homes;Profesional;El Cañaveral;Madrid;Vicálvaro;-;3753;89;2;5;Sí;Sí;Sí;Sí;Sí;Sí;No;Sí;No
98369305;Piso en Calle Cerro del Campo, 22;Piso;*LICENCIA DE OBRAS CONCEDIDA. Obras Iniciadas. Descubre Elion, nueva promoción de 90 viviendas en el barrio de El Cañaveral. Tipologías son de 2, 3 y 4 dormitorios con terraza, áticos y bajos con jardín. Para que disfrutes del máximo confort en tu nueva casa se colocará suelo radiante-refrescante para la climatización, utilizando la aerotermia como sistema generador de energía. Este novedoso sistema destaca por aportar calor en invierno y frescor en verano de manera uniforme, permitiendo altos ahorros energéticos. Las zonas comunes constan de piscina de adultos e infantil, zonas ajardinadas, pista multideporte y parking comunitario.;919383634;Calle Cerro del Campo, 22;375000;3;El Cañaveral, Madrid;Aedas Homes;Profesional;El Cañaveral;Madrid;Vicálvaro;-;3641;103;2;5;Sí;Sí;Sí;Sí;Sí;Sí;No;Sí;No
102097309;Piso en Calle Casa de Tilly, 33;Piso;Descubre Freya, nueva promoción de 131 viviendas en el barrio de El Cañaveral.  Tipologías son de 1, 2, 3 y 4 dormitorios con terraza, áticos y bajos con jardín.  Las viviendas destacan por su sostenibilidad, arquitectura de la promocion y amplias zonas comunes las cuales constan de piscina de adultos e infantil, gimnasio, solarium y zonas ajardinadas.  Desde la ubicación de tu vivienda solo necesitarás 20 minutos para llegar al centro de la capital y podrás desplazarte rápidamente utilizando tanto la R-3 como la M-45. Ambas vías cuentan con un cómodo acceso desde la promoción y te ofrecen conexión con la M-30 en 10 minutos. Además, esta área cuenta con accesos directos mediante transporte público, el cual se verá completado con la futura estación de metro en el propio Cañaveral.;919382394;Calle Casa de Tilly, 33;348000;2;El Cañaveral, Madrid;Aedas Homes;Profesional;El Cañaveral;Madrid;Vicálvaro;-;3702;94;2;6;Sí;Sí;Sí;Sí;Sí;Sí;No;Sí;No
