101762761;Piso en Anna Frank;Piso;SE VENDE PISO A ESTRENAR EN EL CAÑAVERAL, de 123 m2 construidos, 1 plaza de garaje y trastero, zonas comunes con piscina, jardines, gimnasio y zona infantil.  Compuesto por: Hall, amplio salón con salida directa a la terraza de 6 m2, cocina con salida al tendedero con toma de agua para lavadora-secadora y salida directa a la terraza de 6m2,3 dormitorios, el dormitorio principal con vestidor y baño en suite con bañera, el otro baño con plato de ducha. Suelo de tarima en todas las estancias y gres en baños y cocina. Puertas lacadas en blanco, ventanas climalit.  El inmueble dispone de trastero y plaza de garaje INCLUIDA EN EL PRECIO segunda plaza de garaje opcional. Armarios empotrados y forrados en las habitaciones, calefacción individual de gas natural y preinstalación de aire acondicionado por conductos en todas las estancias, toma de antena en las habitaciones. Cocina amueblada con materiales de primera calidad, encimera de silestone y muebles blancos con tirador gola. Recinto privado con zonas comunes, piscina, jardines, zona infantil, gimnasio y sala de reuniones.  La vivienda está situada en el Barrio del Cañaveral, con multitud de servicios alrededor y bien comunicada por la red de transportes del municipio, parques infantiles, farmacias, restaurantes y supermercados.    No dude en llamarnos para concertar su cita para visitar el inmueble en la que además recibirá el asesoramiento gratuito de nuestro departamento financiero KÌRON. FINANCIACION 100% Teléfono de contacto  -  -.;919388321;ANNA FRANK;359600;3;El Cañaveral, Madrid;ESTUDIOS PLAZA MAYOR -PINILLA S.L ;Profesional;El Cañaveral;Madrid;Vicálvaro;372000;2924;123;2;4;Sí;No;Sí;Sí;Sí;Sí;Sí;Sí;Sí
99143854;Chalet adosado en Calle Cerro del Tesoro, 90;Chalet;¡Licencia de obra concedida! y terreno en propiedad ¡Últimas unidades! Tesoro residencial es una promoción de 7 unifamiliares de renta libre en régimen de cooperativa, urbanización cerrada con jardín privado y zonas comunes con piscina comunitaria de cloración salina. Ubicada en la calle Cerro del Tesoro nº90, muy próxima a la entrada del Cañaveral. Las viviendas de Tesoro residencial se distribuyen en tres plantas más un sótano con dos plazas de garaje con acceso directo a la vivienda. Además, podrás disfrutar de una estupenda terraza en la tercera planta de 14m2, otro lugar para poder disfrutar del aire libre sin salir de casa. En la planta baja encontramos un luminoso salón con salida directa al jardín privado, desde el que se accede a las zonas comunes de la urbanización. También encontramos una amplia y luminosa cocina y un aseo de cortesía. La primera planta cuenta con 3 dormitorios, uno de ellos en suite con vestidor y acceso a una terraza. Además del baño en la habitación principal tiene un segundo baño. La segunda planta consta de un amplio dormitorio con varias posibilidades de uso. Entre sus calidades destacamos aerotermia, suelo radiante y refrescante que se traducirá en una alta calificación energética y una considerable reducción en el gasto de suministros. Para tu tiempo libre, dispone de unas zonas comunes para disfrutar en familia y con amigos, piscina de cloración salina. Ahora más que nunca apreciamos poder tener una terraza, un jardín, espacios al aire libre para poder disfrutar en familia, en Tesoro residencial disfrutaras de terraza, solárium y jardín privado. El Cañaveral es una de las zonas más atractivas de la capital por su tranquilidad, por la calidad de los proyectos residenciales que se están desarrollando y por su buena comunicación por carretera con acceso directo a la M-45, R-3, A-3 y A-2. El Cañaveral tiene proyectado nuevas líneas de buses y metro. Está prevista una amplía dotación de servicios y equipamientos: avenidas y bulevares, carril bici, áreas verdes, guarderías, zonas comerciales, centro de salud, colegios e institutos, zona industrial, zonas de ocio y zonas deportivas. Podrá ver los inmuebles disponibles con el dossier, plano, memoria de calidades y forma de pago. Entrega estimada último trimestre 2024.;919382083;Calle Cerro del Tesoro, 90;565700;4;El Cañaveral, Madrid;My dream My home;Profesional;El Cañaveral;Madrid;Vicálvaro;-;3009;188;3;-;No;Sí;Sí;Sí;Sí;Sí;No;No;Sí
99143891;Casa independiente en Calle Cerro del Tesoro, 90;Chalet;¡Licencia de obra concedida! ¡Próximo inicio de obra!  Tesoro residencial es una promoción de 7 unifamiliares de renta libre en régimen de cooperativa, urbanización cerrada con jardín privado y zonas comunes con piscina comunitaria de cloración salina. Ubicada en la calle Cerro del Tesoro nº90, muy próxima a la entrada del Cañaveral. Las viviendas de Tesoro residencial se distribuyen en tres plantas más un sótano con dos plazas de garaje con acceso directo a la vivienda. Además, podrás disfrutar de una estupenda terraza en la tercera planta de 14m2, otro lugar para poder disfrutar del aire libre sin salir de casa.    En la planta baja encontramos un luminoso salón con salida directa al jardín privado, desde el que se accede a las zonas comunes de la urbanización. También encontramos una amplia y luminosa cocina y un aseo de cortesía.    La primera planta cuenta con 3 dormitorios, uno de ellos en suite con vestidor y acceso a una terraza. Además del baño en la habitación principal tiene un segundo baño.  La tercera planta consta de una sala con muchas posibilidades de uso. Entre sus calidades destacamos aerotermia, suelo radiante y refrescante que se traducirá en una alta calificación energética y una considerable reducción en el gasto de suministros.    Para tu tiempo libre, dispone de unas zonas comunes para disfrutar en familia y con amigos, piscina de cloración salina.    Ahora más que nunca apreciamos poder tener una terraza, un jardín, espacios al aire libre para poder disfrutar en familia, en Tesoro residencial disfrutaras de terraza, solárium y jardín privado.    El Cañaveral es una de las zonas más atractivas de la capital por su tranquilidad, por la calidad de los proyectos residenciales que se están desarrollando y por su buena comunicación por carretera con acceso directo a la M-45, R-3, A-3 y A-2. El Cañaveral tiene proyectado nuevas líneas de buses y metro.    Está prevista una amplía dotación de servicios y equipamientos: avenidas y bulevares, carril bici, áreas verdes, guarderías, zonas comerciales, centro de salud, colegios e institutos, zona industrial, zonas de ocio y zonas deportivas.    Podrá ver los inmuebles disponibles con el dossier, plano, memoria de calidades y forma de pago en:    Entrega estimada último trimestre 2024.;919382083;Calle Cerro del Tesoro, 90;544700;4;El Cañaveral, Madrid;My dream My home;Profesional;El Cañaveral;Madrid;Vicálvaro;-;2913;187;3;-;No;Sí;Sí;Sí;Sí;Sí;No;No;Sí
100892606;Chalet pareado en Calle Paraíso, 2;Chalet;5 UNICAS VIVIENDAS EN CALLE PARAISO – VICALVARO - LICENCIA OBTENIDA- COMIENZO DE OBRAS ENERO 2022! ULTIMA VIVIENDA DISPONIBLE. Nueva promoción compuesta por 5 viviendas unifamiliares LIBRES en Vicálvaro (Madrid), en régimen de Cooperativa, pensadas para una demanda mayoritaria de familias que desean mejorar en tamaño, espacio e independencia. Viviendas de 4 dormitorios en parcelas de 250 m², garaje para dos coches. Se ubica en la Calle Paraiso nº2 a 5 minutos a pie de la Estación del Metro de Vicálvaro. Con todas las ventajas de una zona residencial ya consolidada, con importantes dotaciones muy próximas, como los supermercados MERCADONA Y AHORRA MÁS, el Centro Comercial Vicálvaro, el Colegio público VALDEBERNARDO, El Colegio Concertado EL VALLE, Centro de Salud, La Universidad Juan Carlos I, el Parque forestal de Valdebernardo, El recinto Zoológico Faunia, Campos deportivos municipales, etc, . Las viviendas cuentan con un diseño moderno y funcional, todas disponen de un dormitorio en la planta baja. Además cuentan con la posibilidad de tener sotano, piscina privada independiente y elección de varios paquetes de Mejoras. La promoción se desarrollará en régimen de cooperativa (Villas del Paraiso, Sociedad Coop. Mad. ).;919380479;Calle Paraíso, 2;717155;4;Casco Histórico de Vicálvaro, Madrid;FV GESTION;Profesional;Casco Histórico de Vicálvaro;Madrid;Vicálvaro;-;2915;246;3;-;No;Sí;No;Sí;No;No;No;No;Sí
102128171;Piso en Calle Padre Gregorio Céspedes, 30;Piso;Si buscas una vivienda a estrenar, recién construida (mayo 2023) de un dormitorio, un cuarto de baño, trastero, plaza de aparcamiento, piscina, etc. sin duda esta es tu casa. Urbantec Realty te ofrece una vivienda en un edifico también de reciente construcción (mayo 2023) a estrenar.  La vivienda dispone de una fantástica luz natural gracias a su fantásticos ventanales y a una terraza lo suficientemente grande para incorporar en la misma una pequeña mesa de comedor o zona de descanso.  El salón comedor, es amplio y dispone de acceso a la terraza, al igual que el dormitorio. La cocina, con todas las instalaciones realizadas no está incluida en la vivienda, al tratarse de una promoción de obra nueva, los propietarios deciden que muebles o tipo de cocina quieren instalar.  El dormitorio, exterior, dispone de una zona de armarios empotrados. La vivienda tiene presinstalación del Aire Acondicionado y dispone de Calefacción individual por suelo radiante. La urbanización también alberga una Piscina, salón comunitario, etc. El precio incluye trastero y plaza de garaje para cualquier tipo de coche. La ubicación de la vivienda es inmejorable, ya que esta se sitúa en el Cañaveral, barrio nuevo en su totalidad. El acceso es inmejorable al disponer de la R-3, M-45 o M-50 a escasos minutos de la zona. No lo dudes y vente a disfrutar de tu nueva casa en un barrio de nueva construcción en la ciudad de Madrid. Nota: La vivienda según catastro dispone de 105 m2 son construidos que incluyen la terraza, zonas comunes (34 m2), trastero (6m2) y la plaza de garaje (12 m2). La vivienda dispone de unos 53 m2 construidos según catastro.;919380448;Calle Padre Gregorio Céspedes, 30;195000;1;El Cañaveral, Madrid;Urbantec Realty;Profesional;El Cañaveral;Madrid;Vicálvaro;-;3679;53;1;8;Sí;No;Sí;Sí;Sí;Sí;Sí;Sí;Sí
102042049;Piso en Calle de Villajimena;Piso;EASY HOME vende vivienda exterior, en 5ª planta, con ascensor y garaje.  La vivienda se distribuye en Salón amplio, 3 habitaciones, 1 baño completo y cocina individual.  Tiene 3 terrazas incorporadas a la vivienda, una en la cocina, otra en el salón y otra en una habitación. Consta de 2 aires acondicionados, orientación oeste y ventanas de aluminio en todos los ambientes. La ubicación es inmejorable, estaciones de metro cercanas como Vicálvaro y San Cipriano, con varias líneas de autobuses cercanas. Rodeado de todo tipo de comercios, teatros, cine, bares, supermercados, farmacias, Polideportivo municipal, además cuenta con zonas verdes como el parque de la Vicalvarada. No dude en llamarnos para concertar una visita, también le atendemos personalmente en nuestra oficina de la plaza de San Vicente de Paul Nº4 en Madrid, donde será un placer recibirle y resolver cualquier consulta que nos quiera hacer...;919383025;Calle de Villajimena;168000;3;Ambroz, Madrid;EASY HOME Servicios Inmobiliarios;Profesional;Ambroz;Madrid;Vicálvaro;-;2366;71;1;5;Sí;No;No;Sí;Sí;Sí;Sí;No;No
98908907;Piso en Calle Molino Viejo, 14;Piso;OPORTUNIDAD - Reviale te trae en exclusividad este precioso piso exterior de 2 habitaciones, 2 baños, salón comedor, cocina con tendedero, trastero y garaje incluido en el precio. Su superficie es de 75 m2 (98 m2 construidos) y se encuentra en una DE LAS MEJORES URBANIZACIONES DE LA ZONA y con vistas al parque forestal de valdebernardo Es un cuarto piso con ascensor muy luminoso y con una superficie útil es de 75 m2, se distribuye en un amplio salón, dos dormitorios, dos cuartos de baño completos (uno de ellos en suite) cocina amueblada y equipada con electrodomésticos y zona de lavadero y tendedero. Además dispone de un trastero y una amplia plaza de garaje. Si buscas un piso luminoso, este es tu piso, con ventanas tanto al este como al oeste y con sol de mañana y de tarde. Al ser una planta intermedia y tener doble acristalamiento hace que sea una vivienda poco calurosa en verano y el uso de calefacción en invierno sea mínimo. Las calidades del piso son las siguientes:  - Armarios empotrados en toda la casa  - Calefacción individual de gas natural.  - Toldos con cofre  - Aire acondicionado por split en salón.  - Doble ventana de climalit y mosquitera en todas las estancias  - Puertas de madera y parquet salvo en baños y cocina.  - Vigilancia 24 horas. La urbanización es muy tranquila y familiar, con amplias zonas verdes donde tomar el sol o leer en verano con piscina de adultos e infantil, pista multiusos, área de juegos infantiles.  Si te gusta salir a pasear, montar en bici o hacer deporte, el parque forestal de Valdebernardo se encuentra en la misma calle al igual que Faunia que lo tienes a 5 minutos andando. Tienes todos los servicios a tu alcance, tanto supermercados, colegios, institutos, como el centro de salud están al lado. Las paradas de bus que hay son: E3, 71, 100, T23, E5, 4. A 10 minutos de la estación de RENFE Vicálvaro y Línea 9 de Metro Puerta de Arganda. El acceso a la M-40, M-30, A-2 y A3 es rápido.;919384039;Calle Molino Viejo, 14;274000;2;Valdebernardo - Valderrivas, Madrid;Reviale;Profesional;Valdebernardo - Valderrivas;Madrid;Vicálvaro;-;2796;98;2;4;Sí;No;Sí;No;Sí;Sí;Sí;Sí;Sí
100909774;Piso en Calle de Omega;Piso;"Globalpiso vende vivienda de RENTA LIBRE, en Valderrivas. Excelente ubicación, junto a la estación de metro Puerta de Arganda. El inmueble cuenta con 122 m2, distribuidos en, recibidor, amplio salón independiente de 26m2 con mirador, 2 baños de gran tamaño, principal con plato de ducha, 4 dormitorios, todos con armarios empotrados, amplia cocina con tendedero cubierto, suelos de parquet, dobles ventanas, calefacción gas por natural y preinstalación de aire acondicionado por conductos. La vivienda es totalmente exterior y cuenta con aislante térmico en todas las habitaciones y salón.  Urbanización cerrada con servicio de vigilancia las 24 horas, piscina, pista de pádel, parque infantil, gimnasio, sauna y zonas verdes. Plaza de garaje y trastero. Situado junto a la estación de metro L9  Puerta de Arganda"", parada de autobuses varias líneas, colegio publico Bilingüe"" Carmen Laforet"". Gastos de comunidad 180 €. Vicálvaro- Valderrivas, situado al sureste de la Comunidad de Madrid, cuenta con una red de transportes única donde llega el Cercanías, Metro (línea 9) y diversos autobuses como linea 4, 30, E2, Servicio Nocturno N7, 287 Coslada, Vicálvaro, Plaza de Alsacia, además de estar ampliamente comunicado con la m40, A2 y la A3. Farmacias, cafeterías, mercados, tiendas de todo tipo, supermercados y lugares de estudio, como la Universidad de Ciencias Jurídicas y Sociales, crean la imagen de un Vicálvaro lleno de vida y ocio para todos los que buscan pisos de alquiler en Vicálvaro o comprar piso en Vicálvaro y establecer su vida en esta maravillosa zona. No lo dudes, pasa por nuestra inmobiliaria en Vicálvaro y te asesoraremos sin compromiso en todo aquello que necesites. Para poder ver todos nuestros inmuebles puede visitar nuestra página web y puede descargarse nuestra APP Globalpiso totalmente gratuita. Ofrecemos posible financiación del 100% con Grocasa Hipotecas y valoramos su inmueble gratuitamente. "" Gastos de gestión, no incluidos.""";910429760;Calle de Omega;358000;4;Valdebernardo - Valderrivas, Madrid;globalpiso San Blas;Profesional;Valdebernardo - Valderrivas;Madrid;Vicálvaro;-;2934;122;2;1;Sí;No;Sí;No;Sí;Sí;Sí;Sí;Sí
101773285;Piso en Avenida Real;Piso;Altor Asesores pone a la venta este dúplex de 110m2 útiles y 144 m2 construidos en la zona más demandada e histórica de Vicálvaro. Vivienda silenciosa y tranquila que dispone de excelente patio exclusivo de la finca para que jueguen los niños sin salir a la calle. Dispone de 3 habitaciones y un trastero abuhardillado que bien podría ser otra habitación. Un baño completo en suite y otro en pasillo, cocina amueblada y equipada con todos los electrodomésticos y un luminoso salón con aire acondicionado. Suelos de parquet, despensa y armarios empotrados. La casa es del 2006 y esta rodeada de colegios, comercios y parques, a 3m de la Universidad Rey Juan Carlos. Incluye también plaza de garaje.;919383295;Avenida Real;299000;3;Casco Histórico de Vicálvaro, Madrid;Altor Asesores;Profesional;Casco Histórico de Vicálvaro;Madrid;Vicálvaro;-;2623;114;3;3;No;No;No;No;Sí;Sí;Sí;Sí;No
100127869;Piso en Mercurio;Piso;ALTOR ASESORES pone a su disposición esta vivienda en Vicálvaro.  Este piso de 4 dormitorios, 2 baños, en primera planta exterior. La vivienda se encuentra se encuentra ubicada muy cerca de la Universidad Rey Juan Carlos, muy importante a nivel de inversión por el tema de estudiantes. Vicálvaro es uno de los distritos de Madrid mejor comunicado por carretera y transporte público. Situada muy cerca de las paradas METRO (metro Vicálvaro y San Cipriano LÍNEA 9) y frente a parada de AUTOBUSES 4 – 106 – E3 – N7. Comunicaciones por carretera: · M-40: salida 12: carretera de Vicálvaro. Salida 14: avenida del Doctor García Tapia – Vicálvaro. · A-3: salida 7: Vicálvaro – Valdebernardo. · M-45: salida 20 ABC: Vallecas – Mejorada del Campo – Vicálvaro. · M-203: carretera de Madrid a Mejorada del Campo y Alcalá de Henares. · R-3: salida 1: San Blas – Vicálvaro. · M-23- Prolongación de O’Donnell: salida Vicálvaro. · Carretera de Vicálvaro a la Estación de O’Donnell: comunica Vicálvaro con la carretera M-201, el oeste de Coslada y el barrio de Rejas (San Blas-Canillejas). Situada entre el parque forestal de Valdebernardo y el parque forestal de Vicálvaro para que puedas tener naturaleza al lado de tu casa. Una nueva oportunidad de vivir en Vicálvaro, una zona joven, llena de servicios y de comercios, tanto de ocio, como de primera necesidad, así como Farmacias, Colegios públicos y privados, Restaurantes, Supermercados y un largo etc.. . de todo tipo de servicios. ¡ NO DUDE EN VENIR A VERLA, PUEDE SER LA VIVIENDA QUE ESTA BUSCANDO!;919383295;MERCURIO;260000;4;Casco Histórico de Vicálvaro, Madrid;Altor Asesores;Profesional;Casco Histórico de Vicálvaro;Madrid;Vicálvaro;-;2364;110;2;1;Sí;No;No;Sí;No;No;No;No;No
100352663;Chalet pareado en Camino Viejo de Vicálvaro;Chalet;CREDIT HOUSE VENDE Exclusivo Chalet en la mejor zona residencial de Vicálvaro, por su ubicación está bien comunicado con importantes arterias viales, tales como, C/ Casalarreina, C/ San Cipriano, Avenida de Daroca, acceso A2, M40. Cerca Universidad Rey Juan Carlos, Colegios,  Supermercados y variedad de comercios. Autobuses EMT 4-100-106-130-N7-E3-E5, línea de metro 9  (morada), estación Vicálvaro. El inmueble tiene las siguientes características generales, 328M2 de superficie construida aproximadamente, forma parte de una serie de 6 edificaciones del 2001, hace esquina por lo tanto contiene más terreno en el patio y en un lateral. Tiene Aire acondicionado integral con bomba frío-calor. Paredes Lisas, suelos en la planta principal de cerámica, en la primera planta hay tarima. Tiene PLACAS SOLARES DE ULTIMA TECNOLOGIA, lo que ocasiona una reducción considerable en el pago del servicio eléctrico y un consumo responsable ya que no genera emisiones contaminantes. La ITE favorable. Características específicas, posee tres plantas, zona de jardín. Consta de, hall de entrada, un despacho, tres dormitorios, tres baños completos, cocina, salón-comedor con chimenea y acceso a terraza, área de piscina-barbacoa, además en este espacio posee Jacuzzi. Garaje techado con capacidad para tres plazas. El Chalet consta de dos estancias que se pueden destinar según uso, recreación o esparcimiento, hablamos de amplia buhardilla y habitación de juegos en nivel de la zona de aparcamiento. Posee buenas calidades, grandes ventanas, puertas de madera, techos altos, las estancias son espaciosas con lo cual hay luminosidad.  Estamos a vuestra disposición para concertar una visita en el 917608512-622239057-623474896. Contamos con la mayor financiación garantizada.;919384554;Camino Viejo de Vicálvaro;759000;4;Ambroz, Madrid;CREDIT HOUSE;Profesional;Ambroz;Madrid;Vicálvaro;-;2314;328;3;-;No;No;Sí;Sí;Sí;Sí;Sí;Sí;Sí
100138619;Piso en Calle Cerro del Campo, 31;Piso;LAS TERRAZAS DEL CAÑAVERAL es un exclusivo residencial de viviendas creado desde el máximo aprovechamiento del espacio dando un estupendo confort y calidad de vida. En esta nueva urbanización dispondrás de zona ajardinada y piscina comunitaria además de unos acabados de gran material. Todas las viviendas cuentan con terraza, estancias que cuidan hasta el mas mínimo detalle y diversas ventajas como la climatización por aerotermia con suelo radiante-refrescante que te permitirá una mayor eficiencia y ahorro en el consumo energético. Ubicado en uno de los barrios con mayor desarrollo de la capital, con numerosas conexiones (M-45, M-50, R-3…) además de todos los servicios necesarios para un gran nivel de vida. NO LO DUDES MAS y solicita información para elegir la que será, sin ningún tipo de dudas, TU MEJOR INVERSIÓN DE FUTURO.;919380228;Calle Cerro del Campo, 31;245000;2;El Cañaveral, Madrid;Doppio;Profesional;El Cañaveral;Madrid;Vicálvaro;-;2917;84;2;6;Sí;Sí;Sí;Sí;No;No;No;No;No
100138574;Ático en Calle Cerro del Campo, 31;Ático;LAS TERRAZAS DEL CAÑAVERAL es un exclusivo residencial de viviendas creado desde el máximo aprovechamiento del espacio dando un estupendo confort y calidad de vida. En esta nueva urbanización dispondrás de zona ajardinada y piscina comunitaria además de unos acabados de gran material. Todas las viviendas cuentan con terraza, estancias que cuidan hasta el mas mínimo detalle y diversas ventajas como la climatización por aerotermia con suelo radiante-refrescante que te permitirá una mayor eficiencia y ahorro en el consumo energético. Ubicado en uno de los barrios con mayor desarrollo de la capital, con numerosas conexiones (M-45, M-50, R-3…) además de todos los servicios necesarios para un gran nivel de vida. NO LO DUDES MAS y solicita información para elegir la que será, sin ningún tipo de dudas, TU MEJOR INVERSIÓN DE FUTURO.;919380228;Calle Cerro del Campo, 31;315000;2;El Cañaveral, Madrid;Doppio;Profesional;El Cañaveral;Madrid;Vicálvaro;-;2625;120;2;-;Sí;Sí;Sí;Sí;No;No;No;No;No
93711733;Piso en Calle de Minerva;Piso;"ALCARREÑA DE GESTION presenta en VENTA piso en excelentes condiciones en una de las mejores zonas residenciales de Vicálvaro. La vivienda, cuenta con hall de entrada, salón comedor, cocina independiente, tres dormitorios, dos baños completos, uno de ellos en suite, plaza de garaje y un trastero. La vivienda, tiene buena orientación, luminosa, puerta de acceso blindada, suelos de tarima en toda la vivienda siendo de gres en cocina y baños, calefacción individual por gas natural, carpintería interior en madera roble con rodapié a juego, carpintería exterior en aluminio marron con doble cierre y acristalamiento tipo climalit.  Los cuartos de baños completos, uno de ellos incorporado al dormitorio principal tipo suite con bañera y el otro con plato de ducha, armarios empotrados en todos los dormitorios, la cocina amueblada y equipada con terraza tendedero.  Tanto la plaza de garaje como el trastero, cuentan con acceso directo desde el ascensor. El edificio, en un recinto cerrado y en urbanización privada, cuenta con conserje y video-vigilancia 24 horas, ascensor, zonas ajardinadas y con piscina comunitaria y cancha de baloncesto. Su ubicación permite rápido acceso a la M-40, M-30, A-2 y A-3, además de cercanía a medios de transporte como autobuses (E3, nocturno) metro Puerta de Arganda y Cercanías. Destacar su proximidad a colegios, parques, comercios y zonas de ocio. Parque forestal de Valdebernardo a 5 minutos andando y a diez minutos de faunia.""";949727273;Calle de Minerva;355000;3;Valdebernardo - Valderrivas, Madrid;Alcarreña de gestión;Profesional;Valdebernardo - Valderrivas;Madrid;Vicálvaro;-;3737;95;2;3;Sí;No;Sí;No;Sí;Sí;Sí;Sí;No
100138608;Piso en Calle Cerro del Campo, 31;Piso;LAS TERRAZAS DEL CAÑAVERAL es un exclusivo residencial de viviendas creado desde el máximo aprovechamiento del espacio dando un estupendo confort y calidad de vida. En esta nueva urbanización dispondrás de zona ajardinada y piscina comunitaria además de unos acabados de gran material. Todas las viviendas cuentan con terraza, estancias que cuidan hasta el mas mínimo detalle y diversas ventajas como la climatización por aerotermia con suelo radiante-refrescante que te permitirá una mayor eficiencia y ahorro en el consumo energético. Ubicado en uno de los barrios con mayor desarrollo de la capital, con numerosas conexiones (M-45, M-50, R-3…) además de todos los servicios necesarios para un gran nivel de vida. NO LO DUDES MAS y solicita información para elegir la que será, sin ningún tipo de dudas, TU MEJOR INVERSIÓN DE FUTURO.;919380228;Calle Cerro del Campo, 31;285000;2;El Cañaveral, Madrid;Doppio;Profesional;El Cañaveral;Madrid;Vicálvaro;-;1566;182;2;bj;Sí;Sí;Sí;Sí;No;No;No;No;No
