101290822;Dúplex;Duplex;"Inmobiliaria Milenium ofrece en exclusiva bonito loft reformado y totalmente amueblado con cocina equipada. En la planta baja dispone de recibidor, amplia cocina americana de buena calidad, gran salón comedor con grandes ventanales, aseo y trastero aprovechando el hueco de la escalera. En la primera planta tenemos zona de descanso/dormitorio con vestidor, zona multifuncional y baño con plato de ducha. PLAZA DE GARAJE INCLUIDA! La urbanización está videovigilada y tiene conserje de lunes a sábados. No dudes contactar con nosotros para concertar una visita o preguntar cualquier duda. Consulta la posibilidad de financiación de hasta el 100% con nuestro departamento financiero MHCredit. 3% + IVA de gestión inmobiliaria a cargo del comprador. *Oferta no vinculante, puede contener errores de publicación*.";918250205;Valdelacasa;223000;0;Valdelacasa, Alcobendas;Grupo Inmobiliario MILENIUM;Profesional;-;Alcobendas;Valdelacasa;-;2276;98;2;3;Sí;No;No;No;Sí;Sí;Sí;No;No
102225943;Piso en Avenida de España, 18;Piso;"Piso exterior en Alcobendas en tercera planta con ascensor. Muy luminoso en urbanización rodeada de jardines. Consta de amplio hall de entrada, salón independiente de gran tamaño con acceso a terraza, 4 dormitorios, cocina con terraza tendedero incorporada lo que le da una amplitud muy grande a la misma, 1 baño con ducha muy grande adaptada con plato antideslizante de máxima calidad y otra terraza con acceso desde el dormitorio principal. Tiene parqué en toda la casa, calefacción individual y 2 aparatos de aire acondicionado en salón y dormir torio principal. ABSTENERSE AGENCIAS.";-;Avenida de España, 18;280000;4;Alcobendas Centro, Alcobendas;Charo;Particular;-;Alcobendas;Alcobendas Centro;-;2772;101;1;3;Sí;No;No;Sí;No;No;Sí;No;No
101962534;Piso en Calle de Palencia;Piso;"Agora Gestores Inmobiliarios pone a su disposición este fantástico piso exterior, en de las zonas más cotizadas de Alcobendas. El inmueble consta de 120 metros cuadrados, con amplia cocina amueblada y equipada, salón con terraza, tres dormitorios con armorios empotrados, dos baño un de ellos en habitacion principal. Plaza de garaje grande incluidas. La vivienda dispone de ventanas aluminio, suelo de gres, calefacción individual de gas natural y aire acondicionado en el salón y dormitorios. Edificio de tres alturas, una vivienda en cada planta, este situado en una primera planta exterior. Cuenta con todos los servicios próximos al inmueble, tanto de comercio, hospitales, colegios, hostelería y ocio, sin necesidad de grandes desplazamientos. Está muy próximo a las paradas de metro y cercada también a la parada de diferentes líneas de bus. No se lo piense llámenos y le informamos de lo que necesite, además le ayudamos con la financiación de manera totalmente gratuita. ESTAMOS A SU DISPOSICIÓN. AGORA GESTORES INMOBILIARIOS CREANDO HOGARES TU ÉXITO NUESTRA META Encuentra más en.";919385528;Calle de Palencia;330000;3;Ensanche, Alcobendas;Ágora Gestores Inmobiliarios;Profesional;-;Alcobendas;Ensanche;-;2640;125;2;1;Sí;No;No;Sí;No;No;No;No;No
101528358;Piso;Piso;"¡Piso de 2 dormitorios en el corazón de Alcobendas! No pierdas la oportunidad de vivir o invertir en el centro de Alcobendas, en una zona muy bien comunicada, cuentas con todos los servicios que puedas necesitar al alcance de la mano y sin necesidad de coger le coche, supermercados, bancos, restaurantes, CEIP Profesor Tierno Galván, el Centro de Arte de Alcobendas al lado y el Auditorio Paco de Lucía. Además, está muy bien comunicado con salida al bulevar de Salvador Allende. ¡Ideal tanto para vivir o para invertir! Consta de salón muy luminoso, cocina amueblada y totalmente equipada, 2 dormitorios con multitud de posibilidades y 1 baño completo. Además, cuenta con armarios empotrados en los dos dormitorios y en el pasillo, con toma de gas en la ventana. Cuenta con solárium para disfrute de los vecinos y en el precio se incluye un trastero.  ¡No lo dudes más y llámanos!";919386793;Alcobendas Centro;175000;2;Alcobendas Centro, Alcobendas;Alser Asesores;Profesional;-;Alcobendas;Alcobendas Centro;-;2966;59;1;-;No;No;No;No;No;No;No;Sí;No
101811082;Piso en isabel rosillo s/n;Piso;"-TECNOCASA ALCOBENDAS- Oficina Tecnocasa -TECNOCASA VENDE- El inmueble se distribuye en hall de entrada, salón distribuidor, cocina, tres dormitorios y baño completo y terraza. El inmueble se encuentra en buen estado y goza de muchísima luz. Entres sus calidades encontramos: suelos en gres, carpintería interior en cerezo, carpintería exterior en aluminio. Situado en una zona rodeada de comercios, centro de salud, colegio, institutos y con todas los servicios y comercios en la zona. Te asesoramos de manera gratuita para conseguir tu hipoteca. Consúltanos sin compromiso.";919380068;isabel rosillo s/n;146000;3;Alcobendas Centro, Alcobendas;Tecnocasa Inmobiliario Alcobendas;Profesional;-;Alcobendas;Alcobendas Centro;-;2355;62;1;4;No;No;No;Sí;No;No;No;No;No
102141223;Piso;Piso;"SIN COMISIÓN DE AGENCIA. VENTA DIRECTA DE LA PROPIEDAD. Piso en Alcobendas, Madrid, perfecto para familias. La vivienda consta de 62 m² construidos distribuidos en tres habitaciones, salón-comedor, cocina y un aseo. Segunda planta sin ascensor. Localizado en el centro de Alcobendas, en sus alrededores encontramos la Escuela Infantil Chiquitín Alcobendas, supermercados, bancos, bibliotecas, farmacias, oficinas de correos, centros deportivos, varias paradas de autobús, la estación de metro Marqués de la Valdavia y la estación de tren Alcob. sseb.";919380292;Alcobendas Centro;168000;3;Alcobendas Centro, Alcobendas;Kasactiva Soluciones Inmobiliarias;Profesional;-;Alcobendas;Alcobendas Centro;-;2897;58;1;bj;No;No;No;Sí;No;No;No;No;No
101188868;Chalet pareado en valladolid, 17;Chalet;"- Oficina Tecnocasa -TECNOCASA VENDE- Vivienda para REFORMAR en calle Valladolid, luminosa de 3 dormitorios. Con muchas posibilidades de reformarla y distribuir para hacerla tu vivienda ideal Sin gastos de Comunidad.   NO DUDES EN VISITARLO ¿Necesitas hipoteca? , ¿No tienes nada mirado? , te hacemos un estudio de viabilidad totalmente gratuito con Kiron expertos en hipotecas Para mas información no dude en ponerse en contacto con nosotros y visítelo sin ningún compromiso. llamadas y whatssap.";919380068;valladolid, 17;156000;3;Alcobendas Centro, Alcobendas;Tecnocasa Inmobiliario Alcobendas;Profesional;-;Alcobendas;Alcobendas Centro;-;2943;53;1;-;No;No;No;No;No;No;No;No;No
102115368;Piso en ceuta s/n;Piso;"-TECNOCASA ALCOBENDAS- Oficina Tecnocasa -TECNOCASA VENDE- El inmueble se distribuye en hall de entrada, salón distribuidor con amplia terraza, cocina grande, dos dormitorios (antes 3), baño con plato de ducha y terraza. El inmueble se encuentra con la obra de reforma integral casi terminada y goza de muchísima luz al ser orientación sur oeste Entre sus calidades encontramos: Paredes lisas aisladas, ventanas de PVC climalit oscilobatientes, tuberías de la vivienda, calefacción y electricidad cambiadas, electricidad nueva con iluminación de bajo consumo, entrada de antena en todos los dormitorios, cocina alicatada con suelo de gres porcelánico, baño alicatado con planto de ducha instalado y extractor, puertas en baño y cocina correderas. Situado en una zona rodeada de comercios, centro de salud, colegio, institutos y con todas los servicios y comercios en la zona. Te asesoramos de manera gratuita para conseguir tu hipoteca. Consúltanos sin compromiso.";919380068;ceuta s/n;185000;2;Alcobendas Centro, Alcobendas;Tecnocasa Inmobiliario Alcobendas;Profesional;-;Alcobendas;Alcobendas Centro;-;2803;66;1;1;No;No;No;Sí;No;No;No;No;No
100778860;Dúplex;Duplex;"***DS REALTORS VENDE SIN COMISIONES PARA EL COMPRADOR*** Estupendo LOFT-Dúplex en Alcobendas, EDIFICIO NEOGREEN frente SOTO DE LA MORALEJA. CARACTERÍSTICAS Ubicado en tercera (3ª) y última planta muy luminoso con vistas despejadas, tiene una superficie de 52 m2 construidos aproximados con elementos comunes, está distribuido de la siguiente manera: En planta inferior (3ª) salón comedor - cocina open-space de 32 m2 aproximadamente. En Planta superior (4ª) baño y estancia para dormitorio/despacho de 15 m2 aprox. Todo el LOFT se encuenta bañado por una luminosidad estupenda debido a su orientación Sur y techos muy altos. El LOFT se encuentra en buen estado de conservación para disfrutar y también como despacho profesional dispone de calefacción y aire acondicionado por conductos. Además se incluye en el precio una amplia plaza de garaje en el mismo edificio con acceso directo a través del ascensor. El LOFT es ideal para profesionales liberales que quieran disponer un activo versátil y para inversores ya que ofrece una RENTABILIDAD ALTÍSIMA debido a su liquidez en alquiler. CARACTERÍSTICAS DEL EDIFICIO Ubicado en el Edificio NEGOREEN construído en 2007 con excelentes calidades, accesibilidad total, parking en superficie para visitas, Conseje, Vigilancia, Ascensor, Zonas Verdes. UBICACIÓN La localización es inmejorable con una conectividad espectacular debido a su cercanía con el Soto De la Moraleja, Acceso directo a la A1, Metro La Granja, a escasos 15 minutos del centro de la capital y muy próximo al Aeropuerto. Rodeado de todo tipo de servicios como son Centros Comerciales, Colegios, Escuelas Infantiles, Hoteles...";919381894;Valdelacasa;164000;1;Valdelacasa, Alcobendas;DS Realtors;Profesional;-;Alcobendas;Valdelacasa;-;3154;52;1;3;Sí;No;No;No;Sí;Sí;Sí;No;No
99129507;Chalet pareado;Chalet;"Maravillosa y luminosas casa de dos plantas, con muchas posibilidades, entre ellas la de construir un piso con patio en la plata baja. Actualmente está distribuida de la siguiente forma: En planta baja se encuentra un local comercial, con licencia de bar en pleno funcionamiento, equipado y listo para trabajar. En la segunda palabra con entrada independiente está la zona de vivienda totalmente reformada, se compone de hall de entrada muy amplia, dos dormitorios dobles, cuarto de baño, cocina grande con salida a una terraza de 38m2 donde se puedo construir una tercera habitación. Esta casa es ideal para inversor o familia que quiera tener una casa unifamiliar o dos pisos. No dude en solicitar una vista, nos encargamos de la financiación.";919381419;Alcobendas Centro;395000;2;Alcobendas Centro, Alcobendas;Bersan Servicios Inmobiliarios;Profesional;-;Alcobendas;Alcobendas Centro;400000;1732;228;1;-;No;No;No;No;No;No;No;No;No
102289031;Piso en Avenida de España, 34;Piso;"BROKER INMOBILIARIO promociona mágnifica vivienda ubicada en AVENIDA DE ESPAÑA. La vivienda se sitúa en una avenida muy amplia, con rampa para personas con movilidad reducida y un ascensor. El inmueble consta de TRES HABITACIONES amplias con MUCHA ILUMINACIÓN, un BAÑO REFORMADO al completo con plato de ducha, una COCINA REFORMADA con gran amplitud y buena iluminación. Y por último un salón de grandes proporciones con acceso a una terraza con vistas a la avenida. La vivienda cuenta con un recibidor y la posibilidad de un estudio para implementar un aseo. Además la vivienda cuenta con un trastero de grandes dimensiones situado en la parte baja del edificio. La vivienda cuenta con múltiples posibilidades en caso de desear una reforma por su gran superficie y distribución. No dudes en llamar para informarte o concertar una visita con nosotros! Contamos con servicio de asesoramiento financiero, asesoramiento inmobiliario y un amplio abanico de opciones.";681939431;Avenida de España, 34;255000;3;Alcobendas Centro, Alcobendas;Cesar;Particular;-;Alcobendas;Alcobendas Centro;-;2833;90;1;2;Sí;No;No;Sí;No;No;No;Sí;No
102194269;Piso en capitan francisco sanchez, 29;Piso;"Oferta sujeta a posible proceso competitivo o a proceso ordenado de venta. Este inmueble está incluido en un posible proceso competitivo. El precio indicado es el precio de salida. GARSIERRA. Vivienda distribuida en 3 habitaciones, 1 baño, salón-comedor y cocina. Situada frente al centro de salud y equipamientos deportivos municipales, zonas verdes y centros educativos. Bien comunicado por transporte público y carretera.";919388504;capitan francisco sanchez, 29;134000;3;Alcobendas Centro, Alcobendas;Garsierra;Profesional;-;Alcobendas;Alcobendas Centro;-;1540;87;1;4;No;No;No;Sí;No;No;No;No;No
101895447;Piso en Calle del Concilio;Piso;"4º sin ascensor muy luminoso, última planta, 4 habitaciones muy luminosas, cocina con terraza, baño, calefacción con caldera de gas de condensación. Salón con terraza.  A 4minutos andando de METRO Marqués de Valdavia.  ¡ Te ayudamos con la financiación! Esta información es meramente orientativa, no tiene carácter contractual y puede no coincidir con los datos reales, la propiedad y/o la inmobiliaria se reservan el derecho de cambiar, eliminar o endurecer cualquier requisito, condición o precio reflejados en este email.";919388216;Calle del Concilio;160000;4;Alcobendas Centro, Alcobendas;MD. GESTIÓN ACTIVOS;Profesional;-;Alcobendas;Alcobendas Centro;165000;1860;86;1;4;No;No;No;Sí;No;No;No;No;No
100762354;Piso;Piso;"Excelente piso exterior 105M2 construidos, en muy buen estados, 3 dormitorios, dormitorio principal con su baño incorporado tipo suite, 2 cuartos de baños completo uno con bañera y el otro con plato de ducha, salón amplio con acceso a terraza, cocina amueblada con muebles de diseño más electrodomésticos y encimera de silestone más tendedero, a/a en salón, calefacción individual de gas natural, ascensor, plaza de garaje, trastero, zona de Valdelasfuentes, muy bien comunicado.";916636276;Norte;345000;3;Norte, Alcobendas;Gelma;Profesional;-;Alcobendas;Norte;-;3286;105;2;1;Sí;No;No;Sí;Sí;Sí;Sí;Sí;Sí
102203517;Piso en Calle alava;Piso;"Distrito Global presenta una vivienda a estrenar muy luminosa perfecta para vivir o como inversión.";919383848;Calle alava;309000;2;Alcobendas Centro, Alcobendas;Distrito Global Inmobiliaria;Profesional;-;Alcobendas;Alcobendas Centro;316000;4414;70;2;2;Sí;No;No;No;Sí;Sí;Sí;Sí;No
101008728;Piso;Piso;"SYCASA pone en venta en exclusiva este excelente piso. Muy cerca de la Avd de España, de 116 m2 construidos muy luminoso, en una segunda planta con ascensor. Consta de Hall de entrada, pasillo distribuidor, 3 dormitorios muy amplios con armarios empotrados, la principal, con vestidor con gran armario y baño con plato de ducha tipo suite, dispone de un amplio salón independiente con salida a una estupenda terraza cerrada, amplia cocina amueblada que dispone también de zona de lavado y tendedero exterior, el inmueble dispone de un segundo cuarto de baño con bañera. La vivienda Cuenta con un estupendo trastero en el mismo edificio de 10 m2 y plaza de garaje en el mismo edificio. La comunidad cuenta con elevador salva escaleras en el portal. Muy bien comunicado, cerca de comercios, restauración, zonas de ocio, parque infantil, farmacia, centro médico y colegios. próximo a parada de autobús y a 5 minutos de la estación de Renfe, con salida muy directa a N 1 y M-50. Centros comerciales y grandes superficies como Megapark –Plaza Norte 2, Alegra, Viñas.  PUEDE REALIZAR UNA VISITA GUIADA A TRAVES DEL VIDEO. CALIDADES: Ventanas de aluminio y cristal climalit.  Suelos de parquet y cerámicos  Puerta de entrada blindada. Puertas de paso en sapelly.  "Mejor ver. " Llámenos y se lo enseñamos sin compromiso. " Te ayudamos con la financiación a tu medida.  SYCASA dispone de servicio financiero consiguiendo el 100% de financiación con las mejores condiciones del mercado actual, estudio gratuito. ¡Consúltenos sin compromiso”!";919380160;Alcobendas Centro;295000;3;Alcobendas Centro, Alcobendas;Sycasa inmobiliaria;Profesional;-;Alcobendas;Alcobendas Centro;-;2543;116;2;2;Sí;No;No;Sí;Sí;Sí;No;Sí;No
101809207;Piso en Calle de Francisco Largo Caballero;Piso;"Piso 140 m² en Alcobendas, Madrid CORNEJO INMUEBLES ofrece vivienda en venta en Valdelasfuentes. Año de construcción 2002. VIVIENDA LIBRE PARA MARZO 2024. ACTUALMENTE SE ENCUENTRA ALQUILADA A INQUILINOS MUY BUENOS (CONSULTAR CONDICIONES) HASTA MARZO.    Vivienda de 85m2, situada en una primera planta con ascensor. Cuenta con salón comedor independiente con aire acondicionado, cocina completamente equipada, TRES dormitorios independientes con armarios empotrados y DOS baños completos (uno con bañera y otro con plato de ducha). Calefacción individual por gas natural, suelos de parquet de espiga, ventanas de climalit, carpintería de roble y puerta blindada.  Dispone de dos plazas de garaje y trastero incluidos en precio. Situado en una zona fantástica de Alcobendas, cerca de colegios, institutos, comercios, supermercados y centros de salud y polideportivo de Valdelasfuentes. A 10 minutos caminando al metro de Manuel de Falla (Línea 10). Comunidad de propietarios 96€/mes IBI: 412€/año.";919385068;Calle de Francisco Largo Caballero;330000;3;Norte, Alcobendas;Cornejo Inmuebles;Profesional;-;Alcobendas;Norte;-;2357;140;2;1;Sí;No;No;Sí;Sí;Sí;Sí;Sí;No
101809207;Piso en Calle de Francisco Largo Caballero;Piso;"Piso 140 m² en Alcobendas, Madrid CORNEJO INMUEBLES ofrece vivienda en venta en Valdelasfuentes. Año de construcción 2002. VIVIENDA LIBRE PARA MARZO 2024. ACTUALMENTE SE ENCUENTRA ALQUILADA A INQUILINOS MUY BUENOS (CONSULTAR CONDICIONES) HASTA MARZO.    Vivienda de 85m2, situada en una primera planta con ascensor. Cuenta con salón comedor independiente con aire acondicionado, cocina completamente equipada, TRES dormitorios independientes con armarios empotrados y DOS baños completos (uno con bañera y otro con plato de ducha). Calefacción individual por gas natural, suelos de parquet de espiga, ventanas de climalit, carpintería de roble y puerta blindada.  Dispone de dos plazas de garaje y trastero incluidos en precio. Situado en una zona fantástica de Alcobendas, cerca de colegios, institutos, comercios, supermercados y centros de salud y polideportivo de Valdelasfuentes. A 10 minutos caminando al metro de Manuel de Falla (Línea 10). Comunidad de propietarios 96€/mes IBI: 412€/año.";919385068;Calle de Francisco Largo Caballero;330000;3;Norte, Alcobendas;Cornejo Inmuebles;Profesional;-;Alcobendas;Norte;-;2357;140;2;1;Sí;No;No;Sí;Sí;Sí;Sí;Sí;No
101888668;Piso;Piso;"LemonLine te presenta este 4º, con ascensor, de 92m²* útiles. ¡Y sin coste de intermediación inmobiliaria para el comprador! Consta de recibidor, un luminoso salón-comedor con un extenso balcón, una amplia cocina con acceso al balcón, dos baños de 3 piezas con plato de ducha, dos habitaciones dobles (una con salida al balcón) y una habitación individual.  Características: - Reformado - Estancias amplias con mucha luz natural  - Mobiliario no incluido - Calefacción de gas por radiadores  - Suelos de parqué - Ventanas de aluminio  - 92m² útiles y 99m² construidos según catastro - 4º real - Finca del 1977 - Ascensor La vivienda se encuentra a escasos minutos caminando de todos los servicios necesarios en nuestro día a día. Acceso a A-1, M-603, M-616. Líneas de autobús más próximas: 10 Parada de metro más próxima: Manuel de Falla Si tienes cualquier duda o pregunta o quieres programar una visita, ¡no dudes en ponerte en contacto con nosotros! Si necesitas financiación, nuestro departamento financiero LemonLine Hipotecas obtiene **hasta el 100% gracias a nuestros únicos acuerdos de colaboración con las entidades bancarias. *El precio ofertado de este inmueble no incluye el mobiliario interno de la vivienda. La superficie del inmueble ha sido facilitada por el vendedor, consultada en la Sede Electrónica de Catastro o Registro de la Propiedad, pudiendo haber alguna variación con la superficie real. Les comunicamos que en el precio ofertado de venta, no están incluidos los gastos de compraventa: notariales, registrales, gestoría, ITP (Impuesto de Transmisiones Patrimoniales) y/o gastos bancarios que pudieran generarse. **La obtención de la financiación está sujeta a las condiciones de la entidad financiera y tendrá en cuenta el perfil y solvencia del cliente. Consulta nuestra web para leer el Aviso Legal sobre la descripción de este inmueble.";936179365;Ensanche;318000;3;Ensanche, Alcobendas;LemonLine;Profesional;-;Alcobendas;Ensanche;-;3212;99;2;4;Sí;No;No;No;No;No;No;No;No
101931856;Piso en Calle Arroyo de la Vega, 7;Piso;"Fabuloso y luminoso piso en urbanización ajardinada con piscina. Salón-comedor de unos 40m2 y cocina con terraza tendedero. La habitación principal tiene vestidor y baño ensuite.  Trastero espacioso y dos plazas de garaje. Absténgase inmobiliarias e intermediarios. Sólo compradores interesados.";627812630;Calle Arroyo de la Vega, 7;525000;3;Valdelacasa, Alcobendas;jaime;Particular;-;Alcobendas;Valdelacasa;550000;3500;150;3;1;Sí;No;Sí;No;Sí;Sí;Sí;Sí;Sí
101008728;Piso;Piso;"SYCASA pone en venta en exclusiva este excelente piso. Muy cerca de la Avd de España, de 116 m2 construidos muy luminoso, en una segunda planta con ascensor. Consta de Hall de entrada, pasillo distribuidor, 3 dormitorios muy amplios con armarios empotrados, la principal, con vestidor con gran armario y baño con plato de ducha tipo suite, dispone de un amplio salón independiente con salida a una estupenda terraza cerrada, amplia cocina amueblada que dispone también de zona de lavado y tendedero exterior, el inmueble dispone de un segundo cuarto de baño con bañera. La vivienda Cuenta con un estupendo trastero en el mismo edificio de 10 m2 y plaza de garaje en el mismo edificio. La comunidad cuenta con elevador salva escaleras en el portal. Muy bien comunicado, cerca de comercios, restauración, zonas de ocio, parque infantil, farmacia, centro médico y colegios. próximo a parada de autobús y a 5 minutos de la estación de Renfe, con salida muy directa a N 1 y M-50. Centros comerciales y grandes superficies como Megapark –Plaza Norte 2, Alegra, Viñas.  PUEDE REALIZAR UNA VISITA GUIADA A TRAVES DEL VIDEO. CALIDADES: Ventanas de aluminio y cristal climalit.  Suelos de parquet y cerámicos  Puerta de entrada blindada. Puertas de paso en sapelly.  "Mejor ver. " Llámenos y se lo enseñamos sin compromiso. " Te ayudamos con la financiación a tu medida.  SYCASA dispone de servicio financiero consiguiendo el 100% de financiación con las mejores condiciones del mercado actual, estudio gratuito. ¡Consúltenos sin compromiso”!";919380160;Alcobendas Centro;295000;3;Alcobendas Centro, Alcobendas;Sycasa inmobiliaria;Profesional;-;Alcobendas;Alcobendas Centro;-;2543;116;2;2;Sí;No;No;Sí;Sí;Sí;No;Sí;No
101863438;Piso en Calle del Pintor Velázquez, 8;Piso;"NO INMOBILIARIAS LLAMAR AL SEIS CINCUENTA CUATRO SIETE TRES UNO SEIS UNO Gran piso de 2 dormitorios 2 baños en zona muy tranquila de Alcobendas muy luminoso ya que da a jardines  Cocina amueblada Calefaccion y agua caliente por gas natural dormitorio principal con baño incorporado y zona de vestidor Cocina mueblada Urbanizacion con piscina y gimnasio. Posibilidad de garaje en la zona.";-;Calle del Pintor Velázquez, 8;298000;2;Ensanche, Alcobendas;fernando;Particular;-;Alcobendas;Ensanche;-;3506;85;2;ss;Sí;No;Sí;No;No;No;No;No;Sí
101493699;Piso en cadiz;Piso;"RCL. INMOBILIARIA - VENDE - Zona Paseo de la Chopera. - -. En exclusiva, piso de tres dormitorios de 61 metros cuadrados construídos. Consta de tres dormitorios, salón comedor de paso y tres dormitorios. Cocina y cuarto de baño. El piso es ideal para Inversores. Estaría para reformar. La vivienda se encuentra en una entreplanta, con pocas escaleras.  El inmueble se encuentra casi haciendo esquina con el paseo de la Chopera. Siendo una zona consolidada con todos los servicios al rededor incluyendo paradas de autobuses, tanto interurbano como urbanos, estación de metro a cinco minutos andando y la de cercanías a 10 minutos. Imprescindible ver. RCL VENDE: PRECIO: 145.000, 00 € Llame para concertar una visita.";919383574;cadiz;145000;3;Alcobendas Centro, Alcobendas;Servicios inmobiliarios RCL;Profesional;-;Alcobendas;Alcobendas Centro;-;2377;61;1;bj;No;No;No;No;No;No;No;No;No
102051410;Piso en Calle de Salamanca;Piso;"PISO CON INQUILINOS - SOLO INVERSORES  Un gran inmueble se encuentra en la localidad de Alcobendas, Madrid.  Esta excelente vivienda cuenta con 3 habitaciones y 1 baño, se encuentra en buen estado y es una gran oportunidad para invertir. Además, perfecto para aquellos que quieren generar ingresos pasivos, este inmueble está alquilado y ofrece una rentabilidad de casi 6% anual. Esta oportunidad de inversión garantiza unos ingresos pasivos cómodos y seguros. Planifica tu inversión con esta increíble propiedad, ubicada en Salamanca 30, Alobendas, Comunidad de Madrid.  Si deseas realizar una compra inteligente, esta vivienda con un precio de venta de 179500€ y un precio de alquiler de 865€ es la mejor opción. No esperes más para invertir con este fenomenal inmueble. Compra ahora y comienza a disfrutar de los excelentes beneficios que esta maravillosa casa tiene para ofrecerte. La información proporcionada en tiene diversas fuentes, entre ellas organismos oficiales o el propietario del inmueble con lo que a veces puede no ser del todo correcta o exacta. Inviertis no se hace legalmente responsable de los errores o inexactitudes que puedan existir, por favor consulta con uno de nuestros agentes para más información.";936171844;Calle de Salamanca;179500;3;Alcobendas Centro, Alcobendas;Inviertis Properties;Profesional;-;Alcobendas;Alcobendas Centro;-;2393;75;1;2;No;No;No;No;No;No;No;No;No
