Id del anuncio;Título;Tipo de inmueble;Descripción;Teléfono;Dirección;Precio;Habitaciones;Subtítulo;Nombre del vendedor;Tipo de vendedor;Barrio;Municipio;Distrito;Precio antes de rebaja;Euros/m2;Metros cuadrados construidos;Baños;Planta;Ascensor (Sí/No);Obra nueva (Sí/No);Piscina (Sí/No);Terraza (Sí/No);Parking (Sí/No);Parking incluído en el precio (Sí/No);Aire acondicionado (Sí/No);Trastero (Sí/No);Jardín (Sí/No)
102303911;Dúplex en Calle de la Cruz Antigua;Duplex;"Hoy ponemos a la venta ¡SIN COMISIÓN PARA EL COMPRADOR! este ático duplex de dos dormitorios, con baño y aseo y preciosa terraza, aire acondicionado en salón, mosquiteras, en perfecto estado, para entrar a vivir, ubicado en pleno centro de Ciempozuelos muy cerca de la Plaza de la Constitución, a 10 minutos andando de la estación de RENFE, linea de cercanías C-3 a 32 minutos de estación de Atocha, excelentes comunicaciones Madrid capital y poblaciones limítrofes, por carretera A-IV, M-50, M-40 etc.. . Bus urbano e interurbano, linea directa a Hospital Infanta Elena, cuota comunidad 25€.";616936998;Calle de la Cruz Antigua;100000;2;Casco Antiguo sur, Ciempozuelos;RE/MAX URBE;Profesional;-;Ciempozuelos;Casco Antiguo sur;-;1818;55;2;3;No;No;No;Sí;No;No;Sí;No;No
101852375;Piso en Avenida del Consuelo;Piso;"Magnifico piso en la mejor ubicación de Ciempozuelos, cuatro dormitorios, el principal en suite, 2 baños y aseo (reconvertido en lavadero) 115 m2, con garaje, trastero, piscina comunitaria, patio, 4 balcones a la avenida del Consuelo, aire acondicionado en el salón, suelos de Tarima, paredes lisas, puertas lacadas en blanco, cocina amueblada, campana extractora de diseño, vitro-ceramica.. . Parada de Bus en la puerta, todos los servicios municipales, comercios varios, instituto, colegios, guarderías, todo en un radio de 500m. a 10 minutos andando de la estación de RENFE, linea C-3 de cercanías, 32 minutos hasta Atocha, Ciempozuelos cuenta con Bus tanto urbano como interurbano, linea directa al hospital infanta Elena, por carretera accesos a Madrid y ciudades limítrofes por A-4, M-50, M-45, etc.. . 35 Km a Madrid. La disponibilidad de esta vivienda será febrero de 2024.";616936998;Avenida del Consuelo;180000;4;Casco Antiguo sur, Ciempozuelos;RE/MAX URBE;Profesional;-;Ciempozuelos;Casco Antiguo sur;-;1565;115;2;1;Sí;No;Sí;Sí;Sí;Sí;Sí;Sí;No
98351106;Piso en Plaza Mayor;Piso;"¡Aprovecha este descuento exclusivo! Disponible solo hasta el 10 de Septiembre. Clikalia pone a la venta este inmueble exterior de 90 m2 con muchísimas oportunidades, perfecto para convertirlo en el hogar de tus sueños. Se sitúa en la planta baja con ascensor, en la calle Mayor, en Ciempozuelos. ¿Te gustaría reformar esta vivienda? En Clikalia te ofrecemos la opción de reformar tu vivienda de forma integral sin complicaciones y con un presupuesto muy competitivo para que conviertas el inmueble, en el hogar que siempre has querido, adaptado a tu gusto y necesidades. ¡Solicita información de forma gratuita y sin compromiso! Somos los propietarios de la vivienda ¡NO COBRAMOS COMISIÓN! El piso consta de 2 habitaciones, salón-comedor, cocina independiente y 1 baño. Este inmueble cuenta con una ubicación excelente ya que se encuentra a pocos minutos a pie del Parque San Juan de Dios. A su vez, muy próximo a múltiples paradas de autobús y del Cercanías (C3). Posibilidad de financiación hasta el 100%. Pregúntanos sin compromiso. ¿Te interesa esta vivienda? ¡Llámanos! Clikalia está a tu disposición de lunes a viernes de 9.00h a 20.00h.";919388464;Plaza Mayor;90000;2;La Estación - Psiquiátrico San José, Ciempozuelos;Clikalia España;Profesional;-;Ciempozuelos;La Estación - Psiquiátrico San José;99000;1000;90;1;bj;Sí;No;No;No;No;No;No;No;No
102389248;Piso en Vereda del Prado;Piso;"Inmonieves comercializa inmueble de 84 metros distribuidos en: Hall de entrada, cocina con terraza tendedero, salón pasante con salida a una amplia terraza exterior con unas visitas impresionantes, cuarto de baño, y tres dormitorios. Gastos de comunidad 70 €. El inmueble tiene acometida de gas natural (pero habrá que darle de alta) Es una sexta planta en un edificio de siete alturas con ascensor, hay cuatro vecinos por planta. DESTACAR: Necesita reforma " INTEGRA " destacamos " INTEGRA" por que así es, no actualizar el inmueble si no INTEGRA, peeeeeeeero así lo haces a tu gusto. Muy bien comunicado, tranquilo. y si lo quieres para invertir alta rentabilidad. Si disfrutas con las obras …. en este piso disfrutaras realizándola. Ventajas:  Es totalmente exterior, tiene mucha luz, es amplio 84 metros útiles según catastro, muy bien comunicado. Precio: 89.9000€.";919389429;Vereda del Prado;89900;3;Cuevas - Ilustración, Ciempozuelos;Inmonieves;Profesional;-;Ciempozuelos;Cuevas - Ilustración;-;1058;85;1;6;Sí;No;No;Sí;No;No;No;No;No
97742231;Piso en Calle Caretos;Piso;"Precioso piso muy cercano al cercano al centro neurálgico de Ciempozuelos, se puede llegar caminando a cualquiera de los principales servicios que necesitamos en la vida diaria, incluido parada de autobús urbano a 30 m. , en un edificio de buena construcción, tiene ascensor, tres dormitorios amplios, con armarios empotrados, dos baños completos, cocina con tendedero, salón independiente y amplio recibidor. Aire acondicionado en salón y dormitorio principal, suelos de gres y está muy cuidado.  Ciempozuelos es una población con casi 25.000 habitantes y muy bien comunicada por RENFE linea C3, autobuses urbanos e interurbanos con línea con Madrid, Aranjuez, San Martín, Hospital Infanta Elena en Valdemoro.  Ciempozuelos también es una población con Escuela Universitaria de Enfermeria, algo a tener en cuenta por inversores por la demanda de arrendamientos.";658934313;Calle Caretos;139000;3;La Estación - Psiquiátrico San José, Ciempozuelos;RE/MAX URBE;Profesional;-;Ciempozuelos;La Estación - Psiquiátrico San José;-;1495;93;2;3;Sí;No;No;No;No;No;Sí;No;No
97084194;Piso en Calle de las Estrellas;Piso;"¡SIN COMISIÓN AL COMPRADOR! Gran piso de 127 m2, dos dormitorios (antes tres dormitorios), 1 baño, cocina con comedor anexo y despensa, gran salón, completamente reformado para entrar a vivir, pintura lisa, aire acondicionado en salón y dormitorios, terraza, garaje y trastero incluidos en precio. Ubicado en calle principal muy cercano al centro, escuelas, instituto, en un radio de 500 m. Bus urbano e interurbano con linea directa a hospital Infanta Elena de Valdemoro, 15 min a RENFE andando, linea C-·3 de cercanias 32 minutos hasta Atocha, buenos accesos a Madrid capital y poblaciones limitrofes por A-IV, M-50, M-40 etc...";616936998;Calle de las Estrellas;140000;2;Casco Antiguo norte, Ciempozuelos;RE/MAX URBE;Profesional;-;Ciempozuelos;Casco Antiguo norte;-;1102;127;1;2;No;No;No;Sí;Sí;Sí;Sí;Sí;No
102172509;Chalet adosado en Doctor Rivas;Chalet;"Casa baja de pueblo, a reformar, 236 metros cuadrados de parcela con salida trasera a calle paralela, 149 metros cuadrados construidos, de los cuales 98 metros cuadrados pertenecen a la vivienda y 51 metros cuadrados a garaje, trastero y porche, patio con parra y pozo, tres dormitorios, un baño, pasada IEE hace un año, ubicada en el centro de Ciempozuelos con todos los servicios municipales, comercios etc.. . en un radio de 300 metros. 10 minutos a RENFE andando, parada de BUS urbano e interurbano a 100 metros, Ciempozuelos cuenta con buenas comunicaciones con Madrid capital y poblaciones limitrofes, tanto por carretera A-IV, M-50, M-40, M-30 etc, como por tren, linea de cercanías C-3, 32 minutos hasta Atocha.";616936998;Doctor Rivas;160000;3;Casco Antiguo norte, Ciempozuelos;RE/MAX URBE;Profesional;-;Ciempozuelos;Casco Antiguo norte;-;1074;149;1;-;No;No;No;No;No;No;Sí;Sí;Sí
99537617;Piso en Travesía de Capitán Antonio de Oro Pulido;Piso;"! RESERVADO¡ Redpiso Ciempozuelos vende en exclusiva estupendo piso en la zona centro del pueblo, a pocos metros de la plaza del Ayuntamiento. La vivienda cuenta con excelente ubicación y acceso, tanto en trasporte público (Cercanías C3, autobuses 426- Madrid Legazpi y autobús 425-Hospital Valdemoro) como en coche, cuenta con los servicios principales a poca distancia a pie, como lo son supermercados, panaderías, colegios, farmacia etc. La vivienda se distribuye en pasillo, cocina y salón con acceso a terraza, un baño completo con plato de ducha, dos dormitorios exteriores y un trastero.  EN REDPISO tenemos departamento financiero propio y convenios con numerosos bancos, consiguiendo la mejor financiación. Solicita ya nuestro estudio financiero, es completamente gratuito. En el precio de venta no se incluyen gastos de escrituración, ni honorarios por la intermediación inmobiliaria. ¡ EXCELENTE OPORTUNIDAD! CONSULTENOS SIN COMPROMISO. CON GUSTO LO ATENDEREMOS.";910232199;Travesía de Capitán Antonio de Oro Pulido;132000;2;Casco Antiguo norte, Ciempozuelos;Redpiso;Profesional;-;Ciempozuelos;Casco Antiguo norte;-;1535;86;1;2;Sí;No;No;Sí;No;No;Sí;Sí;No
101641193;Chalet en Calle de Antonio Cabezón;Chalet;"Espectacular casa de 423m² en Ciempozuelos, Madrid. Esta vivienda, por su amplitud, satisface las necesidades de una familia con niños.  Este chalet tiene dos plantas de altura y cuenta con salón, cuatro habitaciones, dos baños, aseo y cocina amueblada, absolutamente independiente del resto de estancias y equipada con electrodomésticos. Además, el chalet cuenta con balcón, que aporta gran luminosidad a toda la estancia, terraza, para que disfrutes del buen tiempo, un patio para que puedas desayunar al aire libre y armarios empotrados para optimizar tu espacio. El inmueble es todo exterior, con buhardilla en la que encontrarás un gimnasio y un despacho. También cuenta con una piscina privada que hará el calor veraniego mucho más llevadero, y trastero, lo que aumenta la capacidad de almacenaje de tu vivienda. Este chalet, situado en una vía de fácil acceso, tiene plaza de garaje para mayor seguridad. Además, por su orientación oeste, disfrutarás del sol por las tardes, momento en el que la casa resulta especialmente acogedora.  La vivienda se vende sin amueblar y en buen estado, lista para entrar a vivir, con espacios muy aprovechables y calidades excelentes. En ese sentido, este chalet cuenta con paneles solares, calefacción por bomba de calor y aire acondicionado, carpintería de madera y suelo de gres, de fácil mantenimiento y gran resistencia.  Esta casa está situada en una zona bien comunicada, residencial y tranquila, muy cerca de la parada de autobús. Para mayor comodidad, la vivienda se encuentra muy cerca de un hospital y de un colegio.  De particular a particular. Sin comisiones. Llámanos y visita esta vivienda. h1o3u7s4e9l6l.";919389411;Calle de Antonio Cabezón;410000;4;Los Cestos - Belén - Las Eras, Ciempozuelos;Housell;Profesional;-;Ciempozuelos;Los Cestos - Belén - Las Eras;-;969;423;3;-;No;No;Sí;Sí;Sí;Sí;Sí;Sí;No
99981649;Chalet en Calle Zurbarán;Chalet;"De particular a particular. Sin comisiones. Llámanos y visita esta vivienda. Espaciosa casa de 140 m² de superficie y 200 m² de parcela, en la que podrás disfrutar de tiempo al aire libre, en Ciempozuelos, provincia de Madrid. Esta vivienda, por su amplitud, satisface las necesidades de una familia con niños.  Este chalet se distribuye en amplio y luminoso salón, cocina amueblada, cuatro dormitorios y tres cuartos de baño completos. Además, el chalet cuenta con terraza, para que disfrutes del buen tiempo, un patio para que puedas desayunar al aire libre y armarios empotrados, para aumentar la capacidad de almacenaje de tu hogar. El inmueble es todo exterior, con jardín privado en el que aprovecharás el buen tiempo. Este chalet se encuentra situado en una vía de fácil acceso, tiene garaje para dos coches y que puedas aparcar con comodidad y trastero, para que guardes todo aquello que necesites.  Con orientación este, en esta casa disfrutarás del sol por las mañanas. La vivienda se vende sin amueblar y en buen estado, lista para entrar a vivir. En cuanto a las calidades, este chalet cuenta con calefacción de gas, aire acondicionado, carpintería exterior de pvc, suelos de parquet, que da mucha calidez a la vivienda y de gres, de fácil mantenimiento y gran resistencia.  Esta casa está situada en una zona tranquila, próxima al centro, bien comunicada, muy cerca de la parada de autobús. Para mayor comodidad, la vivienda se encuentra muy cerca de un centro médico, un colegio y todos los servicios necesarios.  h1o3u5s2e0l1l.";919389411;Calle Zurbarán;270000;4;Cuevas - Ilustración, Ciempozuelos;Housell;Profesional;-;Ciempozuelos;Cuevas - Ilustración;-;1800;150;3;-;No;No;No;Sí;Sí;Sí;Sí;Sí;Sí
100660701;Piso;Piso;"Aunque lo parezca por lo cuidado no es un piso a estrenar. Tiene orientación sur lo que hace que la luz inunde todas las estancias. Tiene cocina independiente, salón, dos dormitorios con armarios empotrados y un baño. En salón y dormitorio principal tiene aire acondicionado, el sistema de calefacción principal es por radiadores eléctricos igual que el agua caliente sanitaria. Cercano a todos los servicios de la localidad, como las paradas de autobus urbano e interurbano a unos 200m. , colegios, institutos, parques, supermercados.. . todo a una distancia muy cómoda caminando. Si necesitamos coche, tiene una amplia plaza de garaje.";658934313;Los Cestos - Belén - Las Eras;115000;2;Los Cestos - Belén - Las Eras, Ciempozuelos;RE/MAX URBE;Profesional;-;Ciempozuelos;Los Cestos - Belén - Las Eras;-;1797;64;1;1;Sí;No;No;No;Sí;Sí;Sí;No;No
101200516;Piso en Calle Postas;Piso;"Piso en venta en Ciempozuelos (Madrid), perfecto para familias. El inmueble cuenta con una superficie de 89 m² construidos distribuidos en 3 dormitorios, salón-comedor, cocina, 1 baño completo y 1 balcón.  La vivienda tiene suelos de parquet y se ubica en la 2ª planta del edificio, sin ascensor. Muy luminoso.  El piso necesita varias mejoras  Localizado en el centro de Ciempozuelos, en sus alrededores encontramos la Escuela Infantil Bilingüe Jarque, supermercados, bancos, farmacias, oficinas de correos, centros deportivos y varias paradas de autobús.  Cuenta con fácil acceso a Autovía del Sur (A-4). Infórmese sin compromiso.";919382865;Calle Postas;108500;3;Cuevas - Ilustración, Ciempozuelos;Centro Comercial Inmobiliario;Profesional;-;Ciempozuelos;Cuevas - Ilustración;-;1219;89;1;2;No;No;No;Sí;No;No;No;No;No
102233859;Piso en Travesía de San Sebastián;Piso;"LA CASA AGENCY pone piso en venta en Urbanización Seminueva para entrar a vivir! El inmueble exterior de 77 m² consta de 2 dormitorios con armarios empotrados, baño, salón-comedor, cocina y tendedero. Muy buenas calidades. Cuenta con calefacción individual con tarifa nocturna. Finca con ascensor, piscina, jardines y áreas comunes. Amplia Plaza de Garaje de 13 metros incluidos en el precio. Situado en el Centro de la Localidad, rodeada de parques, comercios, colegios, próximo a Mercadona y a 10 minutos de Renfe de Cercanías.";911594440;Travesía de San Sebastián;134900;2;Casco Antiguo sur, Ciempozuelos;La Casa Agency | Comillas Real Estate;Profesional;-;Ciempozuelos;Casco Antiguo sur;-;1752;77;1;1;Sí;No;No;No;Sí;Sí;No;No;Sí
100397096;Piso en Calle Marte;Piso;"VENTA GARANTIZADA pone a la venta estupenda vivienda en el barrio Pintor de Goya! IDEAL PARA INVERSORES La vivienda se distribuye en dos dormitorios, el primero amplio para cama de matrimonio y el segundo parar cama individual, ambos dormitorios cuentan con armarios empotrados. la cocina americana amueblada, salón amplio y baño completo con plato ducha. Puerta de seguridad, gres cerámico, puertas macizas, carpintería de aluminio, persianas, calefacción individual. Te ayudamos con la financiación, contacta con nosotros!";919385268;Calle Marte;93000;2;Casco Antiguo sur, Ciempozuelos;Alquiler Protegido - Venta Garantizada;Profesional;-;Ciempozuelos;Casco Antiguo sur;98999;1550;60;1;2;No;No;No;No;No;No;No;No;No
102229716;Piso en Travesía de San Sebastián;Piso;"LA CASA AGENCY pone piso en venta en Urbanización Seminueva para entrar a vivir! Inmueble exterior de 77 m², consta de 2 dormitorios con armarios empotrados, baño, salón-comedor, cocina y tendedero. Muy buenas calidades. Cuenta con calefacción individual con tarifa nocturna. Finca con ascensor, piscina, jardines y áreas comunes. Amplia PLAZA DE GARAJE de 13 metros incluidos en el precio. Situado en el Centro de la Localidad, rodeada de parques, comercios, colegios, próximo a Mercadona y a 10 minutos de Renfe de Cercanías. Nuestra compañía dispone de un departamento de Intermediación Financiera FINANZATE en el cual puedes obtener un asesoramiento sin compromiso y sin coste para usted, en que le darán a conocer sus posibilidades reales de inversión. Por el volumen de operaciones que realizamos durante todo el año, conseguimos las mejores opciones y garantías a la hora de comprar su vivienda. Si buscas una vivienda con buena ubicación, distribución y para entrar a vivir ¡ésta es tu oportunidad! ¡Contáctanos hoy mismo para programar una visita y descubre todo lo que tiene para ofrecer!";651199925;Travesía de San Sebastián;134900;2;Casco Antiguo sur, Ciempozuelos;LA CASA AGENCY - FUENLABRADA;Profesional;-;Ciempozuelos;Casco Antiguo sur;-;1752;77;1;1;Sí;No;Sí;No;Sí;Sí;No;No;Sí
100979097;Piso en Jeronimo Del Moral, 22;Piso;"Para entrar a vivir, TGB Gabinete Inmobiliario, te ofrece de Obra Nueva, vivienda de 2 dormitorios que es un capricho. Quieres vivir en una zona privilegiada en el centro de Ciempozuelos? esta es tu ocasión, última vivienda a la venta. Facilidades de pago hasta la entrega, si lo necesitas, te ayudamos en la financiación y todos los trámites. Ayuntamiento. bancos, comercios, notaría, colegios, Renfe y restauración muy próximo a la vivienda. Si lo necesitas, podemos ayudarte en la financiación. Pregunta sin compromiso. Fotos vivienda y zonas comunes al día 29 marzo 2023 avanzando la obra.";919388874;JERONIMO DEL MORAL, 22;182295;2;Casco Antiguo norte, Ciempozuelos;TGB Gabinete Inmobiliario;Profesional;-;Ciempozuelos;Casco Antiguo norte;-;1494;122;2;1;Sí;No;No;Sí;No;No;Sí;No;No
100886999;Ático en Beatriz Galindo;Ático;"EXCELENTE ÁTICO, Mejor visitar!  Vivienda en perfecto estado para entrar a vivir, muy luminoso, con ventanales amplios, salida a terraza de 25 m2, techo alto y dispone de halógenos en el recibidor, pasillo, cocina y baños.   La cocina está totalmente amueblada con electrodomésticos de primera Marca. Pintura de paredes lisas, armarios empotrados forrados, Calefacción de bomba de calor y frío por toda la casa mediante conductos.  Dos baños amueblados, uno con plato de ducha y otro con bañera. El edificio dispone de ascensor, y la vivienda se vende con plaza de garaje incluida en el precio.   Seguridad: En el portal comunitario dispone de Cámara de video grabación.   Zona céntrica al lado de Renfe cerca de supermercado, jardines, colegio, parques y parada de bus.  **SIN COMISIÓN AL COMPRADOR** **TE AYUDAMOS CON LA FINANCIACION**  **NEGOCIABLE**.";919388874;Beatriz Galindo;219000;3;Casco Antiguo norte, Ciempozuelos;TGB Gabinete Inmobiliario;Profesional;-;Ciempozuelos;Casco Antiguo norte;-;1711;128;2;2;Sí;No;No;Sí;Sí;Sí;Sí;No;No
99010288;Piso;Piso;"KASAURBANA presenta magnifico piso en una de las mejores zonas residenciales de CIEMPOZUELOS.   Está cerca de colegios, guarderías, institutos, supermercados, zonas de ocio, fácil acceso a la A4 y paradas de autobús justo en la puerta.   En las zonas comunes hay cámara de seguridad, jardín interior, 2 pistas de pádel, enorme gimnasio, zona de ocio, zona infantil, gran césped y una maravillosa piscina comunitaria.   Vivienda totalmente reformada que se distribuye así:   - Armario empotrado en el hall  - Cocina nueva en blanco, equipada, con espacio para mesa y sillas, . - Tendedero cubierto muy amplio - Gran salón- comedor muy luminoso y con salida a una terraza rectangular de 15 metros cuadrados techada - 2 habitaciones dobles, una de ellas con baño en suite, con ducha y mampara totalmente nuevo. Ambas tienen armarios empotrados y las ventanas dan a la terraza.  - El segundo baño tiene bañera con hidromasaje y mampara.    OTRAS CALIDADES:    - Ventanas Climalit.   - Vivienda totalmente exterior  - Muy luminoso.    **********Certificado energético en trámites. ********.";919384513;Cuevas - Ilustración;159900;2;Cuevas - Ilustración, Ciempozuelos;KASAURBANA;Profesional;-;Ciempozuelos;Cuevas - Ilustración;-;1176;136;2;1;Sí;No;Sí;Sí;Sí;Sí;Sí;No;Sí
102337374;Chalet pareado en Calle Magdalena;Chalet;"¡OPORTUNIDAD! en exclusiva ofrecemos  Magnifica casa constituida por una vivienda unifamiliar independiente de una planta, ubicada en una zona muy céntrica de Ciempozuelos, y con una superficie gráfica de 291 metros cuadrados según nota registro propiedad.  Esta casa te sorprenderá por la amplitud de sus espacios, su luminosidad y la tranquilidad que se respira en el ambiente. Con 4 habitaciones, es perfecta para familias que buscan un hogar acogedor y cómodo donde crecer y hacer recuerdos inolvidables juntos.   La casa cuenta con una amplia zona de patio que te permitirá disfrutar del aire libre en la comodidad de tu propia casa.   Además, de una cochera dentro del patio de dos plazas de garaje y un amplio trastero.   SIN COMISIÓN AL COMPRADOR.";919388874;Calle MAGDALENA;265000;4;Casco Antiguo sur, Ciempozuelos;TGB Gabinete Inmobiliario;Profesional;-;Ciempozuelos;Casco Antiguo sur;-;908;292;1;-;No;No;No;No;Sí;Sí;Sí;Sí;Sí
102154722;Piso;Piso;"El inmueble consta de las siguientes características: - Hall recibidor muy amplio. Este hall daría paso a la cocina y al salón. - Cocina cuadrada con excelente distribución y ofrece también salida a tendedero pequeño. - Salón muy amplio y luminoso el cual goza de dos ambientes muy bien diferenciados SALÓN - COMEDOR y el cual tiene acceso a una terraza con pérgola la cual goza de unas vistas despejadas. - Independiente zona de descanso, la cual consta de tres habitaciones amplísimas con armario empotrado, ventana con mosquitera y toldo. - Baño amplio completamente reformado con plato de ducha y mampara.";919384513;Casco Antiguo norte;159000;3;Casco Antiguo norte, Ciempozuelos;KASAURBANA;Profesional;-;Ciempozuelos;Casco Antiguo norte;169000;1178;135;2;1;Sí;No;No;Sí;No;No;Sí;Sí;No
101855456;Piso;Piso;"! TAMBIÉN DISPONIBLE EN COMPRAVENTA DE PAGOS APLAZADOS ¡ KASAURBANA ofrece este acogedor piso en CIEMPOZUELOS completamente reformado. El inmueble consta de un Hall recibidor, el cual da un pasillo que da acceso a todas las estancias de la casa. Este pasillo da acceso a un baño completamente reformado de este año y totalmente equipado. Consta de un salón muy amplio el cual se ha introducido la terraza en él con cerramiento. Tras esto podemos encontrar una cocina muy amplia y prácticamente a estrenar, tras la cual encontraremos TRES habitaciones amplias, la cual tiene DOS habitaciones individuales y UNA doble con estancia vestidor.";919384513;San Benito - Soledad - Hispanidad;134900;3;San Benito - Soledad - Hispanidad, Ciempozuelos;KASAURBANA;Profesional;-;Ciempozuelos;San Benito - Soledad - Hispanidad;-;1499;90;1;5;Sí;No;No;No;No;No;Sí;No;No
101865649;Piso;Piso;"KASAURBANA ofrece en venta este magnífico inmueble en CIEMPOZUELOS. El inmueble consta de las siguientes características: - Salón/comedor amplísimo con ventanales y mosquiteras, ambas zonas estan bien diferenciadas. - Cocina totalmente equipada y reformada con salida a una terraza patio de unos 25 metros totalmente privado. - Habitación doble, muy amplia y cómoda, con baño totalmente reformado, equipado e independiente. - Aire acondicionado por conductos, calor azul con radiadores nuevos y trastero grande y alto. Zona céntrica, pero totalmente tranquila a 5 minutos de la plaza y de las salidas a las carreteras A4 y 404.";919384513;San Benito - Soledad - Hispanidad;104990;1;San Benito - Soledad - Hispanidad, Ciempozuelos;KASAURBANA;Profesional;-;Ciempozuelos;San Benito - Soledad - Hispanidad;-;1400;75;1;bj;No;No;No;Sí;No;No;Sí;Sí;Sí
102357694;Casa independiente;Chalet;"! TAMBIEN DISPONIBLE EN COMPRAVENTA DE PAGO APLAZADOS ¡ El inmueble consta de las siguientes características: - Patio delantero de unos 43 m². - PLANTA BAJA: Encontramos un hall de entrada, cocina muy amplia totalmente equipada y reformada, aseo y salón comedor muy grande con bomba de frio y calor con salida a un espacioso jardín, de unos 80 m², en dos alturas ideal para construir o poner una piscina. - PRIMERA PLANTA: Consta de tres habitaciones dobles, todas con armarios empotrados, una de ellas en suite con pequeño vestidor y baño, también dispone de baño independiente para las habitaciones. - BUHARDILLA: Totalmente reformada, con aislante, calefacción propia bomba de frio y calor, decorada con madera de roble totalmente diáfana y con ventana Deluxe ideal para una cuarta habitación. Ventanas climalit de aluminio, con transporte público y colegios en la puerta, buena comunicación.";919384513;San Benito - Soledad - Hispanidad;282000;4;San Benito - Soledad - Hispanidad, Ciempozuelos;KASAURBANA;Profesional;-;Ciempozuelos;San Benito - Soledad - Hispanidad;-;1524;185;3;-;No;No;No;Sí;Sí;Sí;No;Sí;Sí
