Id del anuncio;Título;Tipo de inmueble;Descripción;Teléfono;Dirección;Precio;Habitaciones;Subtítulo;Nombre del vendedor;Tipo de vendedor;Barrio;Municipio;Distrito;Precio antes de rebaja;Euros/m2;Metros cuadrados construidos;Baños;Planta;Ascensor (Sí/No);Obra nueva (Sí/No);Piscina (Sí/No);Terraza (Sí/No);Parking (Sí/No);Parking incluído en el precio (Sí/No);Aire acondicionado (Sí/No);Trastero (Sí/No);Jardín (Sí/No)
101735734;Piso en Antonio Mendez;Piso;"BONITO PISO DE TRES DORMITORIOS, CON TERRAZA EN EL CENTRO DE ALCOBENDAS. El piso se encuentra en un tercer piso sin ascensor con escaleras muy cómodas. El estado de conservación tanto de las zonas comunes como del propio piso son excelentes. Acedemos a la vivienda a través de una puerta blindada y nos encontramos con un pasillo distribuidor, a la derecha hay una cocina recientemente reformada con mobiliario y electrodomésticos nuevos y de gama alta, las ventanas son de PVC oscilobatientes y con puente térmico y acústico, seguidamente nos encontramos con el baño completo con plato de ducha que también ha sido reformado recientemente. Al final del pasillo nos encontramos con el salón muy luminoso y con acceso a una terraza bastante amplia. Desde el salón hay un pequeño pasillo que nos lleva a los tres dormitorios siendo uno de ellos dormitorio de matrimonio. Las calidades de la vivienda son suelos de gres, pintura en liso, ventanas de PVC y aluminio, carpintería interior con puertas plafonadas, radiadores de aluminio y calefacción de gas natural. Todo esto en una calle cortada por lo que tiene poco tráfico, se encuentra a cinco minutos del antiguo ayuntamiento de Alcobendas, muy cerca del mercado de la calle constitución, con transporte publico tanto metro, cercanías, autobuses, rodeado de zonas verdes y con centros de saludos, colegios, etc. ¡NO PIERDAS LA OPORTUNIDAD Y VEN A VISITARLO! NO COBRAMOS HONORARIOS AL COMPRADOR. Y si necesitas HIPOTECA, no dudes en consultarnos y sin compromiso nuestros asesores financiaros avalados por IEAF y homologados por el banco de España, te conseguirán la mejor hipoteca al mejor precio. Este y más inmuebles en Síguenos en facebook: Molgar Gestión Inmobiliaria Hazte seguidor de nuestro canal de Youtube: Instagram: @molgarinmobiliaria <.";949727187;ANTONIO MENDEZ;179900;3;Alcobendas Centro, Alcobendas;MOLGAR Inmobiliaria;Profesional;-;Alcobendas;Alcobendas Centro;-;3102;58;1;3;No;No;No;Sí;No;No;No;No;No
99358539;Piso en Avenida de España;Piso;"¡PISO EN ALCOBENDAS! Queremos enseñaros, este piso muy luminoso, debido a la altura en la que se encuentra, distribuido de la siguiente manera Accedemos al inmueble a través de su hall que nos conduce a un salón comedor de 18 m² con salida a terraza que nos muestra unas tranquilas vistas. La cocina, con electrodomésticos básicos y tendedero cerrado El pasillo nos lleva a los cuatro dormitorios y dos baños con bañera con los que cuenta la vivienda. Tiene ascensor recién instalado, proximidad al ayuntamiento, centro comercial, hacienda y centro médico. Además, dispone de trastero La localidad de Alcobendas se caracteriza, por estar perfectamente comunicada mediante diferentes líneas de autobús, cercanías y metro. ¿Quieres verlo cuanto antes? ¡Llámanos!";919389980;Avenida de España;299000;4;Alcobendas Centro, Alcobendas;Fresno Inmobiliaria;Profesional;-;Alcobendas;Alcobendas Centro;-;3322;90;2;4;Sí;No;No;Sí;No;No;No;Sí;No
101165855;Piso en Travesía de Francisco Baena Valdemoro;Piso;"PRIMER NIVEL VENDE este magnífico piso exterior con una gran luminosidad ubicado en una buena zona de Alcobendas, a 500 mts de la estación de trenes, líneas regulares de autobuses, así como la parada de metro de Marqués de la Valdavia a unos minutos andando.  Su distribución es la siguiente: 3 habitaciones, amplio salón con terraza, cocina con terraza y tendedero, despensa, recibidor y un baño. Con posibilidad de hacer un aseo.  El inmueble está dotado de calefacción individual y aire acondicionado parcial. Sus suelos son de parquet. La fontanería y electricidad han sido cambiados hace 1 año tanto de la vivienda como de la finca. Otro de los beneficios de la vivienda es su situación en la tercera y última planta. Al encontrarse en buen estado, ¡Sólo tendrás que preocuparte de ponerlo a tu gusto! A 15 minutos en coche, 20 si vas en bici tienes la naturaleza con preciosas rutas biosaludables rodeada de arroyos, un castillo y una reserva de polinizadores.  A 2.1 kms la ciudad deportiva Valdelasfuentes, con piscinas, todo tipo de deportes, zona fitness, laguna de hidromasajes, entre otros.  ¡Cuida de ti y de tu familia! Si necesitas financiación no dudes en consultarnos. ¡Desde hace 20 años consiguiendo las mejores condiciones hipotecarias del mercado!";919388906;Travesía de Francisco Baena Valdemoro;199000;3;Alcobendas Centro, Alcobendas;PRIMER NIVEL INMOBILIARIA;Profesional;-;Alcobendas;Alcobendas Centro;-;2398;83;1;3;No;No;No;Sí;No;No;Sí;No;No
100629692;Piso en Almendro;Piso;"PRIMER NIVEL VENDE este magnífico piso con una gran luminosidad ubicado en una buena zona de Alcobendas. Tiene calefacción central, trastero y unas buenas vistas ya que no tienen edificaciones a su altura. Su distribución es la siguiente: Hall de entrada, cocina con terraza tendedero, salón con salida a terraza de grandes dimensiones, 3 dormitorios, baño completo y aseo. La finca dispone de ascensor con rampa de acceso y se encuentra ubicada en una zona próxima a la estación de tren de Alcobendas, líneas regulares de autobuses y a unos minutos andando al metro. Si necesitas financiación no dudes en consultarnos!";919388906;ALMENDRO;255000;3;Alcobendas Centro, Alcobendas;PRIMER NIVEL INMOBILIARIA;Profesional;-;Alcobendas;Alcobendas Centro;-;2318;110;2;2;Sí;No;No;Sí;No;No;No;Sí;No
94558187;Ático;Ático;"MORALEJA CONSULTING OFRECE ATICO EN VENTA DE 2 DORMITORIO Y DOS BAÑOS CON TERRAZA. Orientación sur. IMPRESIONANTES VISTAS DESPEJADAS. TOTAL PRIVACIDAD EN LA TERRAZA 20M2. Piscinas padel, seguridad 24h, zonas deportivas. Terraza orientación sur. El inmueble cuenta con 2 dormitorios y 2 baños. el dormitorio con el baño en suite. Cocina y tendedero lavadero de buen tamaño. Desde el salón accedemos a la terraza de forma rectangular, en la que se puede crear varios ambientes. 2 piscinas zona de juegos infantiles y pista de padel. Seguridad 24h A corta distancia al Plaza Norte II en una estupenda localización con áreas deportivas piscinas zonas infantiles. Dos dormitorios, el principal en suite baño muy amplio con ventana y armarios en todas sus estancias. Cocina con office y tendedero lavadero. Salón comedor de buen tamaño, con salida a la terraza privada Carpinteria interior lacado en blanco suelos de madera y cocina con electrodomésticos. Muy bonitas zonas comunes, vigilancia 24h jardines piscina y padel.";919383975;Alcobendas Centro;470000;2;Alcobendas Centro, Alcobendas;Moraleja Consulting Inmobiliario S.L.;Profesional;-;Alcobendas;Alcobendas Centro;-;4700;100;2;5;Sí;No;Sí;Sí;No;No;Sí;No;Sí
97237354;Piso en Calle de León Pérez Bayo;Piso;"¡Aprovecha este descuento exclusivo! Disponible solo hasta el 10 de Septiembre. Exclusivo piso a estrenar situado en el barrio de Alcobendas Centro, en Madrid. No cobramos comisiones, en Clikalia somos propietarios. La vivienda está ubicada en la 3ª planta exterior con ascensor. Dispone de una superficie total de 65 m², distribuidos en salón-comedor, cocina independiente equipada, 3 dormitorios con armarios empotrados y 1 baño.  Además, cuenta con ascensor, cocina amueblada, armarios empotrados, terraza y aire acondicionado. Situado en el barrio de Alcobendas Centro, en la Calle Leon Perez Bayo, cuenta con una ubicación excelente ya que se encuentra a pocos minutos a pie del Centro Médico Valdavia y del Campo de Fútbol Navarra. A su vez, está próximo a supermercados, restaurantes, colegios, gimnasios, paradas de autobús, la estación de metro Marqués de la Valdavia (L10) y la estación de Renfe Alcobendas (C4) Posibilidad de financiación hasta el 100%. Pregúntanos sin compromiso. ¿Te interesa esta vivienda? ¡Llámanos! Clikalia está a tu disposición de lunes a viernes de 9.00h a 20.00h.";919388464;Calle de León Pérez Bayo;200000;3;Alcobendas Centro, Alcobendas;Clikalia España;Profesional;-;Alcobendas;Alcobendas Centro;210000;3077;65;1;3;Sí;No;No;Sí;No;No;Sí;No;No
101401202;Piso en Calle de Santa Lucía;Piso;"Clikalia pone a la venta este inmueble exterior de 51 m2 en reforma. Se sitúa en la 3ª planta sin ascensor, en la calle Santa Lucia, en Alcobendas. Somos los propietarios de la vivienda ¡NO COBRAMOS COMISIÓN! El inmueble consta de 2 habitaciones, una de ellas doble y la otra individual, las une la terraza, salón-comedor que conecta con la cocina abierta equipada y 1 baño. La vivienda cuenta además con terraza y calefacción. Este inmueble tiene una ubicación excelente ya que se encuentra a pocos minutos a pie del Centro de arte de Alcobendas y el Centro Médico Valdavia, así mismo se encuentra rodeado de supermercados, restaurantes y boutiques. La línea de metro más cercana es Marqués de la Valdavia (L10). Contacta para ver los detalles de la reforma y agendar una visita. ¡Posibilidad de financiación hasta el 100%! ¿Te interesa esta vivienda? ¡Llámanos! Clikalia está a tu disposición de lunes a viernes de 9.00h a 20.00h.";919388464;Calle de Santa Lucía;180000;2;Alcobendas Centro, Alcobendas;Clikalia España;Profesional;-;Alcobendas;Alcobendas Centro;-;3529;51;1;3;No;No;No;Sí;No;No;No;No;No
101179779;Piso en Calle Salamanca;Piso;"INMOBILIARIA PRIMER NIVEL ofrece en exclusiva excelente vivienda en Alcobendas, junto a Avenida de España. Consta de 75m2 distribuidos en amplio salón exterior, 3 dormitorios, 1 baño completo, y cocina equipada con pequeña terraza. Calefacción por gas natural, e instalación de radiadores recién renovada. Baja comunidad (40€) agua incluida. Muy bien ubicada, junto a todos los servicios. Tercera planta (y última) sin ascensor. Te ayudamos con la financiación a tu medida. ¡Consúltanos sin compromiso!";919388906;Calle SALAMANCA;159000;3;Alcobendas Centro, Alcobendas;PRIMER NIVEL INMOBILIARIA;Profesional;-;Alcobendas;Alcobendas Centro;-;2120;75;1;3;No;No;No;Sí;No;No;No;No;No
101261094;Piso en Manzanares;Piso;"PRIMER NIVEL INMOBILIARIA VENDE este piso totalmente reformado. Es una primera altura en una excelente ubicación, muy cerca de la estación de metro Marqués de la Valdavia y a 15 minutos en coche del Aeropuerto Madrid Barajas. El entorno donde de encuentra acaba de ser reformado por el Ayuntamiento de Alcobendas, habilitando la zona como peatonal y aportando un valor añadido extra a todos los inmuebles de la zona.  El edificio donde se emplaza solo tiene 3 viviendas, siendo un piso exterior con gran luminosidad.  Dispone de una gran terraza y consta de amplio salón independiente, 3 dormitorios de gran tamaño, cocina con una segunda terraza, baño con ventana al exterior y vestíbulo.  Ven a vivir a una ciudad rodeada por un entorno natural, zonas verdes, parques temáticos para niños, una amplia variedad gastronómica, numerosas actividades y colegios que han llegado a la final del "Young Business Talent" y con el ratio de e-commerce más elevado de la zona.  El piso se encuentra a 1.1 kms del "Bulevar Coworking" de apoyo a futuros emprendedores y a 1.6 kms de "Alcobendas Hub", un espacio temporal de trabajo mientras instalas tu empresa.  No lo dudes, ven a verlo! Si necesitas financiación, no dudes en consultar nuestras condiciones.";919388906;MANZANARES;210000;3;Alcobendas Centro, Alcobendas;PRIMER NIVEL INMOBILIARIA;Profesional;-;Alcobendas;Alcobendas Centro;-;2188;96;1;1;No;No;No;Sí;No;No;No;No;No
101591975;Piso en Calle del Pintor Rosales;Piso;"PRIMER NIVEL INMOBILIARIA VENDE este magnífico piso exterior con una gran luminosidad, en una de las áreas más demandadas de Alcobendas (zona Pintores), donde se disfruta de una gran calidad de vida y con una buena comunicación, tanto en transporte público como por carretera. Es una tercera planta con ascensor, siendo además la última del edificio, lo que le confiere al inmueble la tranquilidad de saber que ningún vecino pudiera resultar molesto. La urbanización donde se ubica, está excepcionalmente cuidada, con zonas comunes ajardinadas con un excelente servicio de jardinería, piscina comunitaria de gran tamaño. solarium y un gran espacio a modo de club social y gimnasio totalmente equipado, donde además se realizan clases programadas de baile, yoga, sevillanas, etc.. . Consta de hall de entrada, salón independiente de gran tamaño con acceso a terraza, 4 dormitorios, cocina con terraza tendedero, 2 baños (1 en suite) y otra terraza con acceso desde 2 dormitorios. Tiene calefacción central, con un gasto de comunidad bajo para los servicios que ofrece y está equipado con aire acondicionado en salón y 3 dormitorios. Está ubicado a escasos minutos de la estación de Metro Marqués de la Valdavia, al lado de líneas regulares de autobuses y a pocos minutos en coche del Aeropuerto de Madrid- Barajas. Si necesitas financiación, disponemos de un servicio financiero propio que podrá ayudarte a conseguir las mejores condiciones del mercado. Consúltanos sin compromiso.";919388906;Calle del Pintor Rosales;350000;4;Ensanche, Alcobendas;PRIMER NIVEL INMOBILIARIA;Profesional;-;Alcobendas;Ensanche;-;2869;122;2;3;Sí;No;Sí;Sí;No;No;Sí;No;No
101567573;Piso en Calle de los Naranjos;Piso;"ESTUPENDO PISO COMPLETAMENTE REFORMADO JUNTO AL PASEO DE LA CHOPERA! Oportunidad precioso piso reformado. La vivienda está compuesto por 3 habitaciones, salón comedor, cocina con tendedero, baño completo y terraza. Distribuido en Hall de entrada, a continuación podemos encontrar la zona de distribución de los 3 dormitorios, el principal con gran tamaño armario empotrado y terraza, la cual dispone de toldos, las otras dos habitaciones de tamaño idóneo para completar la vivienda. Baño completo reformado íntegramente y con plato de ducha además de contar con ventilación añadida. Salón comedor independiente, al cual se le añadió la terraza para poder ganar mas espacios. La cocina también ampliada con parte de la terraza cuenta un una perfecta distribución y tendedero acristalado. Totalmente reformada es una vivienda lista para entrar a vivir. con ventas nuevas oscilobatientes de rotura térmica, suelos de tarima, gas natural independiente, cocina y baño nuevos. la vivienda tiene una situación privilegiada, ya que en los alrededores de la vivienda podemos encontrar todo tipo de servicios y comercios que se pueden imaginar. Gracias a su ubicación Junto a la menina, a menos de 2 minutos andando del centro comercial de la Vega. Encontramos Centro Comercial Plaza Norte a 5 minutos, así como la salida a la carretera de Burgos (A-1), y todo el trasporte necesario en la misma puerta. ¡No dejes pasar la ocasión y contacta con nuestro equipo comercial para organizar tu vista!";949728042;Calle de los Naranjos;198000;3;Alcobendas Centro, Alcobendas;Procolbi Inmobiliaria;Profesional;-;Alcobendas;Alcobendas Centro;-;2870;69;1;2;No;No;No;Sí;No;No;No;No;No
102258229;Piso en Calle de Antonio Méndez;Piso;"PRIMER NIVEL VENDE piso exterior con una gran luminosidad ubicado en el centro de Alcobendas. Se encuentra a escasos metros de la estación de tren, líneas regulares de autobuses, así como a unos minutos de la parada de metro de Marqués de la Valdavia. Su distribución es la siguiente: 3 habitaciones, amplio salón-comedor con terraza, cocina americana, recibidor y un baño.  El inmueble está dotado de calefacción individual y aire acondicionado parcial. Sus suelos son de porcelánico y sus ventanas de PVC climalit oscilobatientes.  Tanto la fontanería, como la electricidad y la vivienda como tal han sido reformados recientemente, lo cual le dota de muy buenas condiciones de habitabilidad.  Si necesitas financiación no dudes en consultarnos. ¡Desde hace 20 años consiguiendo las mejores condiciones hipotecarias del mercado!";919388906;Calle de Antonio Méndez;182000;3;Alcobendas Centro, Alcobendas;PRIMER NIVEL INMOBILIARIA;Profesional;-;Alcobendas;Alcobendas Centro;-;2800;65;1;3;No;No;No;Sí;No;No;Sí;No;No
101256350;Piso en Marques De La Valdavia;Piso;"PRIMER NIVEL INMOBILIARIA VENDE este piso de 3 habitaciones con una excelente ubicación en la calle Marqués de la Valdavia, a escasos metros de la estación de METRO. Todas las estancias son exteriores, incluidos los 3 dormitorios que son de gran tamaño, admitiendo una cama doble. Tiene una enorme terraza con orientación Sur, lo que le confiere una muy buena luminosidad todo el día. Además, desde la terraza podemos disfrutar de unas bonitas vistas libres de edificaciones y con la urbanización La Moraleja al fondo. Dispone de aire acondicionado en el salón, el suelo es de parquet y dispone de puerta principal acorazada. Ubicado en una zona tranquila, en una avenida principal de gran anchura, próxima a todos los servicios y bien comunicada. El inmueble se vende sin ascensor, aunque ya se ha tratado la instalación futura en Junta de Propietarios y parece que se cumplen los requisitos técnicos para su instalación, aunque de momento no hay nada aprobado. Si necesitas financiación, no dudes en consultar nuestras condiciones.";919388906;MARQUES DE LA VALDAVIA;149000;3;Alcobendas Centro, Alcobendas;PRIMER NIVEL INMOBILIARIA;Profesional;-;Alcobendas;Alcobendas Centro;-;2258;66;1;4;No;No;No;Sí;No;No;Sí;No;No
100848835;Piso en Calle de Francisco Largo Caballero;Piso;"Reino Inmobiliario ofrece en exclusiva vivienda en la zona de Valdelasfuentes, una de las mejores zonas de Alcobendas. La vivienda se distribuye en amplio hall de entrada, un fantástico y acogedor salón comedor, cocina amueblada y equipada, 3 dormitorios y dos baños completos ( uno de ellos es suite principal). Armarios empotrados en todos los dormitorios. Aire Acondicionado en salón y dormitorio principal. En el precio de venta se incluyen dos plazas de garaje y trastero. Toda la urbanización esta adaptada para personas con movilidad reducida (rampas y ascensores), dispone de servicio de conserjería. Se encuentra a pocos metros de la Estación de RENFE Valdelasfuentes y Estación de Metro Manuel de Falla, junto a la Ciudad Deportiva de Valdelasfuentes supermercados ( Mercadona, Ahorramas, Lidel, Dia etc) ambulatorio, comercios de todo tipo a su alrededor, restaurantes, bares. La zona cuenta con una fantástica zona de paseo, a escasos metros del colegio Bachiller Alonso y también de parques infantiles para los más pequeños. ¡Anímate a visitar este inmueble y no pierdas esta oportunidad! Certificados de consumo energético y de emisión energética pendientes de revisión. Financiamos hasta el 100% de la vivienda, Asesoramiento Financiero GRATUITO. Si desea cualquier información adicional o visitar este inmueble no dude en contactarnos.";910376164;Calle de Francisco Largo Caballero;305000;3;Norte, Alcobendas;REINO INMOBILIARIO Y FINANCIERO;Profesional;-;Alcobendas;Norte;315000;3050;100;2;1;Sí;No;No;No;Sí;Sí;Sí;Sí;No
101081231;Piso en Calle de Ruperto Chapí s/n;Piso;"Inmobiliaria Garsan Alcobendas pone en venta espectacular vivienda totalmente reformada de 126 m² con 4 dormitorios, terraza descubierta y plaza de garaje en la calle Ruperto Chapí en Alcobendas. 28100. Madrid. - DISTRIBUCIÓN: Amplio hall recibidor de 6 m² con armario empotrado. Cocina totalmente amueblada de 12 m², con electrodomésticos (a excepción de nevera) y salida a terraza tendedero acristalada. Salón comedor independiente de 25 m² con  salida a terraza descubierta de 6 m². 4 dormitorios de 14 m², 12 m², 12 m² y 7 m² 3 de ellos con armario empotrado. 2 Cuartos de baño completos, el de suite con bañera y el de servicio con plato de ducha y mampara. - CALIDADES: Vivienda muy luminosa. Puerta de entrada blindada. Suelos de tarima. Carpintería interior lacada en blanco. Doble ventana de climalit. Las encimeras de la cocina son de silestone y las del baño principal de mármol. Calefacción individual de Gas Natural. A/A en un dormitorio. Toldo en perfecto estado en la terraza. La vivienda está en perfecto estado, electricidad y fontanería reformado en 2017. - EDIFICIO: La vivienda se encuentra en una cuarta planta con ascensor. Se vende con una plaza de garaje situada en el mismo edificio. Año de construcción 1989. - GASTOS: Comunidad: 120€/mes. I. B. I. : 435€. - SITUACIÓN: La vivienda se encuentra en la calle Ruperto Chapí, detrás del c. c. La Gran Manzana y ayuntamiento nuevo. A 2 min de la parada de Renfe y 5 minutos de la parada de Metro Manuel de Falla. Comercios, centro médico, policía, supermercados, colegios.. . Posibilidad de financiación a tu medida. No te quedes sin verlo!";919386216;Calle de Ruperto Chapí s/n;450000;4;Ensanche, Alcobendas;Inmobiliaria Garsan Alcobendas;Profesional;-;Alcobendas;Ensanche;-;3571;126;2;4;Sí;No;No;Sí;Sí;Sí;Sí;No;No
101167345;Piso en Calle Doctor Ángel Olivares;Piso;"LE CLÉ (Servicios Inmobiliarios) ofrece en exclusiva piso en Valdelasfuentes. La vivienda dispone de 2 dormitorios y 2 baños (uno de ellos en suite). Amplio salón comedor con salida a terraza. Cocina totalmente equipada con tendedero y acceso directo a la terraza. Armarios empotrados vestidos. Aire acondicionado en salón y dormitorios. Calefacción gas natural. Muchísima luz. Orientación Este. Plaza de garaje incluida en el precio. Urbanización cerrada con piscina de adultos e infantil y zona de juegos para niños. Portero físico. Muy bien ubicada, a 5 minutos de Renfe Valdelasfuentes y a escasos metros de Metro Norte. Zona muy consolidada con comercios, colegios, guarderías, centro de salud y polideportivo. Rodeado de parques y jardines. SIN COMISIÓN DE AGENCIA AL COMPRADOR.";916610167;Calle Doctor Ángel Olivares;372000;2;Norte, Alcobendas;Le clé (servicios inmobiliarios);Profesional;-;Alcobendas;Norte;-;3796;98;2;1;Sí;No;Sí;Sí;Sí;Sí;Sí;No;No
102303801;Piso en Paseo de la Chopera;Piso;"Exclusivo piso en rehabilitación ubicado en el barrio de Alcobendas, en Madrid. No cobramos comisiones, en Clikalia somos propietarios. La vivienda está ubicada en la 1 planta exterior con ascensor. Dispone de una superficie total de 78 m², distribuidos en salón y comedor, cocina independiente equipada, 3 dormitorios y 1 baños. Además, cuenta con ascensor, terraza, cocina amueblada y aire acondicionado. Situado en Alcobendas, en la Calle Paseo De La Chopera, una de las zonas más exclusivas de la ciudad, cuenta con una ubicación privilegiada que te permitirá estar cerca de todo lo que necesitas como el Parque de Andalucía, Parque Jardín de la Vega y del Museo Nacional de Ciencia y Tecnología. A su vez, hay varios restaurantes, supermercados, paradas de autobús y la estación de metro Marqués de la Valdavia (L10). Agenda tu vista presencial, te acompañamos en todo el proceso. Llámanos de lunes a viernes de 9.00h a 20.00h Posibilidad de financiación hasta el 100%. ¡Pregúntanos sin compromiso! Algunas de las estancias de la vivienda están siendo reformadas.";919388464;Paseo de la Chopera;245000;3;Alcobendas Centro, Alcobendas;Clikalia España;Profesional;-;Alcobendas;Alcobendas Centro;-;3141;78;1;1;Sí;No;No;Sí;No;No;Sí;No;No
101826725;Piso en Calle del Príncipe;Piso;"En pleno centro de Alcobendas, con todos los servicios en las inmediaciones y bien comunicado, presentamos éste piso de 66m2. Situado en la cuarta planta de un edificio de 4 alturas con ascensor, pero con altura real de quinto piso, que junto con su orientación dota al inmueble de mucha luminosidad. El recibidor da paso por un lado a la cocina independiente de gas natural, con caldera individual, equipada con armarios, nevera y lavadora y con una terraza cubierta al fondo. El salón comedor tiene salida a una fantástica terraza desde la que disfrutar de unas maravillosas vistas de Madrid y una pared con armarios empotrados. Cuenta con dos dormitorios de buen tamaño y un cuarto de baño peculiar estilo francés, con media bañera y lavabo por un lado y por otro lado en una estancia separada el WC. Suelos de parquet y ventanas de aluminio.";919380325;Calle del Príncipe;187000;2;Alcobendas Centro, Alcobendas;Bafre Inmobiliaria;Profesional;-;Alcobendas;Alcobendas Centro;197000;2833;66;1;4;Sí;No;No;Sí;No;No;No;No;No
