102187958;Piso en cañadas;Piso;"ROYAL HOUSE VENDE PISO CON REFORMA INTREGRAL A ESTRENAR  DESCRIPCION Piso situado en la primera planta del edificio, urb. Las Cañadas, consta de un amplio salón con acceso a terraza con vistas a zonas ajardinadas y piscina, cocina completamente reformada con tendedero incorporado, baño con ducha con mampara, mueble bajo lavabo y espejo. A estrenar, 3 amplios dormitorios y trastero.  La reforma se ha efectuado con materiales de primera calidad y estética moderna, suelos de tarima, carpintería lacada blanca, paredes lisas, calefacción y agua caliente de gas natural. La urbanización cuenta con zonas ajardinadas y piscina.  Situada estratégicamente, con acceso desde la Ctra. Alpedrete-Moralzarzal, frente a colegio público y Dehesa, a 200 metros supermercado, farmacia y comercios de proximidad y cerca del Hospital General de Villalba. A 5 minutos en coche estación Renfe Cercanías Villalba y parada de autobús Madrid y urbanos a 100 metros.  Inmejorables las opciones que ofrece por su ubicación, todos los servicios al lado, supermercado y hospital y naturaleza a 5 minutos.  En ROYAL HOUSE, NO COBRAMOS HONORARIOS AL COMPRADOR.  GESTIONAMOS SU FINANCIACION. En Royal House te asesoramos y acompañamos durante el proceso de compra de tu hogar ayudándote a conseguir la mejor financiación para ti. Lo más importante para nosotros es darte todas las garantías en tu compra. Tu tranquilidad es nuestro objetivo primordial. tu eliges la casa y nosotros nos ocupamos de todo lo demás Nuestro equipo destaca por su amplia experiencia, compromiso y dedicación, cercanía y profesionalidad. Trabajando con el objetivo de asegurar un proceso de compra-venta eficaz. Royal House, a tu lado desde 1992 en calle Real nº 33 de Collado Villalba, Madrid.";919380951;cañadas;185000;3;Dehesa - El Soto, Collado Villalba;ROYALHOUSE soluciones Inmobiliarias;Profesional;-;Collado Villalba;Dehesa - El Soto;-;2126;87;1;2;No;No;Sí;Sí;No;No;No;Sí;No
100663823;Piso en Calle Mariano Benlliure;Piso;"Muy bien ubicado en Collado Villalba en carretera Moralzarzal junto al colegio de los Maristas. Urbanización Peñanevada IV,  zona muy tranquila rodeada de naturaleza. Urbanización privada del año 1970, con  Zonas comunes con zonas ajardinadas, piscinas, pista de tenis y campo de fútbol. Vivienda en planta baja  exterior, orientación Norte-Sur, luminosa. Reformado. A estrenar. 3 dormitorios (9 m2, 7 m2 y 7 m2 respectivamente) dos de ellos tienen armario empotrado. 1 baño ducha.  Carpintería exterior de PVC con climalit. Suelos de tarima. Pintura Lisa.  Calefacción y agua caliente por  gas natural individual Bien comunicado  por BUS, (autobuses al zoco de Villalba).  Fácil acceso a A-6.";919415835;Calle Mariano Benlliure;160000;3;Villalba Pueblo, Collado Villalba;ASB inmobiliaria;Profesional;-;Collado Villalba;Villalba Pueblo;-;2192;73;1;bj;No;No;Sí;No;No;No;No;No;No
102229812;Piso en Los Altos De Villalba s/n;Piso;"SE VENDE MAGNIFICO PISO EN URB. LOS ALTOS DE VILLALBA CON 2 PLAZAS DE GARAJE Y TRASTERO INCLUIDOS EN EL PRECIO.  Magnifico piso en una de las mejores urbanizaciones de Villalba. El piso consta de 110m distribuidos en hall, 3 habitaciones con amplios armarios empotrados forrados en madera, 2 baños completos ambos con platos de ducha y uno de ellos incluido en dormitorio principal, cocina en perfecto estado con terraza tendedero, salon ampliado a terraza con vitas a los jardines.  Suelo de parquet, ventanas tipo climalit oscilobatientes, puertas de roble, pintura en liso en toda la casa.  2º planta con ascensor.  Orientacion Sur-este y Oeste.  EL PRECIO INCLUYE DOS PLAZAS DE GARAJE Y TRASTERO ( el trastero muy amplio de unos 9m aprox. ubicado junto las dos plazas de garaje) Zonas comunes con amplios jardines, piscina comunitaria con acceso desde el mismo portal, zona infantil. Colegio Cantos Altos a 200m, institutos 15m andando, buses, facil acceso A-6.  No dude en verlo. Llamenos y concierte una cita sin compromiso. No cobramos honorarios al comprador.  PRECIO NEGOCIABLE! CONSULTING 2001 INMOBILIARIA, 30 AÑOS A SU SERVICIO.  Nos encontrara en C/ Honorio Lozano num. 7 en Collado Villalba.";687001624;LOS ALTOS DE VILLALBA s/n;298000;3;Villalba Pueblo, Collado Villalba;GRUPO TORREJON 2000-CONSULTING;Profesional;-;Collado Villalba;Villalba Pueblo;-;2709;110;2;2;Sí;No;Sí;Sí;Sí;Sí;No;Sí;Sí
101822255;Piso en Batalla Bailen;Piso;"CONSULTING 2001 VENDE PISO EN URBANIZACION PARQUE SIERRA EN PLENO CENTRO DE COLLADO VILLALBA  proximo a todos los sevicios, con amplias zonas comunes, piscinas, tenis, zona infantil.  75 m distribuidos en hall, 3 habitaciones la principal con armario empotrado, baño completo nuevo con plato de ducha, salón con amplia terraza y bonita vistas a los jardines orientacion sur, lo que quiere decir que es muy soleado, cocina amueblada.  Calefaccion de gas natural.  3º planta. Parquesierra es una de las urbanizaciones mas centricas de Villalba, privada y cerrada, con portero y vigilancia. Dentro se encuentra un enorme parking de coches para los vecinos.  Se encuentra a 10 minutos caminando de colegios, comercios, bus y renfe.  No pierda la oportunidad de verlo. Llamenos y concierte una cita sin compromiso.   NO cobramos honorarios al comprador.  CONSULTING 2001 INMOBILIARIA, 30 AÑOS A SU SERVICIO.  Nos encontrara en C/ Honorio Lozano num. 7 en Collado Villalba.";687001624;BATALLA BAILEN;126000;3;Villalba Estación, Collado Villalba;GRUPO TORREJON 2000-CONSULTING;Profesional;-;Collado Villalba;Villalba Estación;-;1703;74;1;3;No;No;Sí;Sí;No;No;No;No;Sí
101571088;Piso;Piso;"REDPISO VILLALBA ofrece preciosa vivienda en Urbanización Entresierras, muy bien comunicada con todos los servicios, comercios, supermercados, colegios, y líneas de autobuses. En la urbanización podemos disfrutar de diferentes zonas comunes, amplios jardines, parques infantiles, pistas deportivas varias y piscinas. Según entramos a la vivienda nos encontramos un cómodo hall de entrada que comunica a la derecha con un estupendo office con acceso a la cocina muy luminosa totalmente equipada donde también podemos disfrutar de la terraza cerrada, continuando desde el hall entramos a un amplio salón con chimenea, y donde encontramos salida a la terraza muy amplia y que dado que es esquina es en L, continuando por la vivienda, encontramos un pasillo distribuidor de las habitaciones, la principal con baño en suite 3 piezas con plato de ducha y gran armario empotrado, siguiendo otros dos dormitorios, uno de ellos con armario, y por último un baño completo de 4 piezas con bañera que da servicio a estos dos últimos dormitorios. Con esta vivienda tenemos incluido un trastero. En REDPISO tenemos un departamento financiero DCREDIT, con asesoramientos gratuitos y financiación hasta el 100% según perfil.";910299398;Los Negrales;217000;3;Los Negrales, Collado Villalba;Redpiso;Profesional;-;Collado Villalba;Los Negrales;-;1808;120;2;3;No;No;Sí;Sí;No;No;No;Sí;Sí
102088188;Piso;Piso;"REDPISO VILLALBA ESTACION, ofrece piso en zona de La Estación de Villalba, comunicado con trasporte público, colegios, centros de salud, farmacias, etc. Según entramos a la vivienda llegamos al recibidor con armario empotrado, a la izquierda tenemos la cocina amplia y amueblada con tendedero, del recibidor al salón comedor con terraza cerrada y vistas a la sierra, por el pasillo tenemos un aseo y un baño completo con plato de ducha, 2 dormitorios con armarios empotrados y el dormitorio principal amplio con armario empotrado. Cuenta con suelos de parque, tarima flotante y gres cerámico, caldera de gas natural, carpintería roble, ventanas dobles de aluminio, gotelé, luces led, cableado y fontanería cambiados, la urbanización cuenta con piscina comunitaria y ascensor. En REDPISO disponemos de un departamento financiero DCREDIT con asesoramientos gratuitos, financiación de hasta el 100% según perfil.";910299398;Carlos Ruiz;169700;3;Carlos Ruiz, Collado Villalba;Redpiso;Profesional;-;Collado Villalba;Carlos Ruiz;-;1825;93;2;4;Sí;No;Sí;Sí;No;No;No;No;Sí
101715785;Casa independiente;Chalet;"REDPISO VILLALBA PUEBLO ofrece precioso Chalet Independiente en Collado Villalba, municipio ubicado al noroeste de la capital de Madrid, con servicios de transporte como RENFE y autobuses. Al ingresar nos encontramos con el jardín delantero en el que se ubica el garaje y la entrada principal de la vivienda. Una vez dentro, nos encontramos con el hall distribuidor que nos permite acceder hacia la izquierda a una cocina moderna y de gran capacidad de almacenaje. A la derecha el baño que cuenta con plato de ducha, ventana y armario, además de tener espacio para la lavadora. De frente el salón, amplio y muy luminoso con grandes ventanales y salida directa al jardín trasero. En éste encontramos la piscina de cloro y riego automático. Desde el salón, bajando un par de escalones, podemos pasar a un despacho al que le podría dar el uso que usted más desee. Seguidamente encontramos el dormitorio en planta baja, que cuenta con armario empotrado. Desde el hall, podemos subir a la planta alta por una bellísima escalera, la que posee una chimenea y una pequeña bodega bajo ella. Una vez arriba, pasando por la habitación principal de gran tamaño con armario empotrado, velux y ventanal, tenemos salida directa a la terraza. Además en suite contamos con un baño completo con bañera y ventana y otro dormitorio con altura de buhardilla. ¿Qué más se podría pedir? Si cuenta también con una parcela de 493m2! No espere más... visítela!";910299398;Fontenebro - Altavista;416000;3;Fontenebro - Altavista, Collado Villalba;Redpiso;Profesional;-;Collado Villalba;Fontenebro - Altavista;-;2225;187;2;-;No;No;Sí;No;Sí;Sí;No;No;Sí
99911411;Piso;Piso;"REDPISO VILLALBA ESTACIÓN, ofrece piso en Villalba municipio ubicado al noroeste de la capital de Madrid, con servicios de transporte como RENFE y autobuses, de 85 m2, primera planta. La entrada a pasillo recibidor, con cocina y tendedero cerrada y con estufa de pellets, caldera gas natural agua, donde pasamos a un amplio y luminoso dormitorio, del pasillo llegamos al salón comedor con salida a la terraza con trastero, y también a un distribuidor que da a dos dormitorios amplios, el dormitorio principal con aire acondicionado, y a el baño completo con plato de ducha y mampara, tiene suelo de tarima, puertas de pino, paredes lisas, calefacción de pellet. En REDPISO disponemos de un departamento financiero DCREDIT, con asesoramientos gratuitos y financiación de hasta el 100% según.";910299398;Carlos Ruiz;139000;3;Carlos Ruiz, Collado Villalba;Redpiso;Profesional;-;Collado Villalba;Carlos Ruiz;-;1562;89;1;1;No;No;No;Sí;No;No;No;No;No
102092701;Chalet adosado;Chalet;"REDPISO VILLALBA, ofrece chalet en Parque de la Coruña en excelente ubicación, cercano a renfe, colegios, supermercados, farmacia, etc. Según entramos a la vivienda nos encontramos con el garaje para un coche, continuamos y accedemos al recibidor que comunica con un aseo de invitados a la izquierda, a la derecha la cocina amplia y luminosa con zona de tendedero, y de frente un amplio salón con chimenea con acceso a un porche cerrado y terraza abierta donde accedemos a las zonas comunes de la urbanización. Continuamos en la siguiente planta, nos encontramos un pasillo distribuidor a la izquierda tenemos 2 dormitorios luminosos con armario empotrado y ambos con acceso a una terraza. Por la derecha un baño completo y el dormitorio principal con armario empotrado, baño en suite y terraza. Seguimos a la última planta y encontramos a la izquierda un dormitorio con baño en suite y a la derecha otro dormitorio. En la urbanización podemos disfrutar de piscina, zona infantil y zonas verdes. En REDPISO disponemos de un departamento financiero DCREDIT con asesoramientos gratuitos, financiación de hasta el 100% según perfil.";910299398;Parque de la Coruña - Las Suertes;379500;5;Parque de la Coruña - Las Suertes, Collado Villalba;Redpiso;Profesional;-;Collado Villalba;Parque de la Coruña - Las Suertes;-;1888;201;3;-;No;No;Sí;Sí;Sí;Sí;No;Sí;Sí
102092677;Chalet adosado;Chalet;"PRECIOSO CHALET REDPISO DE COLLADO VILLALBA, ofrece espectacular chalet adosado en la Urbanización Sitio de Doñana ubicado al noroeste de la capital de Madrid con servicio de transporte de RENFE y autobuses a 10 minutos andando. Cerca de supermercados, colegios, y parques. Accedemos a la vivienda por un patio delantero con garaje. Puerta de entrada al chalet de cristal blindado y puerta de acceso a la vivienda acorazada. Nada más entrar nos encontramos con un recibidor y un aseo, a la derecha se encuentra la cocina con tendedero, bajo las escaleras un pequeño armario y al final de la planta un amplio salón luminoso con chimenea con acceso a un patio trasero con puerta de acceso a las zonas verdes, zona infantil y piscina. En la primera planta nos encontramos con 3 dormitorios, 2 terrazas, con un baño completo y otro en suite. En la buhardilla hay otros 2 dormitorios con un baño con hidromasaje, sauna y aire acondicionado frio/ calor. Velux de la buhardilla con persianas eléctricas. En REDPISO disponemos de un excelente departamento financiero DCREDIT y financiación de hasta el 100% según perfil.";910299398;Parque de la Coruña - Las Suertes;389000;5;Parque de la Coruña - Las Suertes, Collado Villalba;Redpiso;Profesional;-;Collado Villalba;Parque de la Coruña - Las Suertes;-;1935;201;3;-;No;No;Sí;Sí;Sí;Sí;No;Sí;Sí
102184888;Piso en Calle de la Cruz;Piso;"HOGARES DE COLLADO VILLALBA, Vende un espacioso piso en la primera planta de 280 metros cuadrados, ubicado en la zona del Parque de La Coruña. Características destacadas de esta propiedad: Esta propiedad ofrece una generosa área de 280 metros cuadrados, brindándote infinitas posibilidades para crear el hogar de tus sueños. Dispone de 6 dormitorios, tendrás espacio más que suficiente para acomodar a toda la familia o incluso convertir algunas habitaciones en áreas de estudio, sala de juegos o cualquier otro espacio que desees. El salón y uno de los dormitorios cuentan con balcones que ofrecen vistas a la calle, permitiéndote disfrutar del aire fresco y la luz del sol mientras contemplas el entorno animado. Esta propiedad es una excelente oportunidad para los que buscan un proyecto de renovación. Con tu toque personal y una renovación, podrás convertir este piso en tu espacio ideal y aumentar su valor. Ubicación privilegiada: El piso se encuentra en la codiciada zona del Parque de La Coruña, donde podrás disfrutar de la naturaleza, los parques y la tranquilidad, mientras aún estás cerca de todos los servicios y comodidades urbanas. ¡No pierdas esta oportunidad única de adquirir un piso con tantas posibilidades en una ubicación privilegiada! Contáctanos para obtener más información y organizar una visita para ver todo el potencial que esta propiedad tiene para ofrecer. ¡Tu hogar ideal te está esperando en el encantador Parque de La Coruña!";919386676;Calle de la Cruz;239000;6;Parque de la Coruña - Las Suertes, Collado Villalba;Hogares Villalba;Profesional;-;Collado Villalba;Parque de la Coruña - Las Suertes;-;854;280;1;1;No;No;No;No;No;No;No;No;No
101324243;Piso en Paseo rio guadarrama;Piso;"ROYAL HOUSE VENDE sin HONORARIOS PARA EL COMPRADOR, Apartamento de 1 dormitorio Apartamento junto calle Real y puente del rio, 3 ª planta del edificio, 51 m² construidos, salón-comedor, cocina amueblada independiente, 1 dormitorio, baño completo, amplio armario empotrado, plaza de garaje en el mismo edificio. Tiene calefacción de gas natural y el suelo de parquet. Muy luminoso, finca muy cuidada.  Tiene una situación privilegiada, con vistas despejadas estando en el centro de la ciudad, a 4 minutos andando a la estación Renfe-Cercanías y autobús Madrid, al lado de comercios de todos tipos, farmacias, agencias viajes etc.  Alquilado actualmente, ideal para inversores.  ¡Pide cita sin compromiso! En Royal House no cobramos honorarios al cliente comprador, le acompañamos y asesoramos durante el proceso de compraventa y te ayudamos a conseguir financiación a tu medida. Nuestro equipo destaca por su amplia experiencia, compromiso y dedicación, cercanía y profesionalidad.  Trabajando con el objetivo de asegurar un proceso de compra-venta eficaz y seguro Royal House, a tu lado desde 1992.";919380951;Paseo rio guadarrama;119000;1;Villalba Estación, Collado Villalba;ROYALHOUSE soluciones Inmobiliarias;Profesional;-;Collado Villalba;Villalba Estación;-;2164;55;1;3;Sí;No;No;No;Sí;Sí;No;No;No
102323483;Piso en Calle real;Piso;"GRUPO HOGARES LOS BELGAS VENDE excelente vivienda en pleno CENTRO DE COLLADO VILLALBA. FINANCIACION 100% CON NUESTRO DEPARTAMENTO FINANCIERO "FINANHOGAR". Nada más entrar a la vivienda a mano izquierda encontramos un acogedor salón-comedor. De frente por el pasillo distribuidor se sitúa a mano derecha en primer lugar la cocina, totalmente equipada, y el cuarto de baño que da servicio a la vivienda, funcional y con muy buena iluminación. Al final del pasillo los dos dormitorios, amplios, muy luminosos y ambos con su armario empotrado. La vivienda está totalmente reformada. Ventanas PVC con cristal climalit doble y rotura de puente térmico. Se incluye en el precio de venta un trastero ubicado en la planta baja del mismo edificio. Ven a verlo sin compromiso!";919386676;Calle real;129900;2;Villalba Estación, Collado Villalba;Hogares Villalba;Profesional;-;Collado Villalba;Villalba Estación;-;1779;73;1;4;No;No;No;No;No;No;No;Sí;No
102192311;Casa independiente;Chalet;"REDPISO VILLALBA ESTACION, ofrece precioso Chalet ubicado en pleno centro de Villalba, con servicios de transporte como Renfe, autobuses urbanos e interurbanos, colegios, centro de salud, etc. Accedemos a la vivienda por un jardín delantero arbolado, que comunica con el garaje, por el lateral derecho accedemos a un patio trasero y al recibidor de la vivienda que distribuye a mano izquierda con el salón con chimenea y amplia terraza, por el lado derecho un dormitorio y la cocina, de frente tenemos un aseo de invitados y acceso por escalera a la primera planta. Desde esta estancia encontramos 3 amplios dormitorios, muy luminosos, 2 de ellos con armarios empotrados y otro con una terraza acristalada, también tenemos un baño completo que da servicio a los dormitorios. Por último, tenemos la buhardilla muy amplia y dividida en 2 habitaciones, dispone de calefacción por gasoil, tiene 487m2 de parcela. En REDPISO disponemos de un departamento financiero DCREDIT con asesoramientos gratuitos y financiación hasta un 100% según perfil.";910268840;Villalba Estación;369000;6;Villalba Estación, Collado Villalba;Redpiso;Profesional;-;Collado Villalba;Villalba Estación;380000;2027;182;2;-;No;No;No;Sí;Sí;Sí;No;Sí;Sí
97330138;Piso en Camino molino, 12;Piso;"CONSULTING 2001 VENDE PISO EN URB. LOS FRESNOS CON PLAZA DE GARAJE Y TRASTERO  Para entrar a vivir, piso con 93 metros distribuidos en hall, 3 habitaciones con armarios empotrados, salon con amplia terraza, cocina con terraza-tendedero cerrado, 2 baños completos. Suelo parquet, dobles ventanas, calefaccion gas natural. PLAZA DE GARAJE Y TRASTERO.  1º Planta. Amplios jardines, piscina, zona infantil canchas de tenis. Proximo a Poligono P-29. Bus urbano y a Madrid. Facil acceso a A-6.    No dude en visitarlo. Llamenos y concierte una cita sin compromiso.";687001624;Camino molino, 12;169000;3;Carlos Ruiz, Collado Villalba;GRUPO TORREJON 2000-CONSULTING;Profesional;-;Collado Villalba;Carlos Ruiz;-;1878;90;2;1;No;No;Sí;Sí;Sí;Sí;No;Sí;Sí
101527861;Casa independiente en Calle Esgueva, 8;Chalet;"CONSULTING 2001 INMOBILIARIA VENDE ZONA ALTAVISTA. Estupendo independiente con 320m en parcela de 720m, distribuido en tres plantas, . Vistas a la sierra. * Primera planta: hall, amplio salón de 40m con salida al porche de 20m, 2 dormitorios dobles, baño, cocina. * Segunda planta: 2 dormitorios dobles con amplios armarios empotrados, baño y vestidor, uno de ellos con terraza y estupendas vistas a la sierra. * Semisotano: dos salones de 40m cada uno, dormitorio con armario empotrado, baño completo, cocina, 2 trasteros. Esta planta está a nivel de la parcela, por lo que tiene luz natural. Acceso directo a la parcela. Jardín con amplia piscina a la cual se accede directamente desde el porche. Vivienda totalmente renovada hace 4 años, con estupendas calidades. Mejor verlo. No dude en llamarnos y concertar una visita. Preguntar por Manuela  CONSULTING 2001 30 años a su servicio.";687001624;Calle ESGUEVA, 8;499000;5;Fontenebro - Altavista, Collado Villalba;GRUPO TORREJON 2000-CONSULTING;Profesional;-;Collado Villalba;Fontenebro - Altavista;-;1559;320;4;-;No;No;Sí;Sí;Sí;Sí;No;Sí;Sí
102054345;Piso en Calle Mirador Sierra de Madrid;Piso;"Luminoso y acogedor piso semiamueblado en muy buen estado, recién pintado, en el Mirador de la Sierra, a cinco minutos andando a Villalba Pueblo.  Distribuido en: hall de entrada, cocina amueblada con electrodomésticos, vitrocerámica inducción, caldera, microondas y campana extractora a estrenar, salida a terraza tendedero acristalada. Amplio salón-comedor con chimenea y pequeña terraza orientación muy tranquila, 4 dormitorios, 1 baño completo con mampara a estrenar y 1 aseo. Calefacción gas propano con caldera Ferroli a estrenar. Carpintería exterior de aluminio doble ventana con climalit. Puertas interiores de roble y principal blindada. Suelos de gres. Alarma en toda la vivienda, incluido sensores en ventanas. Proyecto de aislamiento fachada edificio. Ascensor en entreplantas, y trastero. Rodeado de parque infantil, baloncesto, futbol y zonas verdes con gran aparcamiento público en la zona. Club social con tenis, padel y piscina (el uso de esta es a contratar anualmente, independiente de la comunidad).   ¡Mejor visitar, una vivienda ideal! Web: inmoanagarcia. com.";919384131;Calle Mirador Sierra de Madrid;205000;4;Fontenebro - Altavista, Collado Villalba;GESTIÓN INMOBILIARIA ANA GARCÍA;Profesional;-;Collado Villalba;Fontenebro - Altavista;-;2010;102;2;1;Sí;No;Sí;Sí;No;No;No;Sí;Sí
101300875;Piso en Real, 57;Piso;"CONSULTING 2001 VENDE MAGNIFICO PISO CON 160M DE ESQUINA EN URBANIZACION ALBASIERRA. Una de las mejores urbanizaciones y mas centricas de Villalba ubicada en calle Real.  Con unas vistas increible y muy luminoso. La casa consta de 4 habitaciones todas ellas dobles, armarios, 2 baños, salon y cocina de 20m. Toda la casa con ventanas tipo climalit oscilobatientes, puertas roble, suelo de tarima flotante. 2º planta con ascensor.  El precio incluye PLAZA DE GARAJE y trastero. Antiguamente tenia uso de gestoria y buffet de abogados. Zonas comunes con piscina, tenis, zona infantil. Parking comunitario privado y vigilancia nocturna.  A 100m de la parada de autobuses EL ZOCO, 5' de renfe, comercios, facil accesor A-6.  Mejor verlo! No dude en visitarlo. Llamenos y concierte una vista.  CONSULTING 2001 No cobra honorarios a la parte compradora. CONSULTING 2001 INMOBILIARIA, 30 años de experiencia a su servicio. Nos encontrara en Calle Honorio Lozano, nº7 en Collado Villalba.";687001624;REAL, 57;290000;4;Villalba Estación, Collado Villalba;GRUPO TORREJON 2000-CONSULTING;Profesional;-;Collado Villalba;Villalba Estación;-;1813;160;2;2;Sí;No;Sí;Sí;Sí;Sí;Sí;Sí;Sí
102245488;Piso;Piso;"PARQUECASA VENDE bonito dúplex en urbanización de Villalba pueblo. La vivienda que se encuentra en perfecto estado para entrar a vivir, se distribuye en dos plantas.  En la planta baja encontramos amplio distribuidor con dos armarios (uno de gran capacidad), aseo de cortesía (actualmente utilizado como cuarto de lavado), amplia cocina totalmente amueblada y luminoso salón independiente.  Una bonita escalera de madera nos conduce a la zona de descanso donde encontramos dos dormitorios dobles, uno de ellos con baño en suite y otro baño más. Además disponen de armarios empotrados totalmente forrados y vestidos.  Todas las estancias se encuentran en perfectas condiciones. Calefacción individual de Gas Natural, aire acondicionado en el salón y dormitorio principal, suelos de tarima maciza, ventanas de pvc con climalit y mosquiteras.  La casa dispone de un patio de uso privativo para dos vecinos. El dúplex, tiene incluida en el precio una amplia plaza de garaje en la que entran dos coches, además de un trastero.  Se encuentra en una urbanización muy tranquila con una agradable piscina, zona de juegos infantiles y portero físico. Destacar de la vivienda que tiene una ubicación inmejorable, con todos los servicios básico ( supermercados, farmacia, centro de salud, colegios, parada de autobús, etc. ) a escasos metros. Si estás pensando en comprar una vivienda en la sierra de Guadarrama, en zona tranquila, esta es una buena oportunidad. No dudes en llamarnos para visitarla o ampliar información. PARQUECASA, Asesores Inmobiliarios especializados en la Sierra de Madrid. REF. 253V.";919389220;Villalba Pueblo;250000;2;Villalba Pueblo, Collado Villalba;Parquecasa;Profesional;-;Collado Villalba;Villalba Pueblo;-;2083;120;3;1;Sí;No;Sí;No;Sí;Sí;Sí;Sí;No
101988718;Piso en eras, 14;Piso;""***inmueble el venta desde el día 19/07/2023 al 02/08/2023*** venta en período de pujas al alza. Se venderá a la puja más alta. "***VIVIENDA PROCEDENTE DE BANCO*** " GARSIERRA. Distribuido en salón-comedor, cocina, tendedero, 3 dormitorios, 2 baños y terraza. Orientación sur. Edificio con ascensor. Instalaciones comunitarias de piscina, instalaciones deportivas, zonas ajardinadas, zona de recreo para niños. Garaje". ". ".";919388504;eras, 14;203300;3;Los Valles, Collado Villalba;Garsierra;Profesional;-;Collado Villalba;Los Valles;-;2420;84;2;bj;Sí;No;Sí;Sí;Sí;Sí;No;No;Sí
