101822683;Casa independiente en Calle Torrelaguna;Chalet;"VIVIENDA MADRID Les presenta EN EXCLUSIVA una vivienda independiente que se encuentra situado sobre una parcela de 12.360 m2 y de vivienda 432m2 ubicada en una excelente localidad, por su tranquilidad y privacidad. Posee 8 Habitaciones, 2 Cocinas (las cocinas se pueden acondicionar para habitaciones) y mucho más, continúa leyendo para más información. Excelente oportunidad para un negocio (está abierta esta posibilidad para las empresas). Al acceder a la casa a través de su robusta puerta principal de madera, nos encontramos con un pasillo que da acceso atravesando la puerta a la planta baja de la vivienda y unas escaleras que dan acceso a la segunda planta de la vivienda. La primera planta, Cuenta con un salón-comedor amplio y muy luminoso para poder disfrutar de reuniones en familia de forma cálida y con fácil acceso a la finca de la vivienda. Luego, contamos con una gran cocina muy cómoda, TRES (3) habitaciones y un baño con su bañera. La segunda planta, cuenta con un salón, un comedor, una cocina (por reformar), una terraza y CINCO (5) habitaciones, estas estancias están unidas por un pasillo. Los explicamos de la siguiente forma, por un lado, una elegante sala o despacho con grandes ventanales y una chimenea que proporciona calor a toda la segunda planta gracias a su turbina de gran potencia y también da acceso a la terraza. La terraza tiene vistas Suroeste (con vistas a la espectacular cierra de Madrid) y conecta con el salón y el pasillo. Al volver al pasillo, de primero (lado derecho), tenemos una habitación con excelentes vistas Noreste, puerta de madera y armario empotrado y esta habitación tiene un baño incluido con una gran ventana que ofrece una buena vista. En el pasillo, de segundo (lado derecho), tenemos un baño completo con bañera y una ventana amplia por la que se logra obtener una bonita vista al Noreste.  En el pasillo, de tercero (lado derecho), tenemos una habitación con una ventana amplia por la que se logra obtener una bonita vista del Noreste de España. En el pasillo, de cuarto tenemos una habitación excelente con sus buen armario empotrado y buenas vistas. De quinto (lado derecho), tenemos un comedor que permite compartir buenos momentos con toda la familia o muchos amigos alrededor de la mesa y una gran ventana que da vistas muy bonitas a la finca y son dirección Este. En el pasillo, de primero (lado izquierdo), tenemos una habitación, con armario empotrado, una ventana que da vistas a la terraza y dirección Suroeste. En el pasillo, de segundo (lado derecho), tenemos una habitación amplia con excelentes vistas Suroeste, puerta de madera y armario empotrado. En el pasillo, de tercero (lado derecho) Tenemos la cocina que es muy amplio, tiene una ventana que te permite ver toda la finca y unas vistas muy bonitas hacia el Este de España, la cocina también tiene una puerta que permite el acceso a la terraza de la vivienda. Al final del pasillo en la segunda planta, se encuentra una puerta que es un armario que puede darnos múltiples finalidades según las necesidades particulares de sus residentes. La planta del sótano más cuarto de caldera con un garaje cerrado de capacidad para tres vehículos, motos y bicicletas. Se comunica por unas escaleras con la cocina de la primera planta. También posee una estancia grande independiente que puede funcionar como almacén. En el exterior y desde el porche que tiene orientación Este -Oeste, se disfruta de unas vistas totalmente despejadas de todo el entorno con capacidad para un jardín encantador y zona de barbacoa. También cuenta con un cuarto que se actualmente se desarrolla como salón de juego para la gente joven, se podr&.";919383485;Calle Torrelaguna;999000;8;-;Vivienda Madrid Algete;Profesional;-;Fuente el Saz de Jarama;-;-;2313;432;3;-;No;No;No;Sí;No;No;No;Sí;Sí
101977586;Casa independiente en Avenida del Pilar;Chalet;"JLC lanza promoción de obra nueva en Fuente el Saz de Jarama. Si te gusta este municipio y quieres una vivienda construida para ti es tu oportunidad. La parcela se encuentra localizada cerca de la parada de autobús número 197 que te comunica con Madrid Plaza castilla, Hospital la Paz, Hospital Infanta Sofia, Algete, Valdetorres, Talamanca, Valdepiélagos, Caraquiz, El Espartal, Torrelaguna, Redueña, Torremocha y Patones en 55 minutos. Así mismo, también está cerca de Armarios Arte Norte. El solar hace esquina, tiene salida a las dos calles.  Así mismo, tendrás el campo cerca, vistas a la naturaleza, y gozarás de su tranquilidad. No hay nada construido, por lo que podrás elegir la distribución, si quieres 3 o 4 habitaciones, ven a asesorarte sobre los detalles. En el precio se contempla: - VIVIENDA de obra nueva de 133, 02 m². - PARCELA grande dentro del casco urbano de Fuente el Saz. - Sistema de AEROTERMIA tanto para calor como para frio, tecnología que extrae energía contenida en el aire exterior gracias a un sistema de bombas. - Estudio GEOTÉCNICO y TOPOGRÁFICO de la parcela. - PROYECTO y dirección de obra. - LICENCIA de obra. - VALLA FRONTAL. - 40 metros de HORMIGÓN fratasado. JLC Construcciones es una empresa avalada con más de 20 años de experiencia, que ha subsistido a todas las crisis, cuenta con Estudio de Arquitectura propio. Nuestra labor principal es gestionar todos los trámites necesarios para la realización de la obra cumpliendo con todas las normativas del Código Técnico de la Edificación. En las imágenes del anuncio, hemos puesto grandes construcciones realizadas por JLC en los años anteriores. Solicítanos más información. Te esperamos. Nuestra web inmobiliaria para que eches un vistazo a nuestras parcelas: También tenemos Facebook: JLC Inmobiliaria Nuestra web de construcción: www. jlconstruccion. es También tenemos Facebook: JLC Construcciones Ref. 681.";949721650;Avenida del Pilar;541812;3;-;JLC Inmobiliaria;Profesional;-;Fuente el Saz de Jarama;-;-;4881;111;1;-;No;No;No;No;Sí;Sí;No;No;Sí
91865539;Casa independiente;Chalet;"Chalet independiente 470 M2 construidos amueblado, una finca rustica de 7000M2, muy luminosa con todas las orientaciones, 5 dormitorios, dormitorio principal tipo suite con baño incorporado más armarios empotrados, 2 cuartos de baños amplios, salón independiente con chimenea de leña, cocina con office, plaza de garaje, trastero, bodega, despensa, horno de leña, barbacoa, pozo de agua potable con escrituras y ningún otro vecino puede hacer otro a 200 metros de distancia, piscina, calefacción individual de gasolio, árboles frutales, huerta de variedad de hortalizas, viñedo, etc.  La vivienda, completamente amueblada, en perfecto estado, tiene útiles 400 M2, consta de dos plantas, con cuatro dormitorios y dos baños, amplia cocina y salón con chimenea, calefacción en toda la vivienda, despensa y piscina climatizada. El garaje está distribuido en una planta de 118 M2. La finca es una parcela de gran extensión, 7000 M2, muy bien cuidada, en la que nos encontramos jardín, árboles frutales, huerto, un pozo particular con autonomía de agua potable con los correspondientes controles homologados, un horno construido en piedra, una nave de 73 M2, y gran capacidad para animales, caballos. La zona es privilegiada porque cuenta con todos los servicios, ayuntamiento, centro de salud, oficina bancarias, colegios bilingue, guarderías infantil, estación de servicios de gasolina, restaurantes, bares, oficina de correo, centros comerciales, supermercados carrefour, mercadona, día, fruterías, panadería, vigilancia de policía municipal y guardia civil, también está muy bien comunicado parada de autobuses que van a Madrid, a una distancia de 300 metros, tiene el aeropuerto a 25 km, el hospital Infanta Sofia a 14 km y 35 km a Madrid.";916636276;Fuente el Saz de Jarama;1150000;5;-;Gelma;Profesional;-;Fuente el Saz de Jarama;-;-;2447;470;2;-;No;No;Sí;Sí;Sí;Sí;No;Sí;Sí
101154328;Dúplex;Duplex;"RHINOHOUSE NORTE. , S. L ofrece en exclusiva bonito y luminoso dúplex en Fuente el Saz de Jarama (Madrid) El dúplex cuenta con dos plantas. En la primera encontramos el salón, cocina de buen tamaño y un aseo. La segunda planta consta de 3 dormitorios y un baño. El piso dispone de calefacción central con contador individual. Cuenta también con una plaza de garaje grande. Zona tranquila cerca del centro de salud, comercios y salida para Madrid, tanto por la ctra. que va hacia Algete como por el desdoblamiento hacia Madrid. Muy cerca dispone de un Mercadona.  Fuente el Saz dispone de colegio e instituto. Si no dispone de coche consta con autobuses cada 20- 30 minutos como por ejemplo la líneas 197 y el 184. No dude en llamar y concertar su visita. POSIBILIDAD DE FINANCIACION 100% + GASTOS, NO PIERDAS LA OPORTUNIDAD DE OBTENER TU VIVIENDA.";919384833;Fuente el Saz de Jarama;160000;3;-;rhinohouse;Profesional;-;Fuente el Saz de Jarama;-;-;1468;109;2;1;No;No;No;No;Sí;Sí;No;No;No
102092456;Casa independiente;Chalet;"Grupo Nido capital te presenta Residencial Orighen, en Fuente el Saz de Jarama, a menos de 50km de la Sierra de Madrid y en uno de los municipios en expansión de la capital, totalmente consolidado, con perfecta comunicación y todos los servicios necesarios sin renunciar a un marco natural envidiable.    Residencial Orighen es comienzo, la raíz de aquello que quieres o añoras, el principio o la causa de una nueva forma de vida, lejos del ruido de la ciudad y de su frenético ritmo. 16 viviendas unifamiliares con aparcamiento privado, extensos espacios al aire libre, con jardines y terrazas individuales, posibilidad de tener tu propia piscina, en la que tu familia disfrutará de los largos días de verano. Unos interiores que evocan sofisticación y vanguardia, espacios comunes con gran amplitud, salón-comedor con posibilidad de dejar la cocina unida o independiente, que además dispone de lavadero, 3 amplios dormitorios, con buena geometría, para que cada miembro de la familia tenga su espacio.     Viviendas con la más alta calificación energética, gracias al sistema de aerotermia para agua caliente sanitaria y calefacción, con termostatos individuales en salón-comedor y dormitorios, acompañado de suelo radiante para una mayor eficiencia y ventilación interior de manera mecánica para asegurar un confort absoluto.    ¿Quieres saber más?    Nuestra referencia: ORIGHEN V10 Información solo telefónica, presencial o vía mail Liverso Inmobiliaria Aranda Tf. ¬-  Jardines de D. Diego, Aranda de Duero (Burgos) 09400.";947841065;Fuente el Saz de Jarama;379900;4;-;Liverso Inmobiliaria;Profesional;-;Fuente el Saz de Jarama;-;-;2331;163;3;-;No;No;No;No;No;No;No;No;Sí
81900226;Dúplex en Calle Grande, 22;Duplex;"Amplio duplex con una superficie de 95 m² aprox, se compone de 3 habitaciones dobles con armarios empotrados y principal con aire acondicionado, 2 baños completos uno con bañera y otro con ducha en la primera planta, y en la planta principal, 1 aseo, amplia cocina independiente amueblada y con terraza tipo tendedero/despensa, comedor independiente con balcón y aire acondicionado, los suelos son parquet y gres, garaje (1 plaza), calefacción independiente por gas natural, puerta blindada, portero automático, vidrios dobles, gastos comunidad 81 € aprox. , carpintería exterior aluminio lacado marrón, carpintería interior roble, soleado, piscina comunitaria, Estado certificación: En trámite, INFORMATE!.";919385276;Calle Grande, 22;172900;3;-;Consulting inmobiliario c&h;Profesional;-;Fuente el Saz de Jarama;-;-;1820;95;3;1;No;No;Sí;Sí;Sí;Sí;Sí;No;No
99643712;Piso en Calle Grande;Piso;"GRUPO REIN pone a su disposición vivienda en Edificio situado en el municipio de Fuente el Saz de Jarama, provincia de Madrid. Tiene una superficie de 116 m2 registrales, distribuidos en salón, comedor, cocina, dos dormitorios y 1 baño.     El entorno dispone de los servicios mínimos (suministro de energía eléctrica, abastecimiento de agua, acceso rodado y evacuación de aguas residuales) encontrándose en un buen estado de conservación). Dispone también de equipamiento como comercial, escolar y sanitario. Las comunicaciones del entorno con el resto de la población pueden considerarse buenas. Las comunicaciones interurbanas pueden considerarse suficientes.    Para ver este y más inmuebles puede visitar nuestras plataformas en redes sociales de Facebook y en nuestra web " o bien llamándonos al.";919384319;Calle Grande;165000;2;-;Grupo Rein;Profesional;-;Fuente el Saz de Jarama;-;-;1422;116;1;1;No;No;No;No;No;No;No;No;No
101827793;Chalet adosado en Bodegas, 18;Chalet;"Casa de pueblo con reforma, hecha la mejora en el año 2022, en Fuente el saz de Jarama municipio de la Comunidad de Madrid. El hogar cuenta actualmente con un salón-comedor amplio y luminoso, con con cocina americana, un dormitorio de matrimonio con armario empotrado y un baño con ducha. Así mismo, la vivienda tiene una bodega, de 36m2, que la convierte en única. Las calidades de la vivienda son: calefacción eléctrica, ventanas PVC y puerta blindada. Fuente el saz de Jarama es un municipio que limita con Algete, Valdetorres de Jarama y el Casar.  Se encuentra en el Noreste de la Comunidad de Madrid, gozando de una excelente comunicación con la capital: las principales vías de acceso son la A-1, la M-50, la R2 y la M-111 que da acceso a Barajas. Servicio Publico de trasporte a Madrid-Plaza Castilla (autobús 184 y 197). El municipio dispone de dos guarderías y un colegio publico educación infantil, primaria y secundaria. Además de diferentes comercios, tendrás todos los servicios a mano. Es una gran oportunidad calidad precio. Les esperamos.";919389986;Bodegas, 18;125000;1;-;Eurobuilder Inmuebles;Profesional;-;Fuente el Saz de Jarama;-;-;1453;86;1;-;No;No;No;No;No;No;No;No;No
101933669;Dúplex en Almendralejos s/n;Duplex;"Construiremos un precioso dúplex donde poder vivir cómodamente: la distribución de los espacios comunes se encuentra en el piso de abajo, gozando de mayor intimidad para los espacios más privados en el piso de arriba. Tendrás piscina comunitaria, parking individual, y trastero. Y en la propia vivienda, gozarás de dos terrazas individuales en las habitaciones. Entrando a la vivienda tenemos el salón-comedor (16,24 m²), un armario empotrado para almacenaje, y un aseo para invitados. Cocina independiente (8,75 m²), se vendería con mobiliario, existiendo la posibilidad de modificarlo bajo acuerdo. Y un tendedero anexo (9,57 m²) para mayor amplitud. En la segunda planta, subiendo por unas escaleras, tenemos un distribuidor que comunica con un baño completo (3,77 m²) para las habitaciones con bañera propia, y dos dormitorios (de 15,12 m² y 12,06 m² respectivamente) con armarios empotrados y terrazas individuales para disfrutar de la calle. Tendrás iluminación todo el día y disfrutarás de las vistas a la calle. Fuente el Saz de Jarama es un municipio donde puedes contar con todos los servicios, centro de Salud, 3 centros veterinarios (uno de ellos 24 horas) y residencia canina, guarderías, colegios e instituto, y múltiples comercios. Excelente comunicación tanto de transporte público (184 y 192), como de carreteras con la capital, las principales vías de acceso son la A-1, la M-50, la R2 y la M-111 que da acceso a Barajas (30 minutos). Precio cerrado con llave en mano. Examinamos la viabilidad de tu operación. Para más asesoramiento, solicítenos información. (Imágenes proyectadas).";919389986;Almendralejos s/n;225000;2;-;Eurobuilder Inmuebles;Profesional;-;Fuente el Saz de Jarama;-;-;2586;87;2;1;No;No;Sí;Sí;Sí;Sí;No;Sí;No
98203916;Chalet adosado en Bodegas, 10;Chalet;"Amplia casa de pueblo con patio, salón acristalado, garaje y cobertizo. Dispone de 6 habitaciones, 2 salones, 2 baños y cocina..";919383913;Bodegas, 10;250000;6;-;alfa fuente el saz;Profesional;-;Fuente el Saz de Jarama;-;-;850;294;2;-;No;No;No;No;Sí;Sí;No;Sí;Sí
101463661;Chalet pareado;Chalet;"Chalet pareado de 390,00 m2 sobre parcela de 500,00 m2. De reciente construcción y listo para entrar a vivir.  Consta de cuatro plantas. En la primera planta nos encontramos un comedor de grandes dimensiones, chimenea, grandes ventanales, cocina completamente equipada, porche cerrado con vistas al jardín, cuarto de baño de cortesía y una habitación de  varios usos. Planta primera 4 habitaciones, una de ellas en suite, todas con armarios empotrados y vestidos, habitaciones muy espaciosas y  luminosas. Planta buhardilla, habilitada para sala de estudios, habitación, otros usos y baño completo. Planta sótano. Amplio garaje para dos coches, trastero y sala de lavado.  Depósito  de gasoil de 1000 litros, caldera, aire acondicionado en todas las estancias persianas robotizadas eléctricas, puerta cochera mecanizada, porche acristalado, jardín con césped, plantas y árboles ornamentales.  La casa se encuentra a pocos metros del centro de Fuente el Saz de Jarama. Dispone de centros de salud, centros comerciales, colegios, guarderías, transporte publico, etc. Todo muy próximo  Doña casa servicios inmobiliarios, estamos para ayudarle, se enseña sin compromiso. Estamos en la c/ Madrid, n º 78, Fuente el saz de Jarama, Madrid.";919386162;Fuente el Saz de Jarama;494000;5;-;Doña Casa Servicios Inmobiliarios;Profesional;-;Fuente el Saz de Jarama;-;-;1235;400;4;-;No;No;No;Sí;Sí;Sí;Sí;Sí;Sí
97282214;Piso en Calle Grande;Piso;"Edificio situado en el municipio de Fuente el Saz de Jarama, provincia de Madrid. Tiene una superficie de 116 m2 registrales.  El entorno dispone de los servicios mínimos (suministro de energía eléctrica, abastecimiento de agua, acceso rodado y evacuación de aguas residuales) encontrándose en un buen estado de conservación). Dispone también de equipamiento como comercial, escolar y sanitario. Las comunicaciones del entorno con el resto de la población pueden considerarse buenas. Las comunicaciones interurbanas pueden considerarse suficientes. Fuente el Saz de Jarama es un municipio y localidad de España perteneciente a la Comunidad de Madrid. Su población en 2020 era de 6807 habitantes según el INE. Tiene una población aproximada de 6.000 habitantes. Los pueblos más cercanos a este son Algete, Alalpardo y Cobeña. Fuente el Saz es un pueblo dormitorio de la ciudad de Madrid, en el noreste de la comunidad autónoma. No obstante, no sólo actúa como pueblo dormitorio. También tiene chalets que son segunda vivienda de habitantes de la capital, quienes prefieren el campo para pasar las vacaciones. La vivienda consta de salón comedor, cocina, dos dormitorios y 1 baño.";917907541;Calle Grande;165000;2;-;Haya Real Estate;Profesional;-;Fuente el Saz de Jarama;-;-;1422;116;1;-;No;No;No;No;No;No;No;No;No
101539712;Cortijo;Casa Rural;"¡Si quieres vivir cerca de Madrid, pero rodeado de campo, esta es tu vivienda! NEW HOUSE INMOBILIARIA ofrece en exclusiva esta bonita vivienda construida y registrada, sobre terreno rústico de aproximadamente 500 metros cuadrados.  La finca cuenta con una vivienda que se distribuye en dos dormitorios de gran tamaño, uno de ellos con armario empotrado y split de aire frio/calor, salón comedor con chimenea, cocina amueblada y baño completo con bañera, así como otro armario empotrado en el pasillo principal.  Además cuenta con varias naves que permiten ampliar la vivienda, darles uso de almacén, o la tenencia de animales de todo tipo.  Cuenta también con garaje techado para dos/tres coches.  El agua se abastece del pozo, que además tiene un bidón acumulador.  La finca cuenta con placas solare que funcionan con baterías de gel, aerogenerador, y bidón de gasoil para el abastecimiento eléctrico.  En medio de la finca cuenta con un gran patio con barbacoa, porche y tamaño suficiente para la construcción de una piscina de obra.  No lo pienses más, y ven a verlo.  Si tienes dudas con la financiación, no dudes en preguntarnos. Te ayudaremos a conseguir una transacción segura y con las mejores condiciones de mercado.";919384860;Fuente el Saz de Jarama;165000;2;-;NEW HOUSE INMOBILIARIA;Profesional;-;Fuente el Saz de Jarama;-;-;1684;98;1;-;No;No;No;No;Sí;Sí;Sí;Sí;Sí
101461344;Casa independiente en Vereda las plantas;Chalet;"Magnífica casa de campo en suelo rústico construida en un única planta a unos 3km del núcleo urbano con salón, 5 habitaciones, baño y cocina. El salón tiene chimenea y la vivienda dispone de un trastero en la planta de arriba de 33m2. El patio y jardín rodea la casa y contiene barbacoa.";919383913;Vereda las plantas;220000;5;-;alfa fuente el saz;Profesional;-;Fuente el Saz de Jarama;-;-;1100;200;1;-;No;No;No;Sí;Sí;Sí;No;Sí;Sí
97589750;Chalet adosado en Calle Talamanca;Chalet;"Casa de pueblo reformada adosada con una superficie total 164 m² y un solar de 211 m², se distribuya en planta baja amplia cocina totalmente amueblada, pequeño salón 1 habitación doble, 2 habitaciones individuales y baño, primera planta reformada con acceso por escalera exterior con 3 habitaciones dobles y amplio baño completo, antigüedad de la vivienda 1915, calefacción eléctrica planta baja calor azul, y planta alta bomba de calor, carpintería interior aluminio parte baja y aluminio lacado blanco parte alta, suelos de gres, soleado, estado conservación: reformado, jardín privado, zona muy tranquila cerca de medico, supermercado.. . certificado energético en trámite, INFORMATE!";919385276;Calle Talamanca;240000;7;-;Consulting inmobiliario c&h;Profesional;-;Fuente el Saz de Jarama;-;-;1463;164;2;-;No;No;No;No;No;No;No;No;Sí
101943328;Dúplex;Duplex;"Venta de piso luminoso, en planta baja consta de salón con mirador y cocina independiente, en planta alta consta de dos habitaciones con armarios empotrados y un cuarto de baño.";919388503;Fuente el Saz de Jarama;138000;2;-;HA INMOBILIARIA;Profesional;-;Fuente el Saz de Jarama;-;-;1683;82;1;-1;No;No;No;No;No;No;No;No;No
102156270;Piso;Piso;"Estupenda ocasión. Precioso piso de dos dormitorios y un baño. Se encuentra en la planta baja de un edificio residencial de tres alturas. Situado en el municipio de Fuente El Saz De Jarama, en la provincia de Madrid. La vivienda se distribuye en dos dormitorios, amplio salón-comedor, cocina independiente, un cuarto de baño y patio. Tiene asignado un cuarto trastero situado en la planta sótano del edificio. Superficie construida de 73,94 m².  La cocina se encuentra totalmente amueblada con muebles altos y bajos. También está equipada con vitro-cerámica, campana extractora y horno. Se encuentra en buen estado de conservación, edificio construido en el año 2008.  Se ubica en una zona consolidada, rodeado de viviendas de similares características. En el municipio podemos encontrar todo tipo de servicios, tales como, sanitarios, educativos, restaurantes, supermercados, comercios, etc. Dispone de fácil acceso por carreteras locales para acceder al municipio.";917907541;Fuente el Saz de Jarama;145000;2;-;Haya Real Estate;Profesional;-;Fuente el Saz de Jarama;-;-;1986;73;1;-;No;No;No;No;No;No;No;No;No
101193019;Chalet adosado en Calle los Chopos, 19;Chalet;"Estupendo chalet situado en Fuente el Saz de Jarama. Tiene 4 habitaciones, 2 baños completos, uno de ellos en suite, un aseo (planta inferior). Garaje para 2 coches. Salón de 30 metros cuadrados. Posee 2 zonas ajardinadas. La delantera de unos 25 metros y un jardín trasero de 70 metros cuadrados. Posibilidad de ampliar haciendo zona abuhardillada en la planta superior. El chalet está en una urbanización con zonas infantiles y piscina comunitaria.";655323182;Calle los Chopos, 19;400000;4;-;Fran;Particular;-;Fuente el Saz de Jarama;-;-;2051;195;3;-;No;No;Sí;Sí;Sí;Sí;No;No;Sí
102180975;Dúplex en Avenida de la Alameda, 18;Duplex;"Duplex de dos habitaciones, con baño completo y aseo, aire acondicionado, plaza garaje trastero, piscina.";650531537;Avenida de la Alameda, 18;199000;2;-;alv.guzman.t;Particular;-;Fuente el Saz de Jarama;-;-;2261;88;2;1;Sí;No;Sí;No;Sí;Sí;Sí;Sí;Sí
99209197;Casa independiente en Carretera Valdetorres;Chalet;"LAR vende casa superficie total 300 m²,  1 hab. individual, 2 habitaciones dobles, 1 baño.  La casa para reformar, urbanizado, alumbrado. parcela de 2858 m² con árboles frutales Garaje, Nave y pozo La parcela se puede segregar en 5 parcelas. ¡MEJOR VER!";919386657;Carretera Valdetorres;325000;3;-;LAR, SOLUCIONES INMOBILIARIAS;Profesional;-;Fuente el Saz de Jarama;-;-;1413;230;1;-;No;No;No;No;Sí;Sí;No;No;Sí
101748923;Piso;Piso;"Venta de piso luminoso, consta salón, dos habitaciones con armarios empotrados, cocina independiente y un baño.";919388503;Fuente el Saz de Jarama;114000;2;-;HA INMOBILIARIA;Profesional;-;Fuente el Saz de Jarama;-;-;2000;57;1;bj;No;No;No;No;No;No;No;No;No
100712857;Finca rústica en Carretera Carretera M-103 s/n km16;Casa Rural;"Dos entradas una directa de carretera y la otra por camino Agua y luz Parada de autobús cerca. Excelente oportunidad  No agencias.";613866182;Carretera Carretera M-103 s/n km16;380000;1;-;ILDA;Particular;-;Fuente el Saz de Jarama;-;-;1520;250;1;-;No;No;No;No;No;No;No;No;No
101548175;Chalet adosado en Las bodegas 18, 18;Chalet;"Casa en fuente el Saz con bodega de 36 m impresionante casa para vivir o inversión. Está reformada entre con cocina completa. Muebles. Armarios etc. No dudes en hacernos una vista. Estamos abiertos a ofertas.";638042851;Las bodegas 18, 18;125000;1;-;ricardo;Particular;-;Fuente el Saz de Jarama;-;-;1453;86;1;-;No;No;No;No;No;No;No;No;No
