101657863;Piso;Piso;"Piso de 3 dormitorios con plaza de garaje y trastero en Los Belgas. A 5 minutos andando de la Estación de Cercanías, Estación de Bus ( línea 687 a Moncloa), Centro de salud, Colegios e Instituto, espacio verde del Coto de las Suertes y toda una amplia oferta de servicios. El piso se encuentra en la primera planta interior y se compone de salón-comedor con acceso a una terraza, cocina con tendedero, 3 dormitorios y 2 baños. Además, tiene garaje y un trastero con muchas posibilidades.  Edificio accesible, con piscina, gimnasio y sala multiusos. Posibilidad dentro de unos límites razonables de negociar el precio Agradecemos que no nos contacten inmobiliarias y/o profesionales del sector.";650299936;Villalba Estación;229710;3;Villalba Estación, Collado Villalba;Isabel;Particular;-;Collado Villalba;Villalba Estación;235000;2209;104;2;1;Sí;No;Sí;Sí;Sí;Sí;Sí;Sí;No
101488131;Piso en Calle Isla Lobeira;Piso;"GeniuS servicios inmobiliarios ofrece apartamento en Urbanizacion los Llanos. Este hogar consta 50 metros útiles de vivienda. Se distribuye en hall de entrada con espacioso armario empotrado, salón-comedor con acceso a terraza. Habitación independiente con baño completo en suite y gran armario empotrado. Para comodidad de los futuros compradores se incluye una plaza de garaje con acceso directo desde la finca. Finca construida en 2005 con grandes zonas verdes, servicio de conserje y vigilancia 24hr. Para no tener que salir de su futura casa y si os gusta disfrutar de las actividades deportivas esta urbanización cuenta con pista de pádel y piscina comunitaria. Una zona privilegiada de Collado Villalba donde puede practicar senderismo, rutas en bici o simplemente dar un paseo disfrutando de unas maravillosas vistas. Zona rodeada de bancos, farmacias, guarderías, supermercados, variedad de colegios nacionales próximos al inmueble como el C. P. Mariano Benlliure y el IES Lázaro Cárdenas. A 10 minutos del Polígono Industrial P-29. Zona muy bien comunicada. Con diferentes autobuses urbanos cerca de la vivienda y a pocos minutos de la estación de Renfe y de la estación de Autobuses. Con fácil acceso a la A-6. Llamenos y solicite su visita con nuestros consultores. ¿Pensando en vender? solicite su valoracion gratuita a nuestros teléfonos.";919384725;Calle Isla Lobeira;145000;1;Parque de la Coruña - Las Suertes, Collado Villalba;Genius servicios inmobiliarios s.l;Profesional;-;Collado Villalba;Parque de la Coruña - Las Suertes;155000;2843;51;1;1;Sí;No;Sí;Sí;Sí;Sí;No;No;Sí
101122710;Chalet pareado en Calle Mirador de Despeñaperros, 28;Chalet;"Vendemos precioso chalet pareado en la Urbanización "El Mirador de la Sierra". El chalet consta de 212 m2 construidos en 3 plantas más buhardilla y de un precioso jardín con una terraza en la parte trasera. En la primera planta encontramos un amplio recibidor que da acceso a un gran salón muy luminoso con una terraza acristalada con vistas a la sierra. En esta planta hay también un aseo y una cocina de 18 m2 con un gran office que tiene acceso a una terraza exterior. La segunda planta dispone de tres dormitorios, uno de ellos con baño en suite, y otro baño completo con bañera. La habitación principal, muy amplia, dispone de un vestidor con un precioso armario empotrado y un baño en suite con bañera de hidromasaje.  En la última planta encontramos una buhardilla cerrada con una ventana en el techo y otra en la pared, e impresionantes vistas a la sierra. Está toda forrada de madera y tiene vigas en el techo lo que le da un ambiente rústico muy acogedor. La buhardilla tiene tres ambientes, uno de ellos convertido en una habitación con cama de matrimonio, otro con un gran sillón y mueble con televisión y el otro con dos mesas grandes de despacho.  La planta baja dispone de un amplio garaje con espacio para dos coches y con puerta automática. En el mismo tenemos una zona de lavado con lavadora, secadora y fregadero. Al fondo de esta planta encontramos dos habitaciones utilizadas como trastero y taller. CARACTERÍSTICAS: - Tarima flotante AC6 - Aire acondicionado de 6000 frigorías - Calefacción: caldera de gas natural - Doble ventana en toda la casa - Mosquiteras en ventanas y puertas La urbanización El Mirador de la Sierra está situada en Fontenebro, la mejor zona de Collado Villalba. Con todos los servicios a mano: colegios, supermercados, ocio, restauración, centro de salud, hospital, transporte urbano e interurbano, RENFE y la A-6 a 5 minutos. Muy cerca de paradas de autobús con conexión directa a Madrid y al centro del pueblo.  Además, podemos disfrutar de la naturaleza a nuestro alrededor ya que el Parque Natural de la Cuenca Alta del Manzanares está a 100 metros de la misma. Ideal para los amantes de la naturaleza. Una urbanización ideal para familias, ya que cuenta con piscinas, pistas de tenis y pádel, parques, zonas verdes, salidas directas al campo. Un entorno tranquilo y seguro para los más pequeños. No hay gastos de comunidad. ABSTENERSE AGENCIAS.";637821499;Calle Mirador de Despeñaperros, 28;357000;4;Fontenebro - Altavista, Collado Villalba;ANA ISABEL ALVARADO LOPEZ;Particular;-;Collado Villalba;Fontenebro - Altavista;365000;1684;212;3;-;No;No;No;Sí;Sí;Sí;Sí;Sí;Sí
100835182;Chalet adosado en Calle Particular Montenebros I, 33;Chalet;"Particular vende chalet adosado, recién reformado, reforma integral (electricidad, tuberías…etc) con piscina comunitaria a quince minutos andando al cercanías, chalet de 3 alturas con garaje descubierto. Distribuido en planta baja: salón con chimenea, cuarto de baño con plato de ducha, espacio preparado por se quiere hacer cocina, existen tomas de agua y desagües, salida a parcela privada de unos 40 m2. Primera planta: cocina con terraza, salón de unos 30 m2 con dos grandes ventanales y aseo. Planta primera: tres dormitorios dobles, con armarios empotrados, dos de ellos con techos abuhardillados con más de 3 metros de altura el dormitorio principal con baño y plato de ducha y otro cuarto de baño con bañera que da servicio a los dos dormitorios restantes. El chalet está en calle de fondo de saco lo que hace que no tenga ningún ruido. Vivienda a estrenar, puertas lacadas, tarima flotante…. Etc. A dos minutos de la (a-6) piscina comunitaria  ideal para descansar abstenerse agencias!";624527683;Calle Particular Montenebros I, 33;365000;4;Villalba Estación, Collado Villalba;CARMEN;Particular;-;Collado Villalba;Villalba Estación;375000;2051;178;4;-;No;No;Sí;No;Sí;Sí;No;No;Sí
100350929;Piso en Calle la Venta;Piso;"VIVIENDA PROCEDENTE DE BANCO Vivienda, muy luminosa, cuenta con una superficie de 95m² distribuidos en 3 habitaciones y 2 baño, el salón-comedor y la cocina amueblada. La vivienda dispone de plaza de garaje incluido en el precio y se sitúa en una finca que NO dispone de ascensor. Dispone de armarios empotrados. Es un céntrico piso situado en Collado Villalba en zona cercana a la estación (5 minutos andando) por lo que dispone de excelentes comunicaciones, ubicada a escasos metros de la biblioteca Miguel Hernández, de parques infantiles y zonas verdes, cuenta con todo tipo de comercio en sus alrededores. LLÁMANOS PARA CONCERTAR UNA VISITA! INMUEBLE EN PERIODO DE TRANSPARENCIA HABITALIUM CLUB INMOBILIARIA.";919388203;Calle la Venta;184900;3;Villalba Estación, Collado Villalba;Habitalium Club Inmobiliaria;Profesional;-;Collado Villalba;Villalba Estación;-;1946;95;2;3;No;No;No;No;Sí;Sí;No;No;No
101217570;Chalet pareado;Chalet;"Magnífico chalet pareado de 211 m2 en parcela de 185 m2. 3 plantas más buhardilla. Planta principal hall distribuidor, cocina office con salida al jardín, aseo exterior y salón - comedor amplio con chimenea y acceso directo a porche y jardín. Planta alta 4 dormitorios y baño completo. En la buhardilla se encuentra el dormitorio principal en suite con vestidor y baño completo. En planta semisótano dispone de garaje 2 plazas y cuarto lavadora. Calefacción gas natural. Armarios empotrados en todos los dormitorios. No dispone de gastos de comunidad. Situado junto a la Laguna El Carrizal. Muy próximo a la Estación de Renfe, Polígono P29, comercios, junto a colegios e institutos y, en general, a todos los servicios. Zona residencial. Excelentes comunicaciones y situación e inmejorable ubicación y entorno.";919386552;Parque de la Coruña - Las Suertes;348000;5;Parque de la Coruña - Las Suertes, Collado Villalba;Exclusivas inmobiliarias las matas;Profesional;-;Collado Villalba;Parque de la Coruña - Las Suertes;-;1649;211;3;-;No;No;No;Sí;Sí;Sí;No;Sí;Sí
98359008;Piso en Calle Playa de la Lanzada, 51;Piso;"Piso listo para entrar a vivir, luminoso y bien orientado con chimenea francesa en salón y cuatro armarios empotrados, suelo de parqué acuchillado y ventanas de pvc y aluminio, algunas con doble ventana y cuatro vidrios. Plaza de garaje opcional.";629726310;Calle Playa de la Lanzada, 51;256000;3;Parque de la Coruña - Las Suertes, Collado Villalba;Pedro M.;Particular;-;Collado Villalba;Parque de la Coruña - Las Suertes;310000;2016;127;2;3;Sí;No;Sí;Sí;Sí;No;No;No;Sí
101875149;Chalet adosado en Isla De Salvora;Chalet;"Chalet adosado con parcela de 142 m2 y 130 m2 construidos en 2 plantas. En la planta baja hay un hall de entrada con la escalera que sube al piso superior y el hueco de la escalera está aprovechado de armario. El salón tiene 2 alturas, con chimenea y salida directa al patio posterior de la vivienda. Cocina. 3 dormitorios, todos con armario empotrado y 2 baños, uno con bañera y otro recién reformado con ducha. Uno de los dormitorios es suite. En la planta superior hay 2 dormitorios con armarios empotrados, uno de ellos doble y otro baño completo con ducha. El hueco de bajo cubierta está aprovechado de trastero. Terraza a la que se accede a través de un dormitorio. Los suelos son en gres y tarima. Calefacción de gas natural. Doble acristalamiento. Aire acondicionado en la planta superior. En el patio de entrada de la casa hay techado para el coche. El patio posterior tiene barbacoa, caseta, toldo y vistas al campo, donde ya no hay edificaciones de ningún tipo. Orientación Norte-Sur. Tiene urbanización con piscina, jardines y zona infantil. Y posibilidad de usar canchas de tenis. Zona tranquila, junto a colegio e instituto. Ideal para familias. REF 6548.";919381887;ISLA DE SALVORA;330000;5;Parque de la Coruña - Las Suertes, Collado Villalba;INMOBILIARIA LA LLAVE;Profesional;-;Collado Villalba;Parque de la Coruña - Las Suertes;-;2444;135;3;-;No;No;Sí;Sí;No;No;Sí;Sí;Sí
100403047;Piso en Urbanización alhambra;Piso;"Piso de esquina de 135 m2 con 3 dormitorios, baño completo con bañera y aseo. Cocina amplia con tendedero. Amplio salón con terraza. Calefacción de gas natural. Suelos en gres. 2 Armarios empotrados. La vivienda está muy cuidada. Es amplio y luminoso. Orientación Sur y Oeste. Cuanta con plaza de garaje y un gran trastero bajo cubierta con ventanas. La urbanización es cerrada con piscina, jardines, parque infantil, pista deportiva. El bus a Madrid tiene parada a pocos metros de la entrada a la urbanización. Ideal para vivir cómodamente. REF 6562.";919381887;Urbanización alhambra;226000;3;Fontenebro - Altavista, Collado Villalba;INMOBILIARIA LA LLAVE;Profesional;-;Collado Villalba;Fontenebro - Altavista;-;1626;139;2;2;No;No;Sí;Sí;Sí;Sí;No;Sí;Sí
101504271;Piso en real, 59;Piso;"ABSTENERSE INMOBILIARIAS. Al entrar a la vivienda encontramos un hall que da paso a la izquierda a la cocina, con salida a una de las terrazas con tendedero, habitación de servicio y aseo, y a continuación siguiendo dicho hall al enorme salón con salida a la anterior terraza. Desde ese espacioso salón, nos encontramos con otro pasillo que nos hace de distribuidor para los dormitorios, los tres situados seguidos y todos equipados con armarios empotrados. El primero desde la entrada es doble, el segundo tiene acceso a la otra terraza del piso y se usaba como sala de estar y ver la televisión y el tercero es el principal y cuenta con su propio baño en suite y también comunica con la terraza. Los otros dos dormitorios cuentan con servicio de otro baño completo. Vivienda en buen estado y cuidada, apta para entrar a vivir con no demasiadas reformas. Buena ubicación, con los servicios básicos a mano y fácil comunicación de carreteras, rápido acceso tanto a la autopista A-6 como al centro de Collado Villalba. Urbanización privada y con zonas verdes habilitadas para uso y disfrute de los vecinos, contando también con piscina infantil y piscina para adultos, canchas de tenis, zonas de recreo.. . Llamar por teléfono para conocer más detalles y venir a verlo.";659188708;real, 59;239000;4;Villalba Estación, Collado Villalba;Javier;Particular;-;Collado Villalba;Villalba Estación;259000;1637;146;3;2;Sí;No;Sí;Sí;No;No;No;Sí;Sí
101575331;Piso en Isla salvora, 5;Piso;"Piso amplio de 3 dormitorios con salon que incluye una gran terraza abierta, dos baños (uno de ellos en suite), y cocina con terraza cerrada. Trastero legalizado con escrituras. Baños actualizados con plato de ducha y bañera. Dormitorios con armarios empotrados. Puerta acorazada. Calefacción individual por gas(caldera nueva). Zona muy tranquila. Gran zona ajardinada con piscina, pista de tenis y zona infantil. Comunidad mensual 67€/mes, mancomunidad 80 al trimestre.";919381489;Isla salvora, 5;195000;3;Parque de la Coruña - Las Suertes, Collado Villalba;San joaquin 7 inmobiliaria;Profesional;-;Collado Villalba;Parque de la Coruña - Las Suertes;-;2097;93;2;1;Sí;No;Sí;Sí;No;No;No;Sí;Sí
99340211;Piso;Piso;"SIN AGENCIA, DIRECTAMENTE DE PARTICULAR  IDEAL PARA INVERSORES, Vivienda en rentabilidad con un contrato de alquiler, reciba desde primer día, un 4.7% de rentabilidad neta, porque no tiene hay gastos de comunidad.   La casa está totalmente reformada, en la Planta Baja, para entrar a vivir, el acceso a la vivienda es directo desde la calle. Construido 90 m2, con luz natural en tota la casa, cuenta con Salón- comedor, cocina americana equipada. hay un pasillo que distribuye las tres habitaciones, una las habitaciones con el baño suite con plato de ducha y con un vestidor. Desde esta habitación, hay acceso a un pequeño jardín donde puedes disfrutar con tu familia. Todas las habitaciones y baños cuentan con ventanas al exteriores.  Está totalmente reformado con los suelos de porcelánico imitando madera, ventanas de PVC con CLIMALIT, calefacción de gas.  La vivienda está en la zona residencia, muy cerca de pleno centro del pueblo Collado Villalba. Tienes todos los servicios, como supermercados, comercios, farmacias, restaurantes, zona de ocio, parque infantil, centro de salud, Ayuntamiento, En la zona existen varios colegios e institutos. Junto a la vivienda, se encuentra la parada de autobús con varias líneas entre ellos autobuses, va directo a Moncloa.";-;Villalba Pueblo;209000;3;Villalba Pueblo, Collado Villalba;JM;Particular;-;Collado Villalba;Villalba Pueblo;-;2322;90;2;bj;No;No;No;No;No;No;No;No;No
101389553;Piso en Calle Real;Piso;"Distrito 30 Agentes Inmobiliarios vende estupendo piso en el centro de Collado Villalba. La vivienda de aproximadamente 116 metros cuadrados construidos cuenta con entrada con recibidor, amplio salón comedor, cocina con acceso a terraza, tres dormitorios y dos cuartos de baño. Uno de los dormitorios con cuarto de baño en suite, otro con acceso terraza. Es una vivienda luminosa, exterior y con grandes ventanales.  Suelos de madera, armarios empotrados, calefacción individual gas natural y equipo de aire acondicionado.  La vivienda cuenta con plaza de parking.  Comunidad tranquila, zonas comunes muy cuidadas, dos acessos (desde la calle Real y calle Juan XXIII). Edificio del año 1.996.  La vivienda cuenta con ascensor.  Inmueble situado en una de las mejores zonas del centro de Collado Villalba, con todos los servicios y comunicaciones.  Para más información y visitas contacte con nosotros.";919384590;Calle Real;235000;3;Villalba Estación, Collado Villalba;Distrito 30 Agentes Inmobiliarios, S.L.;Profesional;-;Collado Villalba;Villalba Estación;-;2026;116;2;1;Sí;No;No;Sí;Sí;Sí;Sí;No;No
96132721;Piso en Calle Isla de la Toja;Piso;"Maravilloso piso tipo loft en venta en Collado Villalba, Madrid. Se distribuye en salón-comedor-habitación con cocina abierta y 1 baño con plato de ducha. El piso tiene suelos de parquet. Se encuentra en una zona próxima a diversos comercios y servicios básicos. Además, queda muy cerca de una gran zona verde por la que pasear. Tiene fácil acceso desde la N-VI y mediante la estación de tren de Villalba. ¿Es lo que buscas? Llámanos. En Aliseda Inmobiliaria tenemos la mayor oferta de inmuebles al mejor precio garantizado. Descubre nuestra amplia oferta inmobiliaria y no pierdas la oportunidad de encontrar la casa perfecta para ti.";919387978;Calle Isla de la Toja;97708;1;Parque de la Coruña - Las Suertes, Collado Villalba;Aliseda inmobiliaria;Profesional;-;Collado Villalba;Parque de la Coruña - Las Suertes;-;2641;37;1;bj;No;No;No;No;No;No;No;No;No
101945721;Piso en Calle Isla de la Toja, 5;Piso;"Piso situado en planta baja, está reformado íntegramente incluyendo fontanería y electricidad, cocina ampliada con placa de inducción, horno y microondas encastrados en una torre, encimera de piedra en toda la cocina, salón amplio con salida a una gran terraza que da a los jardines de la urbanización cerrada, tiene 3 dormitorios amplios uno de ellos con armario tipo vestidor, 2 baños completos 1 de ellos en suite principal, está totalmente reformado con puertas de roble y ventanas climalit lacadas en blanco, persianas correderas en cada habitación siendo la de la terraza eléctrica, consta de rejas lacadas en blanco en todas las ventanas, puerta blindada que da acceso a la vivienda, paredes lisas, la urbanización es cerrada y consta de piscina, pista de tenis y cancha de baloncesto. El portal está habilitado para personas con movilidad reducida siendo su puerta de entrada automática. A 5 minutos andando de la renfe, cercano a supermercados, colegios, institutos, bares, farmacia, y parada de autobuses, a menos de diez minutos andando del poligono P29 donde encontraras todos los servicios. Mejor ver!";650172528;Calle Isla de la Toja, 5;219000;3;Parque de la Coruña - Las Suertes, Collado Villalba;Vanessa;Particular;-;Collado Villalba;Parque de la Coruña - Las Suertes;229000;2235;98;2;bj;Sí;No;Sí;Sí;No;No;No;No;Sí
102288908;Piso en carlos ruiz;Piso;"¨POSIBILIDAD DE FINANCIACIÓN AL 100% DE SU PRÉSTAMO HIPOTECARIO". Agencia inmobiliaria TECNOCASA de Collado Villalba vende: Excelente vivienda, ubicada en cuarta planta, la cual dispone de tres dormitorios, un cuarto de baño completo con bañera, salón comedor con acceso a la terraza principal y cocina con acceso a una pequeña terraza,  Zona con múltiples servicios a su alrededor, como centros comerciales, supermercados, Restaurantes, Farmacias, estaciones de autobús, colegios, estación de Renfe, centro de salud. etc. Acceso rápido a Autopista A6, y también a carreteras que conectan a collado Villalba con los pueblos aledaños.";919380491;carlos ruiz;135000;3;Carlos Ruiz, Collado Villalba;TECNOCASA Estudio Nuevo Villalba;Profesional;-;Collado Villalba;Carlos Ruiz;-;1776;76;1;4;No;No;No;Sí;No;No;No;No;No
101050623;Chalet pareado en Calle María Zambrano;Chalet;"SE VENDE UN EXCLUSIVO CHALET PAREADO  en la mejor zona de Villalba Pueblo! Si buscas tranquilidad y naturaleza, esta propiedad es para ti. Este chalet es muy cómodo y está distribuido en dos plantas. CUENTA CON DORMITORIOS AMPLIOS EN LA PLANTA BAJA, las calidades del chalet son de primera calidad. Los detalles elegantes hechos a capricho incluyen el forrado de toda la vivienda y el muro que rodea la propiedad con PIEDRA NATURAL. La entrada principal cuenta con una PUERTA CASTELLANA DE MEDIO PUNTO y los muros de mampostería protegen del viento y del frío en épocas frías. EL SUELO DE BARRO COCIDO DE ALTA CALIDAD ESTÁ CALEFACTADO POR UNA HIDRO ESTUFA DE PELLET. Las ventanas de madera TIENEN DOBLE CRISTAL CLIMALIT Y ROTURA DE PUENTE TÉRMICO. Además, TODAS LAS ESTANCIAS CUENTAN CON TERMOSTATO para controlar la temperatura de forma individual. La propiedad también cuenta con UNA SALA DE GIMNASIO totalmente equipada con cerramiento de primera calidad, aislándola totalmente del exterior. Por último, la PRECIOSA PISCINA CON PUENTE es ideal para refrescarte en los días calurosos. La propiedad se distribuye en dos plantas. EN LA PLANTA BAJA, HAY 2 DORMITORIOS amplios con armarios empotrados y uno de ellos con doble altura con otra zona para despacho-sala de juegos. También hay 2 baños completos, un amplio salón comedor con chimenea casete, una cocina y una sala de gimnasia. EN LA PLANTA PRIMERA, HAY 2 DORMITORIOS ADICIONALES Y UN BAÑO COMPLETO. El jardín cuenta con CÉSPED NATURAL MUY BIEN CUIDADO, UNA PISCINA, UNA LEÑERA Y ACCESO A UNA BODEGA. LA PROPIEDAD SE ENTREGA TOTALMENTE AMUEBLADA CON MUEBLES TRAÍDOS DE LA INDIA Y CON TODA LA EQUIPACIÓN DEL GIMNASIO. ! En resumen, esta propiedad tiene 250M² DE VIVIENDA EN UNA PARCELA DE 575M². El certificado de consumo es de B y el certificado de emisiones es de A. ¡No pierdas la oportunidad de vivir en este exclusivo chalet en la mejor zona de Villalba Pueblo! Para obtener más información, contacta con Inmuebles Villalba Pueblo Inmo Ocio, quienes estarán encantados de ayudarte en todo lo que necesites. Referencia 2301.";919388858;Calle María Zambrano;550000;4;Fontenebro - Altavista, Collado Villalba;InmoOcio;Profesional;-;Collado Villalba;Fontenebro - Altavista;-;2200;250;3;-;No;No;Sí;Sí;Sí;Sí;No;Sí;No
101620290;Piso;Piso;"NO COBRAMOS HONORARIOS AL COMPRADOR  Seguro que quieres conocer este estupendo piso en venta en Collado Villalba que tiene todos los servicios al alcance de tu mano. ESTA PROPIEDAD ES ESPECIAL PORQUE está ubicado en una zona tranquila y rodeada de servicios, como supermercados, colegios, centro de salud y transporte público. Además, cuenta con excelentes comunicaciones con la capital, a través de la carretera A-6 y la estación de tren de cercanías. DISTRIBUCIÓN Entramos a un hall recibidor que da paso a todas las estancias del piso. Dispone de un acogedor salón comedor, cocina independiente totalmente equipada, un dormitorio con armario empotrado, y un baño completo. ES IMPORTANTE SABER QUE El edificio cuenta con ascensor y el piso se encuentra en una planta Baja, lo que le permite disfrutar de unas bonitas vistas desde casi todas las estancia. También cuenta con una amplia plaza de garaje incluida en el precio. Y si dispones de más de un vehículo, hay disponibilidad de plazas con opción de alquiler en el edificio. Otro detalle a destacar es que por la magnífica ubicación que tiene no existe ningún tipo de contaminación acústica, ni de las vías del tren, ni de las pistas de pádel ni del bullicio de la piscina.  COMUNICACIONES. Desde Collado Villalba hay diversas opciones de transporte para llegar a Moncloa en Madrid. Algunas de ellas son: - Tren de cercanías: la línea C-8 de Renfe Cercanías conecta Collado Villalba con Madrid.  - Autobús interurbano: hay varias líneas de autobús que conectan Collado Villalba con Madrid. Las líneas 661, 664 y 665, entre otras, tienen parada en Moncloa. - Coche: si se dispone de vehículo propio, se puede llegar a Moncloa por la carretera A-6.  COMERCIO, SERVICIOS, OCIO Y HOSPITALES:  - Centro Comercial Planetocio, Y Los Valles que ofrecen una amplia variedad de tiendas, cines, restaurantes y actividades de ocio. - Supermercados: Mercadona, Carrefour, Lidl, Aldi, Dia, entre otros. - También hay una gran cantidad de tiendas y comercios locales en la ciudad, como tiendas de ropa, zapaterías, librerías, panaderías, ferreterías, entre otros. Servicios: - Centro de Salud Collado Villalba Estación y el Centro de Salud Collado Villalba Pueblo. Ocio: - Parques y zonas verdes: Collado Villalba tiene múltiples zonas verdes y parques. - Actividades deportivas: la ciudad cuenta con varias instalaciones deportivas, como el Polideportivo Municipal Kike Blas, donde se pueden practicar diferentes deportes como fútbol, baloncesto, natación, entre otros. - Restaurantes y bares: la ciudad cuenta con una amplia variedad de restaurantes y bares donde se pueden degustar diferentes tipos de comida y bebida. Hospitales: - Hospital General de Villalba: este hospital público ofrece servicios de urgencias, hospitalización, consultas externas, entre otros servicios. Si eliges un centro privado el Hospital Madrid Torrelodones se encuentra a 12 minutos en coche.  CENTROS EDUCATIVOS: Collado Villalba cuenta con una amplia oferta de centros educativos de diferentes niveles, tanto públicos como privados. Los más próximos a la ubicación de la vivienda son: CEIP Miguel de Cervantes (Educación infantil y primaria) IES María Guerrero (Educación secundaria y Formación Profesional). Además, la ciudad cuenta con varios centros de educación especial y con la Escuela Oficial de Idiomas. También hay varias academias y centros de enseñanza privados que ofrecen clases de apoyo y refuerzo escolar. ¿A qué esperas para mudarte en la casa de tus sueños?";643420965;Parque de la Coruña - Las Suertes;155000;1;Parque de la Coruña - Las Suertes, Collado Villalba;Elephant Room Villalba;Profesional;-;Collado Villalba;Parque de la Coruña - Las Suertes;-;2385;65;1;bj;Sí;No;Sí;Sí;Sí;Sí;No;No;Sí
