99171214;Chalet pareado en Travesía Cruz Verde;Chalet;"HAKASA San Martín de la Vega pone a su disposición esta maravillosa casa como las que ya no se encuentran, situada en travesía cruz verde de Ciempozuelos. Cuenta con 6 amplios dormitorios, 4 baños completos, 2 cocinas, 2 salones y una sala de juegos, plaza de garaje de 76 m², patio de 116 m², con aires acondicionados, armarios empotrados y una maravillosa chimenea. Se encuentra próximo al Ayuntamiento, colegios, piscina, supermercados, etc. Tenemos un asesor personal exclusivo para ti, disponemos también de nuestro departamento financiero, en el que un asesor te orientará para que obtengas la mejor financiación. Hasta el 100% de financiación. Si busca un inmueble de características similares, puede pasar por nuestra oficina en Calle San Marcos, Nº38 o si lo prefiere llámenos al o Visítenos sin compromiso, mejor ver, ¡ PUEDE SER TU VIVIENDA DESEADA".";919386654;Travesía CRUZ VERDE;350000;6;Casco Antiguo sur, Ciempozuelos;HAKASA SERVICIOS INMOBILIARIOS;Profesional;-;Ciempozuelos;Casco Antiguo sur;-;669;523;4;-;No;No;No;Sí;Sí;Sí;Sí;Sí;Sí
101749991;Estudio en Calle Tablas de Daimiel, 2;Estudio;"Agencia Negociadora del Alquiler vende estupenda vivienda tipo estudio de 54 m2 (36 m2 útiles) según catastro en urbanización cerrada. Consta de cocina independiente con mostrador separador, salón dormitorio, cuarto de baño y patio privado. Dispone de puerta blindada, suelos de gres, ventanas climalit, armarios empotrados, aire acondicionado con bomba de calor y acumuladores como sistema de calefacción. Finca con ascensor, piscina, pistas de pádel y jardines. Importante: El precio de compra de la vivienda no incluye el gasto del Impuesto de Transmisiones Patrimoniales (6%), honorarios de agencia (3% + IVA), ni gastos de notario y registro.";914113253;Calle Tablas de Daimiel, 2;99000;0;Cuevas - Ilustración, Ciempozuelos;Agencia negociadora de alquiler;Profesional;-;Ciempozuelos;Cuevas - Ilustración;-;1833;54;1;bj;Sí;No;Sí;No;No;No;No;No;Sí
93166640;Piso en Avenida de Belén;Piso;"REF. 2093 Vivienda en planta tercera de un edificio de cinco plantas, sin ascensor, en la localidad de Ciempozuelos, provincia de Madrid. La vivienda está distribuida en 3 dormitorios, comedor, pasillo, cocina, baño, tendedero y terraza.  Revestimiento de madera y armarios empotrados en el dormitorio.  La cocina, abierta al salón, dispone de suelo de parqué y mobiliario en buen estado. Además, cuenta con un pequeño trastero en la terraza. Entorno tranquilo y zona con comercios y servicios cercanos como restaurantes, farmacias, oficina de correos y colegios. Bien comunicado. Con parada de autobús a 120 metros y accesos a carreteras M-307/M-404/E-5/A4/ R-4/M320 Tiene una superficie de 63 m2 construidos y 52 m2 útiles. FOTOS FACILITADAS POR LA PROPIEDAD. DESCONOCEMOS EL ESTADO REAL DE LA MISMA EN CASO DE SER CLIENTE PROVENIENTE DE ENTIDAD BANCARIA, LE RUEGO CONTACTE CON NOSOTROS PARA INFORMARLE SOBRE SI PUEDE OPTAR O NO AL INMUEBLE ELEGIDO Somos un Gran País! En Akris os ayudamos a cumplir vuestros Sueños Inmobiliarios Encuentra más en.";919385441;Avenida de Belén;79000;3;Los Cestos - Belén - Las Eras, Ciempozuelos;Akris Madrid (Griñón);Profesional;-;Ciempozuelos;Los Cestos - Belén - Las Eras;-;1254;63;1;3;No;No;No;Sí;No;No;No;No;No
97118053;Piso en Calle de la Violeta s/n;Piso;"Piso con 3 habitaciones en la provincia de madrid, en el municipio de ciempozuelos, en la calle violeta. Con incidencias. Inmueble alquilado-no visitable.";851810162;Calle de la Violeta s/n;96500;3;Cuevas - Ilustración, Ciempozuelos;GIA Grupo Unicaja;Profesional;-;Ciempozuelos;Cuevas - Ilustración;-;1049;92;1;-;No;No;No;No;No;No;No;No;No
102345843;Piso en San Antonio Abad;Piso;"CIEMPOZUELOS (Madrid). "OKUPADO". c/ San Antonio Abad. Vivienda en planta baja. 84´44 m2. PRODUCTO PARA PROFESIONALES/INVERSORES: El Inmueble se transmite ocupado por tercero sin título. El Adquirente asumirá, la situación ocupacional, la situación urbanística, y las discrepancias entre la realidad física y la realidad registral y catastral o en la cabida del Inmueble y la adecuación de todo lo anterior. Será de cuenta del Adquirente los tramites que conlleven la desocupación del Inmueble. Cabe la posibilidad de subrogarse en el procedimiento iniciado por la Vendedora. El precio de venta de este Inmueble se ha determinado en base a las anteriores circunstancias, que han supuesto un menor valor de este, y que deberán ser expresamente aceptadas por el adquirente en la formalización de la transmisión del Inmueble. Precio: 118.000. - €.";871185710;San Antonio Abad;118000;2;Casco Antiguo norte, Ciempozuelos;Gestores de Inversiones Inmobiliarias;Profesional;-;Ciempozuelos;Casco Antiguo norte;-;1405;84;1;bj;No;No;No;Sí;No;No;No;No;No
102215056;Chalet adosado en Calle de la Oca, 37;Chalet;"Chalet adosado de cuatro plantas distribuidos así: planta baja: vestíbulo, aseo, cocina totalmente equipada, salón comedor, planta primera, tres dormitorios y dos baños, armarios empotrados, 2 terraza-balcón, planta bajo cubierta, totalmente diáfana con dos ventanas. planta de sótano garaje y trastero cuenta con un jardín en la fachada y un amplio patio, zona tranquila, a 10 minutos al centro del pueblo, zona tranquila, colegios, supermercado, parada de buses a 5 minutos y 15 minutos a la estación de renfe.";678819070;Calle de la Oca, 37;255000;3;San Benito - Soledad - Hispanidad, Ciempozuelos;Elena;Particular;-;Ciempozuelos;San Benito - Soledad - Hispanidad;-;1109;230;3;-;No;No;No;Sí;Sí;Sí;No;No;Sí
102346755;Piso en Calle España;Piso;"CIEMPOZUELOS (Madrid). "OKUPADO". c/ España. Vivienda en planta baja. 69´70 m2. PRODUCTO PARA PROFESIONALES/INVERSORES: El Inmueble se transmite ocupado por tercero sin título. El Adquirente asumirá, la situación ocupacional, la situación urbanística, y las discrepancias entre la realidad física y la realidad registral y catastral o en la cabida del Inmueble y la adecuación de todo lo anterior. Será de cuenta del Adquirente los tramites que conlleven la desocupación del Inmueble. Cabe la posibilidad de subrogarse en el procedimiento iniciado por la Vendedora. El precio de venta de este Inmueble se ha determinado en base a las anteriores circunstancias, que han supuesto un menor valor de este, y que deberán ser expresamente aceptadas por el adquirente en la formalización de la transmisión del Inmueble. Precio: 85.700. - €.";871185710;Calle España;85700;2;Casco Antiguo sur, Ciempozuelos;Gestores de Inversiones Inmobiliarias;Profesional;-;Ciempozuelos;Casco Antiguo sur;-;1224;70;1;bj;No;No;No;No;No;No;No;No;No
101080341;Chalet adosado en Calle la Virgen;Chalet;"Excelente vivienda de 4 plantas. Planta principal con oficina de aproximadamente 130 m2. Amplio hall de entrada a la vivienda. Oficina con 3 habitaciones/despachos, almacén/vestidor, 1 baño con ducha y 1 aseo. Patio de aproximadamente 87 m2. Planta sótano de aproximadamente 130 m2. Con Local o sala multiusos, cocina, y garaje para 3/4 coches. Se puede hacer acceso independiente al sótano también. 2 instalaciones independientes, para poder independizar la planta baja. Vivienda en planta primera y segunda. Planta primera de aproximadamente 112 m2, más 25 m2 aproximadamente de terraza. En la primera planta hay hall de entrada, 2 dormitorios con armarios empotrados vestidos, 1 baño con ducha, salón independiente de aproximadamente 30 m2, y cocina completamente amueblada con despensa, zona de office y acceso a la gran terraza y al patio.  Planta segunda de aproximadamente 88 m2, con distribuidor, 4 dormitorios amplios con armarios empotrados vestidos, trastero, 1 baño con ducha y 1 baño con bañera, terraza. Baños amueblados.  Suelos de gres porcelánico y parquet de roble.  Ventanas de aluminio color madera y doble acristalamiento.  Puertas de roble.  Calefacción de gas natural con radiadores de aluminio.  Patio acondicionado.  Primeras calidades.  Pintura en liso.  Muy céntrico, excelente ubicación.  A 10 minutos andando de la estación de Renfe. Línea C3.  Cerca del Ayuntamiento, tiendas, bancos. No cobramos comisión al comprador.";919380127;Calle la Virgen;360000;5;Casco Antiguo sur, Ciempozuelos;Inmobiliaria dorian;Profesional;-;Ciempozuelos;Casco Antiguo sur;-;550;655;4;-;No;No;No;Sí;Sí;Sí;No;Sí;Sí
101997968;Piso en Fuerzas Armadas;Piso;"Agencia inmobiliaria de Ciempozuelos-zona Ciempozuelos-oficina Tecnocasa VENDE piso de 93 m2 CONSTRUIDOS, distribuidos en un hall, 1 aseo, salón independiente, luminosa cocina completa, y amplia terraza equipada con toldo, además de un cerramiento usado actualmente de trastero, dicha terraza posee entrada por el salón y por la cocina. La segunda estancia de la vivienda se compone de 2 dormitorios y un baño completo con bañera. Ubicada en una zona céntrica, teniendo cerca diversos servicios y tan solo a 3 minutos de la plaza del pueblo No dude en llamarnos para concretar su cita para visitar el inmueble, en la que además recibirá el asesoramiento gratuito de nuestro departamento financiero Kiron.";919382822;FUERZAS ARMADAS;129000;2;Casco Antiguo norte, Ciempozuelos;Tecnocasa Ciempozuelos;Profesional;-;Ciempozuelos;Casco Antiguo norte;137800;1387;93;2;2;Sí;No;No;Sí;No;No;No;Sí;No
100911913;Chalet adosado en Parroco Don Miguel Angel;Chalet;"Excelente vivienda en el centro del pueblo, a escasos metros de la estación de RENFE. Excelente ubicación.  Vivienda de dos plantas. Planta baja con amplio hall de entrada, una habitacion multiuso, salón, amplio trastero, porche muy luminoso y un gran patio-terraza completamente acondicionado y solado. Planta alta con un gran salón comedor, tres dormitorios dobles, cocina y dos baños completos, uno con ducha y otro bañera.  Buenas calidades. Suelos de gres. Puertas de nogal macizas. Ventanas de aluminio.  Calefacción de gasoil con radiadores de aluminio. Dos armarios empotrados grandes. Cocina office amueblada muy amplia. Silla salvaescaleras para personas con movilidad reducida. Puerta principal acorazada. Alarma. Doble ventana y mosquiteras.  Rejas. Reformada en 2.012. Posibilidad de hacer garaje en trastero o posibilidad de 2 plazas de garaje opcionales con precio independiente en un edificio cercano.  Caldera en buen estado.  Patio de aproximadamente 125 metros cuadrados.  Muy céntrica, al lado de tiendas, bancos, estación de RENFE.  Cerca también de la plaza del Ayuntamiento, la plaza Ventura Rodríguez y la plaza de las Palmeras.  Al lado de los jardines del Paseo de la Estación y del centro de salud.  Zona muy tranquila. No cobramos comisión al comprador.";919380127;Parroco Don Miguel Angel;255000;4;Casco Antiguo sur, Ciempozuelos;Inmobiliaria dorian;Profesional;-;Ciempozuelos;Casco Antiguo sur;-;870;293;2;-;No;No;No;Sí;No;No;No;Sí;No
101590671;Casa independiente en Callejón de las Estrellas;Chalet;"Agencia inmobiliaria de Ciempozuelos-zona Ciempozuelos-oficina Tecnocasa VENDE casa baja reformada de 90 m2 CONSTRUIDOS, distribuida en 3 dormitorios, 2 baños completos con ducha, cocina americana, lavandería y patio de unos 20 metros aprox. Ubicada cerca de supermercados, colegios y tan solo a 10 minutos del centro del pueblo. No dude en llamarnos para concretar su cita para visitar el inmueble, en la que además recibirá el asesoramiento gratuito de nuestro departamento financiero Kiron.";919382822;Callejón de las Estrellas;125000;3;Casco Antiguo sur, Ciempozuelos;Tecnocasa Ciempozuelos;Profesional;-;Ciempozuelos;Casco Antiguo sur;129000;1389;90;1;-;No;No;No;No;No;No;No;No;No
102122101;Piso;Piso;"Oportunidad de inversión: inmueble ocupado. Imposibilidad de visita interior. Piso en Ciempozuelos, Madrid, ideal para familias. El inmueble cuenta con una superficie de 63 m² construidos distribuidos en 3 habitaciones, salón-comedor, cocina además de 1 aseo. Localizado en el corazón de Ciempozuelos, en sus alrededores encontramos la Escuela Infantil Bilingue Jarque, supermercados, bancos, bibliotecas, farmacias, oficinas de correos, centros deportivos y paradas de autobús. Con fácil acceso a Autovía del Sur. Las fotografías pueden no corresponderse con el estado actual del inmueble. Consulte con nuestro Agente Comercial la información adicional sobre el inmueble y las condiciones especiales de compraventa.";919386456;Los Cestos - Belén - Las Eras;71000;3;Los Cestos - Belén - Las Eras, Ciempozuelos;Departamento Comercial;Profesional;-;Ciempozuelos;Los Cestos - Belén - Las Eras;-;1127;63;1;-;No;No;No;No;No;No;No;No;No
100790210;Piso en Beatriz Galindo;Piso;"Excelente piso seminuevo en el centro del pueblo.  Muy cerca de la estación de RENFE línea C3.  Amplio hall de entrada.  Cocina completamente amueblada con vitrocerámica, horno y campana.  Terraza tendedero. Doss dormitorios amplios con dos armarios empotrados vestidos.  Un baño completo con bañera grande.  Trastero incluido en el precio.  Calefacción por conductos frío y calor en toda la casa.  Primeras calidades.  Suelos de gres imitación a madera. Puertas de roble. Ventanas de aluminio lacado con doble acristalamiento y mosquiteras. Pintura en liso.  Puerta principal blindada.  Ascensor.  Exterior.  Impecable. Mejor verlo.  Diseño moderno y actual. Cerca del centro. Al lado de tiendas, bancos, supermercados y cerca del centro de salud. No cobramos comisión al comprador.";919380127;Beatriz Galindo;138500;2;Casco Antiguo norte, Ciempozuelos;Inmobiliaria dorian;Profesional;-;Ciempozuelos;Casco Antiguo norte;-;1629;85;1;1;Sí;No;No;Sí;No;No;Sí;Sí;No
101125920;Piso;Piso;"Piso en Ciempozuelos, Madrid, perfecto para familias. El inmueble cuenta con una superficie de 89 m² construidos distribuidos en 3 habitaciones, salón-comedor, cocina y 1 baño completo y 1 balcón. La vivienda tiene suelos de parquet que proporcionan al piso de mayor calidez y confort. Ubicado en la 2a planta del edificio, sin ascensor. Localizado en el centro de Ciempozuelos, en sus alrededores encontramos la Escuela Infantil Bilingue Jarque, supermercados, bancos, farmacias, oficinas de correos, centros deportivos y varias paradas de autobús. Cuenta con fácil acceso a Autovía del Sur.";919386456;Cuevas - Ilustración;108500;3;Cuevas - Ilustración, Ciempozuelos;Departamento Comercial;Profesional;-;Ciempozuelos;Cuevas - Ilustración;-;1219;89;1;-;No;No;No;No;No;No;No;No;No
98753669;Piso en Lope de Vega;Piso;"Excelente piso completamente reformado.  Totalmente exterior da a dos calles muy luminoso.  Amplio hall de entrada.  Tres amplios dormitorios dobles, anteriormente cuatro habitaciones.  Tres armarios empotrados vestidos y zona de vestidor en dormitorio principal.  Gran cocina amueblada completamente reformada.  Salón independiente muy luminoso, con acceso a la terraza.  Amplía terraza muy aprovechable, ideal para poner una mesa en verano.  Dos baños completos, amueblados y con ventanas, uno con cabina de ducha hidromasaje y otro con bañera grande, con mampara.  Buenas calidades.  Suelos de gres, puertas de roble. Doble ventana de aluminio con contraventana de aluminio lacado en blanco con climalit y mosquiteras.  Toldos.  Calefacción de tarifa nocturna.  Trastero comunitario.  Estufa de pellet.  No se paga comunidad solo el agua.  Edificio muy tranquilo.  Dos split de aire acondicionado en salón y dormitorio principal con bomba de calor.  Pintura tierras florentinas.  Excelente ubicación, muy cerca del centro. Cerca parada de autobús. No cobramos comisión al comprador.";919380127;Lope de Vega;140000;3;Casco Antiguo sur, Ciempozuelos;Inmobiliaria dorian;Profesional;-;Ciempozuelos;Casco Antiguo sur;-;1167;120;2;2;No;No;No;Sí;No;No;Sí;Sí;No
100354850;Piso;Piso;"PISO A LA VENTA EN CIEMPOZUELOS  Se trata de un estupendo piso ubicado en un edificio con ascensor de 103 m² distribuidos en salón-comedor, 3 dormitorios, cocina completamente amueblada, además de equipada con placa y horno y 2 baños. Dispone de armarios empotrados e incluye trastero en el precio. Situado en la localidad de Ciempozuelos junto a la Plaza de Toros, muy bien comunicada con la capital Madrid y que cuenta con todos los servicios y necesidades a escasos minutos. VEN A VISITARLO! HABITALIUM CLUB INMOBILIARIA.";919388203;Los Cestos - Belén - Las Eras;122000;3;Los Cestos - Belén - Las Eras, Ciempozuelos;Habitalium Club Inmobiliaria;Profesional;-;Ciempozuelos;Los Cestos - Belén - Las Eras;-;1184;103;2;1;Sí;No;No;Sí;No;No;No;No;No
92180694;Piso en Calle Marte;Piso;"Oportunidad de inversión: inmueble ocupado. Imposibilidad de visita interior.  Piso de 60 m² con 2 habitaciones, 1 baño, cocina americana amueblada y salón-comedor en venta cerca de la plaza del Sol, en el centro de Ciempozuelos (Madrid). Cuenta con acceso a todos los servicios básicos: comercios, supermercados, centros educativos, deportivos y de salud, transporte público, servicios de hostelería y restauración, etc. Goza de buenas comunicaciones con la estación de tren de la localidad y las carreteras M-404 y M-307. ¿Te interesa? Contacta con nosotros. En Aliseda Inmobiliaria tenemos la mayor oferta de inmuebles al mejor precio garantizado. Descubre nuestra amplia oferta inmobiliaria y no pierdas la oportunidad de encontrar la casa perfecta para ti.  Las fotografías pueden no corresponderse con el estado actual del inmueble. Consulte con nuestro Agente Comercial la información adicional sobre el inmueble y las condiciones especiales de compraventa.";919387978;Calle Marte;80375;2;Casco Antiguo sur, Ciempozuelos;Aliseda inmobiliaria;Profesional;-;Ciempozuelos;Casco Antiguo sur;112700;1296;62;1;-;No;No;No;No;No;No;No;No;No
100004453;Piso en Calle de Jerónimo del Moral;Piso;"Este piso se encuentra en Calle de Jerónimo del Moral, 28350, Ciempozuelos, Madrid, en la zona del San Benito - Soledad - Hispanidad, en la planta 1de una FINCA CON ASCENSOR. Es un piso, construido en el año 1979, que tiene 79 m2 de los cuales 65 m2 son útiles y dispone de 3 habitaciones y 1 baño. VIVIENDA A REFORMAR. Consta de entrada, cocina independiente con salida a terraza-tendedero interior. Amplio salón comedor de paso, con salida a terraza. 3 dormitorios y baño completo. Cuenta con armarios empotrados  Cuenta en sus alrededores con todos los servicios necesarios.  Soluciones a su medida.";919388646;Calle de Jerónimo del Moral;119000;3;San Benito - Soledad - Hispanidad, Ciempozuelos;Hogalia Madrid;Profesional;-;Ciempozuelos;San Benito - Soledad - Hispanidad;-;1506;79;1;1;Sí;No;No;Sí;No;No;No;No;No
101859027;Piso en Calle Caldera de Taburiente;Piso;"Activo pendiente de saneamiento. Inmueble con cargas pendientes de cancelar o con el título de propiedad pendiente de inscripción registral. Os presentamos este piso ubicado en Ciempozuelos, Madrid. El inmueble se distribuye en tres habitaciones, salón-comedor, cocina y dos baños. Situado en los bajos del edificio. Está situado en el centro de Ciempozuelos. En sus alrededores encontramos escuelas, supermercados, bancos, farmacias, oficinas de correos y centros deportivos. En términos de accesibilidad, la propiedad dispone de múltiples conexiones y cuenta con fácil acceso a Autovía del Sur. En Aliseda Inmobiliaria tenemos la mayor oferta de inmuebles al mejor precio garantizado. Descubre nuestra amplia oferta inmobiliaria y no pierdas la oportunidad de encontrar la casa perfecta para ti.";919387978;Calle Caldera de Taburiente;120750;3;Cuevas - Ilustración, Ciempozuelos;Aliseda inmobiliaria;Profesional;-;Ciempozuelos;Cuevas - Ilustración;-;1129;107;2;bj;Sí;No;No;No;Sí;Sí;No;Sí;No
102264162;Piso en Calle Caretos;Piso;"Agencia inmobiliaria de Ciempozuelos-zona Ciempozuelos-oficina Tecnocasa VENDE piso de 56 m2 CONSTRUIDOS, distribuidos en salón, cocina equipada, además de tener tendedero, 1 dormitorio equipado con armario empotrado y baño en suite con bañera Ubicada en una zona céntrica, teniendo cerca diversos servicios alrededor y tan solo a 3 minutos de la plaza del pueblo. No dude en llamarnos para concretar su cita para visitar el inmueble, en la que además recibirá el asesoramiento gratuito de nuestro departamento financiero Kiron.";919382822;Calle Caretos;96500;1;Casco Antiguo norte, Ciempozuelos;Tecnocasa Ciempozuelos;Profesional;-;Ciempozuelos;Casco Antiguo norte;-;1723;56;1;1;Sí;No;No;No;No;No;No;No;No
101269709;Dúplex en Glorieta del Consuelo, 3;Duplex;"GARSIERRA. vivienda procedente de banco estupendo duplex de 4 dormitorios, 2 baños completos, salón y cocina, solarium. Financiación. zona residencial. cerca de la parada de metro. la zona cuenta con todo tipo de servicios y comercios. NO COBRAMOS COMISIÓN.";919388504;Glorieta del Consuelo, 3;132000;4;Cuevas - Ilustración, Ciempozuelos;Garsierra;Profesional;-;Ciempozuelos;Cuevas - Ilustración;-;964;137;2;1;Sí;No;No;Sí;No;No;No;No;No
102225735;Piso en Calle picos de Europa, 1;Piso;"Urbanización Pryconsa ( de las mejores de la zona ) Urbanización cerrada con portero físico 12h. Zonas comunes con gimnasio y piscina. Él piso esta muy cuidado, con la cocina equipada al completo ( frigorífico, lavadora, lavavajillas, microhondas, horno encastrado con vitroceramica.. . ) salón con terraza y habitaciones con los armarios empotrados revestidos y con maletero. Él piso esta amueblado como se ve en las fotos ( no vacío ) Dos baños ( habitación de matrimonio y pasillo)  Toda la casa tiene hecha la preinstalacion de aire acondicionado y calefacción con caldera Sanier Duval con mando programador inalámbrico y todas las revisiones hechas hasta la fecha. Cuenta con plaza de garaje amplia y trastero y en la azotea un tendedero comunitario. La vivienda tiene acabados de primera calidad. Con parada de autobuses enfrente de la urbanización con llegada a Legazpi y Sol muy bien comunicados Precio negociable.";677392550;Calle picos de Europa, 1;159000;2;Los Cestos - Belén - Las Eras, Ciempozuelos;Cesar castellanos;Particular;-;Ciempozuelos;Los Cestos - Belén - Las Eras;-;2120;75;2;2;Sí;No;Sí;Sí;Sí;Sí;Sí;Sí;Sí
101741012;Ático en Plaza de la Virgen de la Antigua;Ático;"Crown & Wells comercializa fantástico Ático en el centro de Ciempozuelos, zonas comunes, ubicado en una plaza con encanto y tranquila, a cinco minutos caminando de Renfe y a cercano a la Plaza Mayor. Consta de 74 m2 que se distribuyen en, Salón comedor amplio con acceso a la terraza de 11 m2, cocina independiente equipada, baño completo y dormitorio con vestidor. Calefacción y aire acondicionado por conducto. Vélux, ventanas de climalit, suelos cerámicos, finca con ascensor. Para más información y visitas, contacten con nosotros, estaremos encantados de atenderle. Precio de venta con honorarios incluídos.";919388476;Plaza de la Virgen de la Antigua;117300;1;Casco Antiguo norte, Ciempozuelos;CROWN & WELLS Real Estate;Profesional;-;Ciempozuelos;Casco Antiguo norte;118700;1585;74;1;3;Sí;No;No;Sí;No;No;No;No;No
101654188;Piso;Piso;"LemonLine te presenta este bajo de 72m²* útiles con terraza, piscina comunitaria, parking y trastero. (Alquilado hasta diciembre del 2024) ¡Y sin coste de intermediación inmobiliaria para el comprador! Consta de recibidor, una espaciosa cocina, un acogedor salón-comedor, un baño de 3 piezas con plato de ducha, una habitación individual con armario empotrado y una habitación doble en suite con bañera, armarios empotrados y salida a la terraza.  Características: - Listo para entrar a vivir - Mobiliario no incluido - Armarios empotrados - Aire acondicionado con bomba de calor - Calefacción de gas por radiadores  - Ventanas de aluminio - Suelos de parqué y gres - 72m² útiles y 88m² construidos según catastro - Plaza de parking+trastero incluidos en el precio  - Finca del 2004 - Ascensor - Piscina comunitaria  La vivienda se encuentra a pocos minutos caminando de todos los servicios necesarios en nuestro día a día. Acceso a M-307, M-404. Líneas de autobús más próximas: 1 Si tienes cualquier duda o pregunta o quieres programar una visita, ¡no dudes en ponerte en contacto con nosotros! Si necesitas financiación, nuestro departamento financiero LemonLine Hipotecas obtiene **hasta el 100% gracias a nuestros únicos acuerdos de colaboración con las entidades bancarias. *El precio ofertado de este inmueble no incluye el mobiliario interno de la vivienda. La superficie del inmueble ha sido facilitada por el vendedor, consultada en la Sede Electrónica de Catastro o Registro de la Propiedad, pudiendo haber alguna variación con la superficie real. Les comunicamos que en el precio ofertado de venta, no están incluidos los gastos de compraventa: notariales, registrales, gestoría, ITP (Impuesto de Transmisiones Patrimoniales) y/o gastos bancarios que pudieran generarse. **La obtención de la financiación está sujeta a las condiciones de la entidad financiera y tendrá en cuenta el perfil y solvencia del cliente. Consulta nuestra web para leer el Aviso Legal sobre la descripción de este inmueble.";936179365;Casco Antiguo norte;135000;2;Casco Antiguo norte, Ciempozuelos;LemonLine;Profesional;-;Ciempozuelos;Casco Antiguo norte;-;1534;88;2;1;Sí;No;Sí;Sí;Sí;Sí;Sí;No;No
