101958450;Piso en Travesía de Capitán Antonio de Oro Pulido;Piso;"Agencia inmobiliaria de Ciempozuelos-zona Ciempozuelos-oficina Tecnocasa VENDE piso de 96 m2 CONSTRUIDOS, compuesto por un hall, salón independiente con acceso a un balcón, luminosa cocina, 1 baño completo, 1 aseo y 3 amplios dormitorios. Además posee un patio interior de 40 m2 con posibilidad de realizar acceso desde la vivienda.  Ubicado en zona céntrica, teniendo diversos servicios a su alrededor, como supermercados, bares, comercios, etc y tan solo a 10 minutos de la RENFE de Ciempozuelos. No dude en llamarnos para concretar su cita para visitar el inmueble, en la que además recibirá el asesoramiento gratuito de nuestro departamento financiero Kiron.";919382822;Travesía de Capitán Antonio de Oro Pulido;133000;3;Casco Antiguo norte, Ciempozuelos;Tecnocasa Ciempozuelos;Profesional;-;Ciempozuelos;Casco Antiguo norte;146000;1385;96;2;1;No;No;No;No;No;No;No;No;No
101924182;Piso en Calle Cuevas del Consuelo;Piso;"¡OPORTUNIDAD EN CIEMPOZUELOS!PISO EXTERIOR CON REFORMA A ESTRENAR. BE REAL ofrece en venta este magnífico piso reformado en venta en Calle Violeta, en Ciempozuelos municipio ubicado en la Comunidad de Madrid. La zona ofrece una excelente calidad de vida y una ubicación estratégica para aquellos que buscan un entorno tranquilo pero cercano a la bulliciosa capital. Rodeado de hermosos paisajes naturales, este pintoresco pueblo combina la serenidad de un entorno rural con la comodidad de contar con todas las comodidades modernas. La ubicación de Ciempozuelos también lo convierte en un lugar atractivo para aquellos que buscan una conexión fácil con la ciudad de Madrid. Gracias a su cercanía con la capital, los residentes pueden disfrutar de la tranquilidad de vivir en un entorno rural mientras se benefician de la accesibilidad y las oportunidades que ofrece una gran ciudad. Este apartamento se encuentra en la primera planta, en un edificio construido en el año 2008, equipado con ascensor para mayor comodidad. Con una superficie construida de 56 m2 de los cuales útiles son 42 m2 este piso recién reformado ofrece una oportunidad única para estrenar un hogar a tu medida. Al ingresar, serás recibido por un acogedor hall de entrada que te conducirá hacia el espacioso salón comedor, ideal para relajarte y disfrutar de momentos inolvidables con familia y amigos. Además, el piso cuenta con una cocina independiente, lista para personalizar según tus gustos y necesidades (sin amueblar y sin electrodomésticos). El dormitorio, completamente amueblado y equipado con un armario empotrado, te brindará un espacio muy acogedor para el descanso. La terraza, accesible directamente desde el dormitorio, es una ventaja destacada de esta propiedad.  Para tu comodidad, el amplio cuarto de baño está equipado con plato de ducha.  El piso también cuenta con calefacción eléctrica, ventanas climalit y suelo de tarima, proporcionando un ambiente cálido y acogedor en todas las estaciones del año.  Además, gracias a su orientación soleada, podrás disfrutar de una luminosidad natural que alegrará tu día a día. El trastero, es una ventaja destacada de esta propiedad. Ubicado en el mismo edificio, brinda comodidad y accesibilidad, ya que podrás acceder a él fácilmente sin necesidad de desplazarte a largas distancias. Además, este espacio adicional te permitirá aprovechar al máximo el espacio en tu nuevo hogar, manteniéndolo organizado. Esta propiedad representa una excelente oportunidad tanto como vivienda residencial habitual o como inversión. Con una ubicación privilegiada, espacios amplios y una reforma integral de calidad, esta vivienda es una excelente oportunidad para aquellos que buscan obtener ingresos estables a través del alquiler.  Contáctanos hoy mismo para obtener más información y concertar una visita. Descubra todo nuestro producto visitando nuestra web BEREAL.ES Cada casa tiene un cliente ideal y ambos están en Be Real. BE REAL la inmobiliaria inteligente. Al fin una inmobiliaria con toda la tecnología y todo el servicio a su precio.  Así de cómodo, así de fácil, así de Real.";919384674;Calle Cuevas del Consuelo;105000;1;Cuevas - Ilustración, Ciempozuelos;BE REAL VILLANUEVA;Profesional;-;Ciempozuelos;Cuevas - Ilustración;-;1875;56;1;1;Sí;No;No;Sí;No;No;No;Sí;No
101665334;Chalet adosado en Calle oca s/n;Chalet;"Agencia inmobiliaria de Ciempozuelos-zona Ciempozuelos-oficina Tecnocasa VENDE Chalet adosado de 230m2 CONSTRUIDOS distribuido en 4 plantas. La planta baja consta de un patio delantero equipado con un porche y rampa de acceso al garaje, la vivienda se compone de un aseo y un recibidor que conduce a un amplio salón/comedor con cocina americana, dicha estancia posee un acceso a un amplio patio. La primera planta consta 1 baño completo con ducha y 3 dormitorios equipados con armarios empotrados, teniendo 2 de ellos terraza propia, además, el dormitorio principal posee un baño en suite. La vivienda posee una amplia buhardilla de 37 m2 equipada con un vestidor, además de un sótano equipado con una habitación completamente insonorizada, pudiéndose utilizar como sala de cine o juegos y un amplio garaje con puertas automáticas, teniendo capacidad para 2 coches  Cada estancia se encuentra totalmente reformada además de incluir suelo radiante de frío y calor por sistema de aerotermia.  Ubicada cerca de diversos servicios como colegios, restaurantes, etc y tan solo a 8 minutos de la plaza de Ciempozuelos. No dude en llamarnos para concretar su cita para visitar el inmueble, en la que además recibirá el asesoramiento gratuito de nuestro departamento financiero Kiron.";919382822;Calle oca s/n;315000;4;San Benito - Soledad - Hispanidad, Ciempozuelos;Tecnocasa Ciempozuelos;Profesional;-;Ciempozuelos;San Benito - Soledad - Hispanidad;-;1370;230;3;-;No;No;No;Sí;Sí;Sí;No;No;No
101924828;Ático en Calle Cuevas del Consuelo;Ático;"OPORTUNIDAD EN CIEMPOZUELOS. PISO EXTERIOR CON AMPLIA TERRAZA Y CON REFORMA A ESTRENAR. BE REAL ofrece en venta este magnífico piso reformado en venta en Calle Violeta, en Ciempozuelos municipio ubicado en la Comunidad de Madrid. La zona ofrece una excelente calidad de vida y una ubicación estratégica para aquellos que buscan un entorno tranquilo pero cercano a la bulliciosa capital. Rodeado de hermosos paisajes naturales, este pintoresco pueblo combina la serenidad de un entorno rural con la comodidad de contar con todas las comodidades modernas. La ubicación de Ciempozuelos también lo convierte en un lugar atractivo para aquellos que buscan una conexión fácil con la ciudad de Madrid. Gracias a su cercanía con la capital, los residentes pueden disfrutar de la tranquilidad de vivir en un entorno rural mientras se benefician de la accesibilidad y las oportunidades que ofrece una gran ciudad. El inmueble se encuentra en un edificio construido en el año 2008 y cuenta con ascensor para mayor comodidad. El piso está ubicado en la primera planta y es totalmente exterior, lo que permite disfrutar de una gran luminosidad y vistas despejadas. Con una superficie construida de 72 m2 de los cuales útiles son 56 m2 el piso ha sido objeto de una reciente reforma a estrenar. Al entrar, nos encontramos con un acogedor hall de entrada que da paso a un amplio salón comedor. Desde este espacio se accede a una maravillosa terraza de 26 m2, ideal para disfrutar de momentos al aire libre con vistas a la calle. La cocina es independiente y se entrega sin amueblar ni electrodomésticos, lo cual permite personalizarla según las necesidades y gustos de cada propietario.  El dormitorio principal está amueblado y cuenta con un espacioso armario empotrado, brindando un práctico espacio de almacenamiento. El cuarto de baño, también reformado, dispone de una bañera. El piso cuenta con calefacción eléctrica, ventanas climalit y suelo de tarima, ofreciendo un ambiente cálido y confortable en todas las estancias. Gracias a su orientación, el piso recibe una gran cantidad de luz solar a lo largo del día, lo que contribuye a crear un ambiente agradable y acogedor. El trastero, es una ventaja destacada de esta propiedad. Ubicado en el mismo edificio, brinda comodidad y accesibilidad, ya que podrás acceder a él fácilmente sin necesidad de desplazarte a largas distancias. Además, este espacio adicional te permitirá aprovechar al máximo el espacio en tu nuevo hogar, manteniéndolo organizado. Esta propiedad representa una excelente oportunidad tanto como vivienda residencial habitual como inversión. Su ubicación en Ciempozuelos, en la provincia de Madrid, proporciona una gran calidad de vida, con todos los servicios y comodidades al alcance de la mano. No pierdas la oportunidad de adquirir este encantador piso reformado y disfrutar de todas sus ventajas en un entorno tranquilo y cómodo. Contáctanos hoy mismo para obtener más información y concertar una visita. Descubra todo nuestro producto visitando nuestra web BEREAL.ES Cada casa tiene un cliente ideal y ambos están en Be Real. BE REAL la inmobiliaria inteligente. Al fin una inmobiliaria con toda la tecnología y todo el servicio a su precio.  Así de cómodo, así de fácil, así de Real.";919384674;Calle Cuevas del Consuelo;120000;1;Cuevas - Ilustración, Ciempozuelos;BE REAL VILLANUEVA;Profesional;-;Ciempozuelos;Cuevas - Ilustración;-;1667;72;1;2;No;No;No;No;No;No;No;Sí;No
101957447;Casa independiente en san jose s/n;Chalet;"Agencia inmobiliaria de Ciempozuelos-zona Ciempozuelos-oficina Tecnocasa VENDE casa de pueblo de 153 m2 construidos distribuida en 2 plantas. PLANTA BAJA: Consta salón independiente, cocina con 2 accesos, 1 baño con bañera, 1 aseo y un patio que consta de un trastero y una cueva de 4 dormitorios. PRIMERO PLANTA: Consta de 3 dormitorios, uno d ellos equipado con armario empotrado y un pequeño cuarto usado actualmente de trastero. Ubicada en zona céntrica a tan solo 9 minutos de la RENFE del pueblo. No dude en llamarnos para concretar su cita para visitar el inmueble, en la que además recibirá el asesoramiento gratuito de nuestro departamento financiero Kiron.";919382822;san jose s/n;87500;3;Casco Antiguo sur, Ciempozuelos;Tecnocasa Ciempozuelos;Profesional;-;Ciempozuelos;Casco Antiguo sur;-;572;153;2;-;No;No;No;No;No;No;No;No;No
98733375;Piso en Calle de la Cruz Antigua;Piso;"Oportunidad de inversión: inmueble ocupado. Imposibilidad de visita interior.  Os presentamos este dúplex ubicado en Ciempozuelos, Madrid. La vivienda se distribuye en dos habitaciones, salón-comedor, cocina, dos baños y un balcón. El inmueble tiene suelos de parquet. Ubicado en la 2a planta del edificio. Está situado en el centro de Ciempozuelos. En sus alrededores encontramos escuelas, supermercados, bancos, bibliotecas, farmacias, oficinas de correos, centros deportivos, varias paradas de autobús y la estación de tren Ciempozuelos. En términos de accesibilidad, la propiedad dispone de múltiples conexiones y cuenta con fácil acceso a M-404. No te pierdas esta oportunidad de encontrar la casa perfecta para ti.  Las fotografías pueden no corresponderse con el estado actual del inmueble. Consulte con nuestro Agente Comercial la información adicional sobre el inmueble y las condiciones especiales de compraventa.";919387978;Calle de la Cruz Antigua;181500;2;Casco Antiguo sur, Ciempozuelos;Aliseda inmobiliaria;Profesional;-;Ciempozuelos;Casco Antiguo sur;-;1681;108;2;2;No;No;No;No;No;No;No;No;No
100552107;Piso en Travesía de la Cruz Verde;Piso;"MC PROPERTY vende AMPLIO piso de 129 m², exterior, con 3 habitaciones, plaza de garaje y trastero EN RENTABILIDAD. La vivienda se distribuye en: entrada, salón comedor, cocina independiente, dormitorio principal con baño en suite, dos dormitorios dobles y baño completo. Armarios empotrados en las 3 habitaciones, así como en el pasillo. Cocina totalmente equipada con electrodomésticos. En muy buen estado. Suelo cerámico. Incluye en el precio 1 plaza de garaje en la misma finca y trastero. Próximo a restaurantes, supermercados, colegio y buena comunicación con transporte público. Gasto de comunidad: 94 €/mes Gasto de IBI: 540. -€ / año.";919384501;Travesía de la Cruz Verde;175000;3;Casco Antiguo sur, Ciempozuelos;MC Property;Profesional;-;Ciempozuelos;Casco Antiguo sur;-;1357;129;2;1;Sí;No;No;No;Sí;Sí;No;Sí;No
102319021;Casa independiente en Vereda del Prado;Chalet;"Agencia inmobiliaria de Ciempozuelos-zona Ciempozuelos-oficina Tecnocasa VENDE casa unifamiliar de 94 m2 CONSTRUIDOS, consta de un recibidor, amplio salón independiente, cocina completa, 2 dormitorios y un baño completo con ducha, además cuenta con un pequeño cuarto por el que se accede a un patio trasero.  La vivienda se encuentra para entrar a vivir y posee aire acondicionado en la cocina, salón y los 2 dormitorios. Ubicada en una zona muy bien comunicada, teniendo diversas paradas de bus alrededor, a 10 minutos de la Renfe de Ciempozuelos, que cuenta con línea directa al centro del Madrid (Línea c-3), cercanía con servicios como supermercados, restaurantes, farmacias… No dude en llamarnos para concretar su cita para visitar el inmueble, en la que además recibirá el asesoramiento gratuito de nuestro departamento financiero Kiron.";919382822;Vereda del Prado;148000;2;Cuevas - Ilustración, Ciempozuelos;Tecnocasa Ciempozuelos;Profesional;-;Ciempozuelos;Cuevas - Ilustración;-;1574;94;1;-;No;No;No;No;No;No;Sí;No;No
102191804;Piso en Travesía san sebastian;Piso;"Agencia inmobiliaria de Ciempozuelos-zona Ciempozuelos-oficina Tecnocasa VENDE piso de 114 m2 CONSTRUIDOS, distribuidos en un amplio hall, salón independiente con 2 balcones, cocina completa con tendedero, 2 baños completos y 2 dormitorios equipados con armarios empotrados, teniendo el principal un baño en suite con bañera. La vivienda consta de una amplia plaza de garaje con capacidad hasta para 2 coches. Ubicada en una urbanización con piscina, zonas comunes y video vigilancia en dichas zonas. No dude en llamarnos para concretar su cita para visitar el inmueble, en la que además recibirá el asesoramiento gratuito de nuestro departamento financiero Kiron.";919382822;Travesía san sebastian;137800;2;Casco Antiguo sur, Ciempozuelos;Tecnocasa Ciempozuelos;Profesional;-;Ciempozuelos;Casco Antiguo sur;-;1209;114;2;1;Sí;No;Sí;No;Sí;Sí;Sí;No;No
102356846;Casa independiente en Calle de Lope de Vega, 12;Chalet;"Se vende casa adosada en el barrio de Belen, doble acceso de entrada de entrada a la vivienda, entrada principal por calle Lope de Vega y entrada por el Barrio de Belen donde se encuentra un parque infantil, la vivienda consta de 3 plantas, Planta baja: Salón, cocina, cuarto de baño completo con bañera y dos amplios dormitorios. Planta primera: dos dormitorios, baño completo recién hecho con plato de ducha y desde el dormitorio principal tenemos acceso a un amplio balcón con vistas al parque infantil.  Planta segunda: acceso a dos amplías terrazas solárium con dos trasteros amplios de obra.  La casa ha sido reformada hace menos de un año. Buena ubicación, céntrica con farmacia y Mercadona a 200 metros y comercios locales alrededor.";660211113;Calle de Lope de Vega, 12;185000;4;Casco Antiguo sur, Ciempozuelos;Amalia;Particular;-;Ciempozuelos;Casco Antiguo sur;-;1233;150;2;-;No;No;No;Sí;No;No;No;Sí;No
94610924;Piso;Piso;"No cobramos comisión al comprador. - Piso con Terraza cubierta de 4,40 m2. En edificio con Ascensor.    La vivienda de 125 m2, se distribuye en: 3 dormitorios, salón, Terraza, cocina independiente, Lavadero y 1 baño.    El salón cuenta con dos grandes ventanas, una de ellas con acceso a la Terraza, desde las que entra luz natural durante el día, en toda la estancia.    La cocina se encuentra completamente amueblada, así como equipada de horno, fogones y extractor. Además, dispone de salida a un Lavadero exterior, abierto, de 3,20 m2.    El baño está equipado de tres piezas y de bañera.    Bien ubicado, junto a varios colegios, paradas de autobús y próximo a todo tipo de pequeños comercios, servicios, farmacias, así como a solo 800 metros del centro de Ciempozuelos.  Asimismo, tiene buena conexión con la carretera M-404 y está a 3,5 km de la Autovía del Sur, A-4.    Llame ahora para conocer más información sobre la vivienda y concertar una visita. - No cobramos comisión al comprador.";919389088;San Benito - Soledad - Hispanidad;119000;3;San Benito - Soledad - Hispanidad, Ciempozuelos;Redwood;Profesional;-;Ciempozuelos;San Benito - Soledad - Hispanidad;-;1293;92;1;-;Sí;No;No;Sí;No;No;No;No;No
100703668;Casa independiente;Chalet;"GPF-18964 Vivienda ubicada en zona centro de Ciempozuelos (Madrid) con una superficie de más de 500 metros cuadrados para entrar a vivir. Se distribuye de la siguiente forma:  La 1ª planta se distribuye en salón-comedor con balcón corrido al exterior, 3 dormitorios, cocina con acceso a terraza con vistas al patio inerior de la finca, baño completo y sala de estar. La 2ª planta está distribuida en salón-comedor con balcón corrido al exterior, 3 dormitorios (uno de ellos en suite), cocina con acceso a balcón corrido que da al interior de la finca y 2 baños completos. A su vez, en la planta baja encontramos un local comercial distribuido en dos estancias, garaje para 2 vehículos ( con posibilidad de un tercero), baño completo y zona techada. Zona muy bien comunicada y rodeada de colegios, comercios, transportes, farmacias, etc. Localización muy céntrica, a escasos 300 metros de Supermercado MERCADONA y a 15 minutos caminando de Estación de Renfe Cercanías de Ciempozuelos. Sobre nosotros: GEPPCO es una Inmobiliaria que ofrece tanto al propietario como al comprador todos los servicios necesarios para que pueda convertir su sueño en una realidad y para ello en todo el proceso contarás con asesoramiento y gestión de alto nivel con una amplia experiencia de más de 25 años y todo un equipo multidisciplinar en el sector: Financiero, Inmobiliario y Jurídico.  Para más información, visítenos en GPF-18964.";919381903;Casco Antiguo sur;299999;6;Casco Antiguo sur, Ciempozuelos;Geppco Inmobiliaria;Profesional;-;Ciempozuelos;Casco Antiguo sur;-;574;523;4;-;No;No;No;Sí;Sí;Sí;Sí;Sí;No
102322637;Chalet adosado en murillo s/n;Chalet;"NAVARRO REAL ESTATE vende chalet adosado en Ciempozuelos.  Chalet adosado compuesto por dos plantas. En la planta principal se encuentran el salón con acceso al patio, baño completo con ventana y bañera, amplia cocina y dos dormitorios con armarios empotrados. En la planta superior encontramos dos dormitorios. El principal tiene armarios empotrados, aire acondicionado, acceso a terraza y al baño. El otro dormitorio tiene aire acondicionado y suelo de tarima flotante. Baño completo con ventana y bañera. Gran patio con piscina. Plaza de garaje en planta y trastero. Este inmueble tiene una ubicación excelente ya que se encuentra en una zona tranquila, próxima al centro y con buena comunicación, paradas de autobús y a 2 minutos de la carretera M-404. No dude en llamarnos para concertar una cita para poder visitar el piso. Disponemos de departamento financiero para asesorarle y si lo necesita, conseguir las mejores condiciones para su hipoteca.";919382018;murillo s/n;284000;4;Cuevas - Ilustración, Ciempozuelos;Navarro Real Estate;Profesional;-;Ciempozuelos;Cuevas - Ilustración;-;1732;164;2;-;No;No;Sí;Sí;Sí;Sí;Sí;Sí;Sí
102345552;Chalet adosado;Chalet;"Crown & Wells Real Estate, comercializa una fantástica oportunidad compra directa o de Arrendamiento con Opción a compra de Chalet adosado en Ciempozuelos. El inmueble cuenta con 183 m2 que se distribuyen en:  Planta principal: Salón independiente con zona para ubicar el comedor y salida al jardín, aseo y Cocina indepente amueblada con electrodomésticos. Primera planta: Baño completo, tres dormitorios con armarios empotrados de madera (color pino), dormitorio principal con baño. Buhardilla: preciosa y amplia buhardilla diáfana con velux y trasteros en la parte inferior de los muros, techos de madera. Dispobible en venta directa y alquiler con opción a compra. Para más información y visitas, contacten con nosotros, estaremos encantados de atenderles.";919388476;San Benito - Soledad - Hispanidad;277300;3;San Benito - Soledad - Hispanidad, Ciempozuelos;CROWN & WELLS Real Estate;Profesional;-;Ciempozuelos;San Benito - Soledad - Hispanidad;-;1515;183;3;-;No;No;No;Sí;Sí;Sí;Sí;Sí;Sí
96540462;Chalet en Calle de la Flor, 7;Chalet;"Venta de magnífica casa situada en el casco antiguo de Ciempozuelos, reformada en su totalidad en 2005, Con 5 dormitorios dobles, dos de ellos en Suite con Baño, tres baños y dos aseos, cocina independiente, comedor, salón, garaje, porche, piscina y dos construcciones independientes, uno de 20 metros usado como segunda cocina y la otra de 35 m como zona de lavadero. Cuenta con mas de 250 mts de patio, además de una cueva de 80 mts, provista de luz y agua. Es una propiedad con muchas opciones, son dos fincas registrales independientes, pudiendo hacer otra casa donde está la cocina y el porche. Pregúntanos las opciones, te asesoraremos en lo que necesites. No dejes pasar esta oportunidad de vivir tranquilamente, cerca de Madrid en una gran casa con todos sus servicios, zonas de compra, transporte, colegios.";919381033;Calle de la Flor, 7;495000;5;Cuevas - Ilustración, Ciempozuelos;Bienestarsi;Profesional;-;Ciempozuelos;Cuevas - Ilustración;-;853;580;4;-;No;No;Sí;No;No;No;Sí;No;Sí
100518059;Piso en España;Piso;"Excelente piso seminuevo en el centro.  Al lado de la plaza del Ayuntamiento.  Piso de aproximadamente 55 metros cuadrados.  Ideal para personas mayores o con movilidad reducida.  Ideal también como inversión, cerca de la estación de tren y en el centro.  Perfecto estado. Hall de entrada. Salón de aproximadamente 18 metros cuadrados. Cocina completamente amueblada de aproximadamente siete metros cuadrados. Un dormitorio doble con armario empotrado. Calefacción de gas natural con radiadores de aluminio. Aire acondicionado.  Excelentes calidades.  Suelos de gres.  Ventanas de aluminio lacado con doble acristalamiento.  Puertas de roble. Ascensor.  Puerta principal blindada.  Excelente ubicación, al lado de supermercados, bancos, tiendas. Todo cerca. Mejor verlo. No cobramos comisión al comprador.";919380127;España;97000;1;Casco Antiguo sur, Ciempozuelos;Inmobiliaria dorian;Profesional;-;Ciempozuelos;Casco Antiguo sur;-;1764;55;1;bj;Sí;No;No;No;No;No;Sí;No;No
102144047;Piso en Calle Montañas de Covadonga;Piso;"Agencia inmobiliaria de Ciempozuelos-zona Ciempozuelos-oficina Tecnocasa VENDE piso de 137 m2 CONSTRUIDOS. La primera estancia de la vivienda se compone de un hall, salón-comedor independiente con acceso a un amplio patio con zona chill out y una luminosa cocina. La segunda estancia de la vivienda se compone de 3 dormitorios equipados con armarios empotrados y 2 baños completos con bañera. La vivienda está reformada, además de incluir garaje y un trastero de 13 m2 aprox. en el precio. Ubicado en una urbanización con piscina, cerca de diversos servicios como colegios, paradas de bus, supermercados y restaurantes. No dude en llamarnos para concretar su cita para visitar el inmueble, en la que además recibirá el asesoramiento gratuito de nuestro departamento financiero Kiron.";919382822;Calle Montañas de Covadonga;179000;3;Cuevas - Ilustración, Ciempozuelos;Tecnocasa Ciempozuelos;Profesional;-;Ciempozuelos;Cuevas - Ilustración;-;1307;137;2;bj;Sí;No;Sí;Sí;Sí;Sí;No;Sí;No
100006890;Dúplex en Calle de Rueda, 6;Duplex;"“INMOBILIARIA DEL RÍO le oferta en exclusiva vivienda Dúplex de 4 dormitorios” Características de la Vivienda: -Segunda planta exterior, -Con excelente iluminación natural, -Hall de entrada, -Salón/comedor con terraza de 14 metros, -Escalera con barandillas de seguridad, -Cocina equipada con electrodomésticos y con una terraza de 2 metros, -Cuatro dormitorios de buen tamaño, el principal en suite, -Tres baños completos, -Calefacción y aire acondicionado por conductos, -La finca cuenta con ascensor y rampa de acceso, No dude en ponerse en contacto con nosotros para visitar este inmueble y para solicitar más información. Estamos siempre gustosos de atenderle. Del Río Inmobiliaria Madrid.";600971765;Calle de Rueda, 6;155000;4;San Benito - Soledad - Hispanidad, Ciempozuelos;Inmobiliario Del Río;Profesional;-;Ciempozuelos;San Benito - Soledad - Hispanidad;-;1148;135;3;2;Sí;No;No;Sí;No;No;Sí;No;No
100889119;Piso;Piso;"MHDB METROPOLITANO vende en exclusiva piso de 74 m² construidos. La vivienda necesita reforma integral, dispone de amplio salón con terraza, cocina con terraza, tres dormitorios, 1 baño, tendedero.  La finca tiene piscina, esta situada en una zona bien comunicada y a un minuto del centro del pueblo, tiene ascensor. Cuenta con todos los servicios cerca: Supermercados, Centro de Salud, colegios,  institutos y escuelas infantiles. , bancos, cafeterías, restaurantes. El Hospital más cercano es el de Valdemoro a 15 minutos en transporte publico. Ciempozuelos cuenta con una estación de RENFE de cercanías que conecta directamente con Madrid capital. Línea de autobús hasta Madrid. ¡EXCELENTE OPORTUNIDAD! Consúltenos sin compromiso, estaremos encantados de ayudarle.";919382289;Casco Antiguo norte;88000;3;Casco Antiguo norte, Ciempozuelos;MHDB Metropolitano ;Profesional;-;Ciempozuelos;Casco Antiguo norte;-;1189;74;1;5;Sí;No;Sí;Sí;No;No;No;No;No
