Id del anuncio;Título;Tipo de inmueble;Descripción;Teléfono;Dirección;Precio;Habitaciones;Subtítulo;Nombre del vendedor;Tipo de vendedor;Barrio;Municipio;Distrito;Precio antes de rebaja;Euros/m2;Metros cuadrados construidos;Baños;Planta;Ascensor (Sí/No);Obra nueva (Sí/No);Piscina (Sí/No);Terraza (Sí/No);Parking (Sí/No);Parking incluído en el precio (Sí/No);Aire acondicionado (Sí/No);Trastero (Sí/No);Jardín (Sí/No)
101243738;Casa independiente;Chalet;"Mr. House Real Estate te ofrece CASA INDEPENDIENTE CON PISCINA CUBIERTA CLIMATIZADA en una de las mejores ubicaciones de Griñón ¡SIN COMISIONES! Se trata de un impresionante chalet independiente de unos cómodos 350m2 distribuidos de la siguiente forma: - PLANTA BAJA: cuenta con unos 120 m2 distribuidos en 3 amplios dormitorios, baño completo, cocina, gran salón y zona de comedor. Además encontramos los accesos a las zonas exteriores. - PLANTA PRIMERA: Aquí encontramos el IMPRESIONANTE DORMITORIO PRINCIPAL con más de 30m2 y baño en suite, DOS VESTIDORES y acceso a terraza. - PLANTA SÓTANO: Destinada a zonas de almacenaje y cuartos de calderas. - ZONA DE PISCINA: Amplio salón diáfano con más de 90m2 con PISCINA CLIMATIZADA, zona de ocio y zona de descanso. Además dispone de un baño completo con POSIBILIDAD de sauna. Esta vivienda está equipada con las mejores calidades. Suelos del mejor gress, ventanas de climalit, CALEFACCIÓN de gasoil en toda la vivienda. Puertas de acceso automáticas. Zona de piscina con Persianas automatizadas de Somfy y ventanas tipo claraboya también automatizadas. Toda la parcela se encuentra solada y ajardinada. Además, la zona de aparcamiento se encuentra cubierta. SOLICITA MÁS INFORMACIÓN SIN COMPROMISO! En Mr House Real Estate NO COBRAMOS COMISIONES DE COMPRA NI POR GESTIÓN FINANCIERA! Mr. House Real Estate 为您提供位于马德里南部Griñon最佳地点之一的带室内温水游泳池的独立住宅，无需中介费！ 这是一栋令人印象深刻的独立别墅，面积为 350 平方米，分布如下： - 零楼：约 120 平方米，有三间卧室、设施齐全的浴室、厨房、大客厅和用餐区。 和通往室外区域的出口。 - 一楼：一间主卧室，面积超过 30 平方米，设有一间浴室、两间更衣室和阳台。 - 地下室：用于储藏区和锅炉房。 - 泳池区：超过 90 平方米的大型开放式房间，设有恒温泳池、休闲区和休息区。 它还有一个带桑拿的可能性的完整浴室。 这所房子配备了最好的品质。 最好的石器地板，climalit 窗户，整个房子的油加热。 自动检修门。 带自动化百叶窗和天窗式窗户的泳池区。 整个地块都经过铺砌和美化。 此外，停车区也被覆盖。 联系我们索取更多信息！ 在 Mr House Real Estate，我们不收取买家中介费和申请贷款手续费！ 中文联系电话： 小刘 (WhatsApp同步) 微信：Mrhouse88.";919386950;Griñón;497500;4;-;Mr House Real Estate;Profesional;-;Griñón;-;-;1382;360;3;-;No;No;Sí;Sí;Sí;Sí;Sí;Sí;Sí
102159402;Casa rural;Casa Rural;"Gilmar Madrid Río ( ) vende casa unifamiliar a estrenar en Griñón (Madrid). Vivienda de 110 m2 construidos con parcela de 8000 m2 (son dos fincas independientes una de 3784m² y la otra donde se encuentra la vivienda de 4141m²). Distribuida en una sola planta con 3 habitaciones, cocina francesa independiente, 2 baños y salón-comedor con chimenea. Además, cuenta con un espacio polivalente con otra chimenea. Entre sus materiales destacamos, bomba frio/calor, ventanas climalit oscilobatientes, suelo de tarima de vinilo de alta calidad. En la trasera de la vivienda encontramos zona barbacoa de obra y en la parte posterior de la misma la leñera, además tiene pozo y depósitos que garantizan el abastecimiento de agua durante todo el año. Asimismo posee un sistema de filtración y cuidado de aguas para su consumo con total garantía de su salubridad. La vivienda está registrada. Esta finca se encuentra en un entorno único, con unos atardeceres de ensueño. Ideal para personas que sueñan con vivir en permanente contacto con la naturaleza. En Gilmar trabajamos para ofrecer a nuestros clientes los mejores inmuebles desde hace 40 años. Cubrimos todas las necesidades inmobiliarias: viviendas, oficinas, locales comerciales, solares, fincas rústicas, terrenos para construir.. . Disponemos de más de 30 equipos especializados en distintas zonas al servicio de más de 90.000 Clientes nacionales e internacionales, que cuentan con asesoramiento necesario para garantizar su seguridad, eficacia jurídica y la mejor rentabilidad financiero-fiscal. Visita nuestra web y encontrarás 4.000 oportunidades más.";919387042;Griñón;389000;3;-;Gilmar Madrid Río;Profesional;-;Griñón;-;-;2288;170;2;-;No;No;No;No;Sí;Sí;Sí;Sí;Sí
97350060;Piso en Calle de Las Eras;Piso;"Mr. House Real Estate te ofrece un IMPRESIONANTE PISO DE 4 DORMITORIOS CON PISCINA en pleno centro de Griñón! Se trata de una vivienda de unos 95m2 distribuidos en 4 dormitorios, baño completo, amplio salón-comedor con terraza integrada y amplia cocina con zona de lavadero. El piso está equipado con ventanas de climalit, calefacción individual de Gas Natural, suelos de gress, baño actualizado y reformado con plato de ducha, etc. URBANIZACIÓN PRIVADA con PISCINA comunitaria, zona infantil y parking semi-privado. La finca se encuentra en una ubicación privilegiada junto a todo tipo de servicios (supermercados, centros educativos, restaurantes, comercios, etc. ) SOLICITA MÁS INFORMACIÓN SIN COMPROMISO! En Mr. House Real Estate NO COBRAMOS COMISIONES DE COMPRA NI POR GESTIÓN HIPOTECARIA!";919386950;Calle de Las Eras;159900;4;-;Mr House Real Estate;Profesional;-;Griñón;-;-;1648;97;1;3;No;No;Sí;No;No;No;No;No;Sí
102133057;Chalet pareado;Chalet;"GRIÑÓN INMOBILIARIA presenta este chalet en una parcela solada y ajardinada, varios ambientes y cenadores. La casa es comoda y distribuida en 3 plantas: planta sotano con salón y sala de juegos, gimnasio, cuarto de caldera. Planta principal con 1 dormitorio, salón /comedor, cocina con office, 1 baño y porche grande acristalado. Planta primera con 4 dormitorios y 2 baños /uno en el dormitorio principal/ y una terraza muy grande acristalada. La zona es tranquila, la casa es comoda, el ambiente es acogedor. En Griñón inmobiliaria estamos convencidos de que la venta de una propiedad es una decisión difícil, ya que conlleva un tramite. Nuestros comerciales estarán todo el trayecto contigo. Proporcionamos: Asistencia y asesoramiento legal y administrativo, Estudios sobre el mercado de la zona, valoración gratuita de su vivienda, Promocionamos su propiedad en todos los medios comerciales necesarios nacionales, para encontrar al comprador idóneo, Nos adaptamos a sus necesidades. VENTA SIN EXCLUSIVA. Tenemos una base de clientes muy amplia y esto nos ayuda agilizar el tiempo de búsqueda.  También cabe destacar que GRIÑÓN INMOBILIARIA gestiona todos los pasos necesarios hasta llegar a notaria, nos ocupamos de que este trayecto sea rápido, fácil y agradable.  Estamos en c/Juan Carlos I N7 local 7 Griñón Madrid tel. y.";919383463;Griñón;349000;5;-;Griñon inmobiliaria;Profesional;-;Griñón;-;-;1129;309;3;-;No;No;No;Sí;No;No;Sí;Sí;Sí
94858737;Casa independiente;Chalet;"Griñón inmobiliaria vende este magnifico chalet independiente que puede ser la casa que soñaste y que siempre querías tener. Disponemos de 4 plantas -. Sótano /garaje o un salón de verano de 125 m2/, planta principal tiene una entrada grande y luminosa, un salón con mucha luz y encanto, una habitación y un baño con ventana, cocina muy grande, planta primera: 4 dormitorios y 3 baños con terrazas en cada dormitorio, buhardilla diáfana muy grande y muy luminosa. Parcela de 500 m2 con piscina cubierta, porche, barbacoa y muchos frutales y plantas muy bien cuidado. Ven y te lo enseñamos o llamanós a tel 0   griñón inmobiliaria, es la inmobiliaria de referencia de griñón, por experiencia profesionalidad, con los años qué llevamos ubicados en la calle juan carlos i nº 7, el conocimiento de nuestra localidad y demás localidades colindantes, hace qué la información sea segura y certera, y eso es muy importante para tener noción de donde vas a vivir, contactar con nosotros si compras o vendes, seriedad y transparencia, esa es nuestra carta de presentación, compra tu casa te haremos un estudio gratuito financiero sabiendo lo qué puedes compra gestionamos tu hipoteca personalizada, y te vendemos tu casa con total garantía de llegar a materializarse la compra-venta, llama para más información, móvil muchas gracias centro de salud 24 horas, y todos los servicios que necesita una localidad como griñón colegios, institutos, centros comerciales, y las mejores tiendas para comprar en griñón. 2 lineas de bus, y una de las mejores zonas para vivir tranquil@.   no cobramos honorarios al comprador..";919383463;Griñón;489900;5;-;Griñon inmobiliaria;Profesional;-;Griñón;-;-;1089;450;4;-;No;No;Sí;Sí;Sí;Sí;Sí;Sí;Sí
100999295;Chalet pareado;Chalet;"GRIÑON INMOBILIARIA vende magnifico chalet pareado distribuido en 3 plantas con garaje, piscina cubierta y porche grande con pergola y chimenea. Planta baja con cocina amueblada, aseo, salón grande con salida al porche y garaje. Planta primera con 3 dormitorios y 2 baños /uno en el dormitorio principal /. Buhardilla diafana y muy luminosa. La vivienda tiene instaladas 10 placas solares y el consumo de la luz es aprox. 30e al mes, calefacción de gasoil individual. Ubicación céntrica. Te va a encantar, te lo enseñamos! En Griñón inmobiliaria estamos convencidos de que la venta de una propiedad es una decisión difícil, ya que conlleva un tramite. Nuestros comerciales estarán todo el trayecto contigo. Proporcionamos: Asistencia y asesoramiento legal y administrativo, Estudios sobre el mercado de la zona, valoración gratuita de su vivienda, Promocionamos su propiedad en todos los medios comerciales necesarios nacionales, para encontrar al comprador idóneo, Nos adaptamos a sus necesidades. VENTA SIN EXCLUSIVA. Tenemos una base de clientes muy amplia y esto nos ayuda agilizar el tiempo de búsqueda.  También cabe destacar que GRIÑÓN INMOBILIARIA gestiona todos los pasos necesarios hasta llegar a notaria, nos ocupamos de que este trayecto sea rápido, fácil y agradable.  Estamos en c/Juan Carlos I N7 local 7 Griñón Madrid tel. y.";919383463;Griñón;409000;3;-;Griñon inmobiliaria;Profesional;-;Griñón;-;-;1834;223;3;-;No;No;Sí;Sí;Sí;Sí;Sí;Sí;Sí
102384012;Casa independiente;Chalet;"GRIÑÓN INMOBILIARIA te abre las puertas de esta casa única, acogedora y muy comoda en un entorno y ubicación perfectos para disfrutar. La casa está distribuida en 3 plantas (sotano, planta principal y planta primera ) sobre una parcela de 543 m2 con piscina, porche y trasteros. Planta principal: cocina grande con despensa/lavadero, salón independiente con comedor, un aseo, dormitorio con baño. Planta primera: 3 dormitorios y un baño y en planta sotano tenemos un garaje para varios coches, cuarto trastero y cuarto caldera.  Queremos destacar en esta casa la construcción: calidad de los materiales, muros de piedra y hormigon /sin pladur/, ventanas de climalit, puertas roble y pintura lisa. Es una oportunidad para familias que quieren vivir cerca de Madrid, en un pueblo como Griñon con su encanto y servicios necesarios (ambulatorio 24h, farmacias, colegios, instituto, centro de mayores, supermercados).  GRIÑÓN INMOBILIARIA, es la inmobiliaria de referencia de Griñón, por experiencia profesionalidad, con los años qué llevamos ubicados en la calle juan Carlos I Nº7, el conocimiento de nuestra localidad y demás localidades colindantes, hace qué la información sea segura y certera, y eso es muy importante para tener noción de donde vas a vivir, contactar con nosotros si compras o vendes, seriedad y transparencia, esa es nuestra carta de presentación, compra tu casa te haremos un estudio gratuito financiero sabiendo lo qué puedes compra gestionamos tu hipoteca personalizada, y te vendemos tu casa con total garantía de llegar a materializarse la compra-venta, llama para más n, móvil.";919383463;Griñón;430000;5;-;Griñon inmobiliaria;Profesional;-;Griñón;-;-;1433;300;3;-;No;No;Sí;No;Sí;Sí;No;Sí;Sí
98793024;Casa independiente en Abrantes;Chalet;"^**^ GRAN LUJO…ESPECTACULAR CHALET INDEPENDIENTE DE 573 m2 CON PARCELA DE 750 m2, CON UNA SITUACION INMEJORABLE. ASCENSOR Y PISCINA ^**^ Esta propiedad, totalmente impecable, consta de 3 plantas, con un impecable jardín con césped natural y piscina con zona de jacuzzi. Consta de 4 dormitorios, todos en suite con baño. El dormitorio principal con un gran vestidor independiente. 5 baños completos y un aseo de cortesía. 2 salones, el principal con área de comedor y chimenea, 2 cocinas, amplia zona de ocio con bodega, zona de plancha, 2 terrazas. La vivienda cuenta con un impresionante recibidor a doble altura, con Ascensor a las 3 plantas. Garaje interior para 4 coches. La vivienda está lista para entrar a vivir, las paredes están pintadas en liso y se encuentran en un perfecto estado al igual que sus suelos, con suelo radiante de agua en toda la casa. Preinstalación de domótica. Aire acondicionado en toda la casa. Ventanas eléctricas y oscilobatientes. Aspiración centralizada. Conducto interior de ropa con caída a lavadero. Hilo musical en toda la casa y alarma con conexión a central. Sensores de luz en entradas de la casa y garaje. El jardín tiene una impresionante piscina con agua climatizada, salinizada y con zona de jacuzzi. Zona de barbacoa exterior. Un verdadero lujo de acabados en toda la casa. A 5 minutos andando del centro del pueblo y de todos los servicios ¡Ven a visitar esta fabulosa casa, te está esperando! No verás una oportunidad igual, te encantará…!  Posiblemente una de las mejores casas de lujo de la zona….      ^**^Este anuncio no es vinculante y puede contener errores. Se muestra a título informativo y no es contractual^**^ ***NO COBRAMOS COMISIÓN AL COMPRADOR.";915344831;ABRANTES;795000;5;-;RE/MAX Jumbo;Profesional;-;Griñón;-;-;1387;573;7;-;No;No;Sí;Sí;Sí;Sí;Sí;Sí;Sí
98792832;Casa independiente en Abrantes;Chalet;"^**^ESPECTACULAR CHALET GRAN LUJO INDEPENDIENTE DE 573 m2 CON PARCELA DE 750 m2, CON UNA SITUACION INMEJORABLE. ASCENSOR Y PISCINA^**^ Esta propiedad, totalmente impecable, consta de 3 plantas, con un impecable jardín con césped natural y piscina con zona de jacuzzi. Consta de 4 dormitorios, todos en suite con baño. El dormitorio principal con un gran vestidor independiente. 5 baños completos y un aseo de cortesía. 2 salones, el principal con área de comedor y chimenea, 2 cocinas, amplia zona de ocio con bodega, zona de plancha, 2 terrazas. La vivienda cuenta con un impresionante recibidor a doble altura, con Ascensor a las 3 plantas. Garaje interior para 4 coches. La vivienda está lista para entrar a vivir, las paredes están pintadas en liso y se encuentran en un perfecto estado al igual que sus suelos, con suelo radiante de agua en toda la casa. Preinstalación de domótica. Aire acondicionado en toda la casa. Ventanas eléctricas y oscilobatientes. Aspiración centralizada. Conducto interior de ropa con caída a lavadero. Hilo musical en toda la casa y alarma con conexión a central. Sensores de luz en entradas de la casa y garaje. El jardín tiene una impresionante piscina con agua climatizada, salinizada y con zona de jacuzzi. Zona de barbacoa exterior. Un verdadero lujo de acabados en toda la casa. A 5 minutos andando del centro del pueblo y de todos los servicios ¡Ven a visitar esta fabulosa casa, te está esperando! No verás una oportunidad igual, te encantará…! Posiblemente una de las mejores casas de lujo de la zona….      ^**^Este anuncio no es vinculante y puede contener errores. Se muestra a título informativo y no es contractual^**^ ***NO COBRAMOS COMISIÓN AL COMPRADOR.";919385793;ABRANTES;795000;5;-;Team Javier Villalba TJV;Profesional;-;Griñón;-;-;1387;573;7;-;No;No;Sí;Sí;Sí;Sí;Sí;Sí;Sí
99460331;Chalet en Avenida de la Paz;Chalet;"De particular a particular. Sin comisión al comprador. Llámanos y visita esta vivienda. Espectacular chalet de 180 m² en Griñón, provincia de Madrid. Esta vivienda, por su amplitud, satisface las necesidades de una familia con niños.  Este chalet tiene dos plantas de altura y se distribuye en amplio y luminoso salón, cocina amueblada, absolutamente independiente del resto de estancias y equipada con electrodomésticos, cuatro dormitorios y tres cuartos de baño completos. Además, el chalet cuenta con terraza para disfrutar de luz natural en toda la estancia, un patio para que puedas desayunar al aire libre, una práctica galería para aumentar el espacio y armarios empotrados, para aumentar la capacidad de almacenaje de tu hogar. El inmueble es todo exterior, con jardín privado con barbacoa con horno, en el que aprovecharás el buen tiempo. Este chalet se encuentra situado en una vía de fácil acceso, tiene garaje, para que puedas aparcar con comodidad y trastero, para que guardes todo aquello que necesites.  Con orientación sur, es una casa muy soleada en las horas centrales del día. La vivienda se vende sin amueblar y en perfecto estado, lista para entrar a vivir. En cuanto a las calidades, este chalet cuenta con calefacción de gas, carpintería exterior de pvc y suelos de parquet, que da mucha calidez a la vivienda.  Esta casa está situada en una zona tranquila y bien comunicada, muy cerca de la parada de autobús. Para mayor comodidad, la vivienda se encuentra muy cerca de un centro médico, un colegio y todos los servicios necesarios.  h1o3u4s3e6l1l.";919389411;Avenida de la Paz;412000;4;-;Housell;Profesional;-;Griñón;-;-;2289;180;3;-;No;No;No;Sí;Sí;Sí;No;Sí;Sí
101956212;Dúplex en Calle Mayor;Duplex;"Este espectacular ático dúplex es una oportunidad única para vivir en una propiedad llena de estilo y comodidades al mismo tiempo. Con sus impresionantes vistas despejadas, la luminosidad que inunda cada rincón del hogar se convierte en uno de los principales atractivos. Este espacioso piso cuenta con un total de tres habitaciones - una doble y dos individuales lo cual ofrece suficiente espacio para toda la familia o incluso invitados adicionales. La cocina está completamente equipada con electrodomésticos modernos, mientras que los baños presentan acabados impecables e incluyen todas las facilidades necesarias. Además, esta maravillosa propiedad viene acompañada por numerosas características excepcionales: aire acondicionado centralizado frío/calor, suelos elegantes, armarios empotrados prácticos, puerta blindada segura.. . ¡y mucho más! El garaje privado te otorgará tranquilidad adicional sabiendo que tu vehículo estará siempre seguro debajo tuyo! Situado justo en el centro histórico del pueblo junto al Ayuntamiento, rodeado por todo tipo servicios accesibles caminando como supermercados, farmacias, etc. ¿Qué esperas? No pierdas esta increíble oportunidad única!";919385824;Calle Mayor;197260;3;-;Human House Inmobiliaria;Profesional;-;Griñón;-;-;1450;136;2;1;Sí;No;No;No;Sí;Sí;No;Sí;No
102000077;Casa independiente;Chalet;"¡Descubre esta joya inmobiliaria en el corazón de Griñon! Con una superficie de 492.00 m2 y una parcela de 1901 m2, este inmueble singular te ofrece seis amplias habitaciones dobles y tres baños completos con un amplio plato de ducha. Su cocina equipada te permitirá disfrutar de momentos culinarios únicos. Además, cuenta con detalles de calidad como carpintería interior de madera, suelo de gres y madera en la planta primera y carpintería exterior tipo climalit. Aprovecha el garaje techado con capacidad para varios coches.  ¡Además, este inmueble es perfecto para organizar eventos! Con su gran superficie, podrás celebrar reuniones familiares, fiestas con amigos o incluso bodas. Esta increíble propiedad también cuenta con una bodega, ideal para los amantes del vino y para organizar catas o eventos exclusivos. Disfruta de un espacio único y especial para almacenar tus mejores vinos y sorprender a tus invitados. ¡Imagina todas las posibilidades que ofrece este lugar!  No lo pienses más y contáctanos para conocer más detalles sobre esta increíble propiedad en Griñon.  ¡Te encantará! Súmale la casa del patio para tus invitados o para hacer usa de ella en verano, tiene muchas posibilidades!  ¿para qué la vas a utilizar tu? ¡No dejes pasar esta oportunidad única!";825760419;Griñón;777225;6;-;Inmobiliaria 23;Profesional;-;Griñón;-;-;1580;492;3;-;No;No;Sí;No;Sí;Sí;No;Sí;Sí
100973595;Piso en Paseo de la Cárcava;Piso;"MR HOUSE REAL ESTATE VENDE! Piso en el Paseo de la Cárcava, en Griñón, Madrid. La vivienda dispone de 86 m2 de los cuales son útiles 63 m2 distribuidos en salón-comedor con terraza, cocina con lavadero, 3 habitaciones y 1 baño. Ubicado en una tercera planta de un edificio sin ascensor. Localizado en el casco urbano de la localidad, muy cerca de la Plaza de las Coliflores. Municipio a 35 Km del centro de Madrid, con todos los servicios básicos a su alcance, con oferta educativa como el Colegio Garcilaso de la Vega, el centro medico, y una gran variedad de servicios de restauración y zonas verdes valoradas en las que poder realizar actividades al aire libre como el. Todo ello, además, con excelentes comunicaciones por transporte público (autobús) y carreteras (M-404 y M-407). LLÁMENOS  LE INFORMAREMOS  SIN COMISIONES POR COMPRA NI POR GESTIÓN DE HIPOTECA MR HOUSE REAL ESTATE SIEMPRE LE OFRECE EL MEJOR PRODUCTO A SU JUSTO PRECIO MR HOUSE 房地产出售！ 位于马德里格里尼翁的 Paseo de la Cárcava 公寓。 房子有 86 平方米，其中 63 平方米有用，分布在带露台的起居-用餐室、带杂物间的厨房、3 间卧室和 1 间浴室。 位于一栋没有电梯的大楼的三楼。 位于小镇市区，离花椰菜广场很近。 距离马德里市中心 35 公里的自治市，所有基本服务触手可及，提供教育服务，例如 Garcilaso de la Vega 学校、医疗中心，以及各种餐厅服务和有价值的绿地进行户外活动，例如 所有这一切，此外，还有公共交通（公共汽车）和高速公路（M-404 和 M-407）的良好通讯。 致电我们 我们会通知您 无购买或抵押管理佣金 MR HOUSE REAL ESTATE 始终以合适的价格为您提供最好的产品.";919386950;Paseo de la Cárcava;130000;3;-;Mr House Real Estate;Profesional;-;Griñón;-;-;1512;86;1;3;No;No;No;Sí;No;No;No;No;No
100897739;Chalet adosado en Rubi;Chalet;"Solvia ofrece Chalet adosado en venta en el municipio de Griñón, provincia de Madrid. Situado en un área residencial con todos los servicios y buenas comunicaciones (paradas de autobús próximas, buen acceso rodado a las carreteras M-404 y M-407 que conectan en pocos minutos con la A-42. La zona está dotada de equipamiento variado, centros deportivos, colegios, supermercados, restaurantes, etc. Cuenta con salón-comedor, cocina amueblada, 4 dormitorios, 3 baños y garaje. Está edificada sobre una parcela de 250 m². Cuenta con pavimento de parquet en la mayoría de las estancias. Con los servicios de Solvia podrá encontrar la vivienda que necesita y asegurar su inversión con el mejor de los asesoramientos especializados. Empiece ahora mismo pidiendo más información. Un responsable cercano a usted le atenderá personalmente.";919388079;Rubi;338100;4;-;Solvia Store Boadilla del Monte;Profesional;-;Griñón;-;-;1674;202;3;-;No;No;No;Sí;No;No;No;No;No
102347389;Chalet pareado;Chalet;"¿Buscas un hogar cómodo, espacioso y lleno de detalles? Entonces esta Casa Pareada ubicada en la zona privilegiada de Griñon es para ti. Con 300 m² distribuidos entre cinco habitaciones dobles, tres baños completos y cocina equipada encontrarás todo el espacio que necesitas para vivir al máximo. Además, cuenta con suelos de gres y carpinterías exteriores tanto en aluminio como climalit haciendo énfasis a los acabados impecables. Entre sus fabulosas características destacan armarios empotrados por toda la casa permitiendo aprovechar hasta el último rincón, trastero, techos altos dotando cada estancia mayor amplitud, jardín privado cuidadosamente diseñado perfecto para relajarte después del trabajo así como una espectacular terraza acristaladas ideal durante cualquier época del año ya sea verano o invierno ¡No pierdas más tiempo!  Cuenta con un sótano muy amplio en el que tienen dos dormitorios, salón y trastero.  Ven a visitar nuestro inmueble hoy mismo.";919385824;Griñón;356260;5;-;Human House Inmobiliaria;Profesional;-;Griñón;-;-;1188;300;3;-;No;No;No;Sí;Sí;Sí;Sí;Sí;Sí
