101955432;Piso en Paseo de la Chopera;Piso;"GRUPO INMOBILIARIO MILENIUM ofrece VENTA de vivienda en Paseo de la Chopera. Vivienda de 130m2 con una orientación Oeste se encuentra en una zona tranquila y céntrica, junto a la estación de metro de Marqués de la Valdavia y estación de tren Valdelasfuentes, cerca de comercios, transportes públicos, centros de salud, zonas verdes, colegios y centros educativos. La vivienda se distribuye en: - Cuatro (4) habitaciones - Dos (2) baños completos - Amplia cocina con acceso a terraza-tendedero - Salón y comedor independiente Y dispone de las siguientes características: - Ventanas de aluminio - Puertas macizas de sapelli - Suelos de parqué - Armarios empotrados (3) - Aire Acondicionado en todas las estancias - Calefacción central Dispone de dos plazas de garaje. No dudes contactar con nosotros para concertar una visita o preguntar cualquier duda. MÁS FOTOS PRÓXIMAMENTE Consulta la posibilidad de financiación de hasta el 100% con nuestro departamento financiero MHCredit. 3% + IVA de gestión inmobiliaria a cargo del comprador. Asesor Comercial: Quiwuilinov García /  *Oferta no vinculante, puede contener errores de publicación*.";916238844;Paseo de la Chopera;346000;4;Alcobendas Centro, Alcobendas;Grupo Inmobiliario MILENIUM;Profesional;-;Alcobendas;Alcobendas Centro;-;2662;130;2;1;Sí;No;No;Sí;Sí;Sí;Sí;No;No
101707908;Piso en Calle Felicidad De La;Piso;"Magnífico piso de 3 habitaciones y 2 baños, en Alcobendas. 199 m2 construidos. 97 m2 útiles. Orientación Este. Salón independiente. Calefacción por suelo radiante y aire acondicionado por conductos. Armarios empotrados, suelo de tarima, ventanas climalit oscilobatientes y puertas lacadas. Domótica (persianas, luz y clima). Dispone de 2 plazas de garaje (12 m2) y trastero (5 m2). Piscina y zona ajardinada. Portero físico en horario comercial. Ascensor y acceso adaptado a personas con capacidad de movilidad reducida. NO PIERDA ESTA OPORTUNIDAD Y CONTACTE CON NOSOTROS PARA REALIZAR UNA VISITA. Daurum Estate ofrece conseguir la mejor financiación a su medida hasta el 100% del valor de compra – venta sea nuestra la vivienda o no. INFORMACIÓN SIN COMPROMISO en el mismo número de teléfono del anuncio. Además, posibilidad de servicio de reformas para acomodar la vivienda a su gusto.";919382678;Calle Felicidad De La;530000;3;Norte, Alcobendas;DAURUM ESTATE;Profesional;-;Alcobendas;Norte;-;2663;199;2;1;Sí;No;Sí;No;Sí;Sí;Sí;Sí;No
102132366;Chalet pareado;Chalet;"Espectacular vivienda de 4 dormitorios (todos dobles de 14 m² aproximadamente y grandes armarios) más cuarto de servicio, dos terrazas, la superior de 177 m² útiles, garaje independiente de más de 60m² en urbanización cerrada con piscina, muy tranquila pero junto al Centro Comercial Gran Manzana y Teatro de Alcobendas. La vivienda tiene entrada independiente de la urbanización por donde se accede a la zona de servicio y un poco más adelante encontramos la entrada principal con un Hall de acceso de 26 m² con doble altura. Desde aquí a la derecha accedemos al Salón-comedor con una superficie conjunta de 55 m² con chimenea con casette, Aseo de visitas y Cocina cuadrada muy amplia de 21 m² con tendedero y cuarto de servicio con armario empotrado baño completo. En la misma planta, desde el hall a la izquierda pasamos a la zona de dormitorios (4 en total) todos de más de 14 m² útiles y con grandes armarios empotrados. Dos de los dormitorios comparten un baño completo, y los otros dos tienen el baño el suite con ventana, el dormitorio principal con terraza cerrada que permite si queremos instalar más armarios y el baño completo en este caso en mármol. Volviendo al hall, subiendo por la escalera accedemos a un segundo salón o sala de estar, ideal para cuarto de juego para los niños o despacho, al lado opuesto accedemos a la terraza superior de 177 m² útiles con toldos y mucha intimidad, donde disfrutar de reuniones familiares o barbacoas sin molestar a ningún vecino. Volviendo a la entrada a la vivienda, disponemos de una entrada directa e independiente mediante escalera al garaje, de 66 m² que dispone también de portón motorizado que lo independiza de la zona común de rodadura, con espacio de sobra para dos coches, motos, bicis, cofres y todo tipo de accesorios que necesitemos guardar. Una vivienda donde lo que llama especialmente la atención es la luminosidad, la tranquilidad y el gran espacio disponible, donde se puede estar tranquilamente en el salón, mientras los niños están arriba en la sala de juegos o en la terraza con los amigos sin molestar y en una urbanización con piscina con pocos vecinos y a un paso de todo tipo de servicios y transporte público (buses y Renfe Av. de España). Llámenos, estaremos encantados de atenderle sin compromiso. Honorarios agencia por cuenta de la propiedad.";914840150;Ensanche;748000;5;Ensanche, Alcobendas;Comprarcasa APINORTE;Profesional;-;Alcobendas;Ensanche;-;2750;272;5;-;No;No;Sí;Sí;Sí;Sí;No;No;Sí
94286867;Casa independiente;Chalet;"Vende casa baja en zona Gran Manzana de Alcobendas, suelo urbano ideal para inversión se encuentra frente a parque en calle muy tranquila a cinco minutos a pie del Ayuntamiento nuevo de Alcobendas, casa baja con tres accesos, patio de entrada de treinta metros cuadrados con magnifica azotea de cien metros cuadrados y patio de 30 metros, seis habitaciones cocina con office independiente, salón, garaje y almacén, ideal para reformar y rentabilidad.";914840150;Ensanche;392000;6;Ensanche, Alcobendas;Comprarcasa APINORTE;Profesional;-;Alcobendas;Ensanche;-;1574;249;2;-;No;No;No;Sí;No;No;No;No;Sí
102387639;Piso en Calle Salamanca s/n;Piso;"Consulting Inmobiliaria vende en exclusiva magnifica vivienda en la zona centro de Alcobendas. La vivienda es una primera planta que hace de planta baja. Se compone de cocina amueblada, con terraza acristalada a patio interior con zona de tendedero, amplio salón con aire acondicionado y terraza acristalada con armario empotrado realizado de aluminio, 3 habitaciones dobles y un baño completo con plato de ducha. La carpintería de exterior es de aluminio, y climalit oscilobatientes en la terraza del salón, y doble ventana en la habitación principal, la carpintería de interior es madera en sapelly. Los suelos son de gres porcelánico. La calefacción es eléctrica con tarifa nocturna, hay posibilidad de poner gas natural ya que el enganche esta dentro de la vivienda. Posibilidad de que la vivienda quede semi amueblada. Dentro del precio se incluye una plaza de garaje y un trastero en la misma zona de la propiedad. No pierdas la oportunidad e infórmate, estaremos encantadas de ayudarte!";919385276;Calle Salamanca s/n;211000;3;Alcobendas Centro, Alcobendas;Consulting inmobiliario c&h;Profesional;-;Alcobendas;Alcobendas Centro;-;2851;74;1;en;No;No;No;Sí;Sí;Sí;Sí;Sí;No
102386116;Piso en Calle de Quevedo;Piso;"Se vende la NUDA PROPIEDAD de este gran piso dividido en 6 viviendas (actualmente alquiladas) en Calle Quevedo, Alcobendas (Madrid). La actual propietaria, señora de 72 años, conservará el derecho de uso y disfrute de la propiedad de por vida. La propiedad tiene un valor de mercado de 500.000€ y se aplica un 55% de descuento sobre ese valor. ¿Esto que implica? GASTOS DE FORMALIZACIÓN: Abonados en su totalidad por el comprador. Los gastos generados en la compraventa (Impuesto de Transmisiones Patrimoniales, notario y registro). El Impuesto de Plusvalía Municipal, será abonado por el vendedor. GASTOS DE MANTENIMIENTO: Una vez formalizada la operación ante notario, los gastos de la vivienda se distribuirán de la siguiente manera: 1. El Impuesto de Bienes Inmuebles (IBI), las derramas extraordinarias y el seguro de continente serán asumidos POR LA PARTE COMPRADORA. 2. La cuota ordinaria de la comunidad, el seguro de contenido, la tasa de residuos urbanos y los suministros (luz, agua, etc. ), individualizados o no, serán asumidos POR LA PARTE VENDEDORA. Descripción del inmueble Te presentamos este piso excepcionalmente rentable, dividido en seis viviendas independientes que actualmente se encuentran todas alquiladas. Cada vivienda ofrece un espacio acogedor y funcional, adaptado a las necesidades de sus inquilinos: Vivienda 1: 2 habitaciones, baño y cocina. 700€ alquiler. Vivienda 2: estudio con ventanas a la calle. 450€ alquiler. Vivienda 3: estudio con ventana al pasillo. 450€ alquiler. Vivienda 4: estudio con ventana al pasillo. 450€ alquiler. Vivienda 5: 2 habitaciones, baño y cocina. 700€ alquiler. Vivienda 6: 2 habitaciones, baño y cocina. 700€ alquiler. Por lo tanto, los ingresos por alquileres actualmente son de 3.350 €.  NOTA IMPORTANTE: Los ingresos de los alquileres seguirán siendo recibidos por la usufructuaria hasta su fallecimiento. Esta propiedad es una inversión sólida y rentable en el futuro. Además, su ubicación privilegiada agrega un valor adicional, brindando acceso a servicios, transporte público y una variedad de opciones de entretenimiento y ocio. No pierdas la oportunidad de adquirir esta propiedad con un alto potencial de rentabilidad. ¡Ven a descubrirla y aprovecha esta oportunidad única en el mercado! LOS HONORARIOS PROFESIONALES SON DEL 2,5% + IVA Y NO ESTÁN INCLUIDOS EN EL PRECIO DE VENTA.";919389108;Calle de Quevedo;219900;9;Alcobendas Centro, Alcobendas;Mas Vida;Profesional;-;Alcobendas;Alcobendas Centro;-;928;237;6;bj;No;No;No;No;No;No;No;No;No
102372087;Piso;Piso;"Impecable y amplio piso en Alcobendas Norte Engel & Völkers presenta este amplio y tranquilo piso en Alcobendas Norte, una de las zonas más cotizadas de la zona Norte de Madrid por su buena situación geográfica en plena expansión urbanística. La vivienda, en impecable estado, tiene bien diferenciada la zona de día y la zona de descanso. Nos recibe a través de un espacioso hall de entrada con dos armarios empotrados dobles de puertas abatibles lacadas en madera blanca. El hall da paso a un gran salón con aire acondicionado. A su derecha encontramos una bonita cocina de casi 13 metros cuadrados, es muy espaciosa y está completamente equipada. Desde la cocina accedemos a un práctico lavadero. Ambas estancias tienen ventanas que dan al patio interior. Impresionan los 38 metros cuadrados del salón con dos ambientes bien diferenciados, una zona comedor y otra zona destinada a ver la televisión o tener agradables conversaciones en familia. El salón es muy luminoso, tiene grandes ventanales abatibles y oscilo batientes. A través de un espacioso pasillo accedemos a la zona de las habitaciones y de los amplios cuartos de baño. Lo primero que encontraremos a la derecha es un gran cuarto de baño completo con lavabo de dos senos y bañera. Este cuarto de baño es de fácil ventilación gracias a la ventana que dá al patio interior. Después encontramos dos bonitos dormitorios de 10 y 12 metros cuadrados, ambos con armarios empotrados. El dormitorio principal con baño en suite y vestidor es super espacioso, tiene 16 metros cuadrados, sorprenden dos armarios empotrados dobles de gran capacidad de puertas correderas de madera y cristal. Por supuesto que este dormitorio tiene aire acondicionado y un precioso y reformado baño en suite. Además esta vivienda incluye dos plazas de garaje ubicadas una junto a la otra y trastero de 7 metros útiles. Por último, resaltamos que esta vivienda se encuentra en una urbanización privada con zonas comunes, piscina, jardín, sala comunitaria para celebraciones, cancha de fútbol o baloncesto y portero físico. No dude en visitarlo y déjese sorprender por este impresionante piso, estaremos encantados de atenderle. En Alcobendas Norte, zona residencial muy bien comunicada con la A1 y carretera de Colmenar, varias líneas de autobuses, muy próximo a la estación de cercanías Renfe línea C4, línea 10 de Metro y metro así como a la N-1 y la Carretera de Colmenar.  Próximo al Aeropuerto Adolfo Suárez, al Hospital Infanta Sofía y a la Universidad Autónoma.  En la zona Norte de Alcobendas hay una amplia oferta de pisos ideales para familias. Comercios, supermercados, parques infantiles, centros deportivos y centros de salud.  Además, Alcobendas es una zona en expansión que acoge varias sedes empresariales y está posicionada como uno de las localizaciones más atractivas para la ubicación de empresas de la Comunidad de Madrid.";919386811;Norte;580000;3;Norte, Alcobendas;Engel & Völkers Madrid;Profesional;-;Alcobendas;Norte;-;3671;158;2;3;Sí;No;Sí;No;Sí;Sí;Sí;No;No
101919955;Piso en Calle de Isabel Rosillo, 12;Piso;"Estrena casa en Alcobendas centro, reformada totalmente a 4 mn andando de la Línea 10 de Metro, en una zona llena de comercio, comunicaciones, vida. Si no quieres meterte a reformar ni hacer obras, es la oportunidad. Salón cuadrado con salida a una terraza alargada con buenas vistas y frente despejado. Dos dormitorios, un baño con plato de ducha, cocina de paso y abierta, todo con un buen espacio y lleno de luz. Puerta de seguridad, pintura lisa, suelo de tarima, ventanas con doble acristalamiento y puertas lacadas en blanco. Las instalaciones de electricidad y fontanería son obviamente nuevas, por lo que te puedes olvidar de problemas en años. El edificio es de 1967 sin ascensor, algo que se compensa con el precio. Alcobendas centro es un barrio clásico de este municipio que conserva el sabor y la actividad de antaño. Muy importante, a menos de 5 mn de la estación de Metro Marqués de la Valdabia, la Línea 10, que recorre el eje de la Castellana entre otros lugares, conectándote con todo Madrid rápidamente. Contacta conmigo para más información.";670964213;Calle de Isabel Rosillo, 12;194000;2;Alcobendas Centro, Alcobendas;RE/MAX URBE;Profesional;-;Alcobendas;Alcobendas Centro;-;3079;63;1;4;No;No;No;No;No;No;No;No;No
101661891;Piso en Calle de la Imaginación;Piso;"Precioso apartamento en una de las mejores urbanizaciones de Fuentelucha. Destaca por su gran amplitud, cocina independiente, Calidades de alta gama: suelos de tarima, pintura en liso, aire acondicionado por conductos, amplio salón con salida a terraza. Urbanización con piscina, pádel, gimnasio, .  Zona nueva pero totalmente consolidada, dotada de todos los servicios. Zonas de restauración, colegios, a 10 minutos caminando de cercanías Renfe y a 15 minutos del metro.";919383512;Calle de la Imaginación;260000;1;Norte, Alcobendas;Nueva era;Profesional;-;Alcobendas;Norte;-;4000;65;1;bj;Sí;No;No;Sí;No;No;Sí;Sí;No
102389635;Piso;Piso;"Piso 95 m² en Alcobendas, Madrid Cornejo Inmuebles les ofrece este estupendo piso con plaza de garaje en una ubicación privilegiada. Con una Superficie útil de 76 m2 distribuidos en salón comedor independiente, dos dormitorios dobles, dos baños completos (uno de ellos en suite), y cocina completamente equipada con salida a una terraza-tendedero. Cuenta además con tres armarios empotrados en las habitaciones y en la entrada. La vivienda es exterior y muy luminosa con vistas al parque Cataluña y al Paseo de la Chopera. Con colegios, guarderia y amplias zonas verdes, metro, autobuses, asi como Cercanias y Hospital. Se encuentra en impecable estado. Adjuntamos memoria de calidades y plano. El precio incluye una plaza de garaje. Conectada por la A1 con coche, a 10 min del Aeropuerto. Es uno de los municipios de la zona norte de Madrid mejor posicionados para acoger sedes empresariales.";919385068;Alcobendas Centro;235000;2;Alcobendas Centro, Alcobendas;Cornejo Inmuebles;Profesional;-;Alcobendas;Alcobendas Centro;-;2474;95;2;1;Sí;No;No;Sí;Sí;Sí;No;No;No
100798045;Piso;Piso;"En venta amplio y luminoso piso con terraza de 7 m/2 situado en zona muy céntrica de Alcobendas. ¡TODO EXTERIOR! El inmueble consta de: entrada, cocina completamente independiente e equipada, salón de 10 m2 con salida a terraza que rodea toda la casa, 2 dormitorio dobles y baño completo con ducha. También es importante destacar que la vivienda cuenta cuenta con: armarios empotrados, mucha luz, orientación sur, toma de gas en la ventana y se entrega amueblada y lista para entrar Vivienda muy económica: cuota de comunidad 57€ incluyendo el agua fría. El piso destaca por su excelente ubicación: está cercano a todos los servicios, comercios, con bus en la puerta, metro( línea 10) y Renfe a 5 min, con fácil y rápida salida a carretera(A-1, A-6, R-2, M-30, M-40, Carretera a Barajas, Carretera a Colmenar, etc) *Ideal para vivir o para invertir *Disponible de inmediato! *Posibilidad de financiación a 100%.";914840150;Alcobendas Centro;159000;2;Alcobendas Centro, Alcobendas;Comprarcasa APINORTE;Profesional;-;Alcobendas;Alcobendas Centro;-;2741;58;1;3;No;No;No;Sí;No;No;No;No;No
101875650;Piso;Piso;"Piso 106 m² en Alcobendas, Madrid Cornejo Inmuebles ofrece amplia vivienda en zona tranquila, rodeada de jardines y parques. Totalmente exterior. Cerca de todos los servicios, comercios y transportes públicos. Dispone de amplia terraza acristalada, todas las estancias independientes y gran trastero en la misma finca de 9m2. Calefacción central. Ascensor y montacargas. Comunidad: 180 euros/mes con calefacción y agua caliente incluida. Consta de plaza de garaje opcional no incluida en el precio, consultar condiciones. ¡No dudes en visitarlo, te encantará!";919385068;Alcobendas Centro;255000;3;Alcobendas Centro, Alcobendas;Cornejo Inmuebles;Profesional;-;Alcobendas;Alcobendas Centro;-;2406;106;1;1;Sí;No;No;Sí;Sí;No;No;Sí;No
102131260;Piso en Dolores Ibarruri;Piso;"Inmobiliaria Emmanuel Bonito piso exterior en Urbanización con piscina. Trastero y 1 plaza de garaje Aire acondicionado por conductor Accesible para minusválidos Dormitorio principal con baño en suite, exterior a la calle principal. Armarios empotrados. Baño exterior con ducha. 3 dormitorios secundarios. Dos exteriores y uno interior. Éste tiene una terracita interior que se cerró, sin dársela al dormitorio. Comparten un baño con bañera. Están juntos con distribuidor propio. Cocina grande, en forma de L, con zona para comedor de diario. Por ella se accede a la terraza principal. Terrazas. Tiene varias. Dos exteriores y una interior. La principal, se accede desde la cocina, muy espaciosa teniendo en cuenta que una parte de cerró para dárselo al dormitorio principal, y la otra para dárselo al salón. En la zona del salón hay otra terracita, estrecha, con toldos. En uno de los dormitorios secundarios, está la terracita, cerrada, orientado hacia la urbanización. Amplio Salón comedor grande. Perfecto para poder un comedor familiar grande y un buen salón con los sofás grandes. Inmobiliaria Emmanuel, nos avalan mas de 30 años en el sector inmobiliario. Estamos especializados tanto en alquiler como en venta de inmuebles y oficinas de ALTO NIVEL situados en las zonas más exclusivas de Madrid, contamos con una amplia cartera de viviendas, no dude en llamarnos para ampliar información y ofrecerle el inmueble que mas se ajuste a sus necesidades. Por solicitud de algunos propietarios, algunos inmuebles que tenemos en esta zona solo están anunciados en nuestra web. Para verlos pinche por favor en nuestro logo o en el enlace adicional ubicado en la parte final del anuncio. Llámanos y ven a visitarlo.";919387307;Dolores Ibarruri;590000;4;Norte, Alcobendas;Emmanuel Integra;Profesional;-;Alcobendas;Norte;-;3758;157;2;3;Sí;No;Sí;Sí;Sí;Sí;Sí;Sí;Sí
101551572;Piso;Piso;"Piso totalmente reformado a estrenar en Alcobendas Engel & Völkers presenta esta vivienda totalmente reformada para entrar a vivir en pleno corazón de Alcobendas.  La vivienda se encuentra ubicada en la primera planta exterior del edificio. Dispone de 3 dormitorios, 1 cuarto de baño, salón con cocina americana y dos terrazas. Una terraza interior pensada como zona de lavandería y tendedero, y la terraza principal, a la que se accede desde la habitación más grande de la casa, está orientada a la calle principal y es ideal para tomar el aire a cualquier hora del día. No esperes más y aprovecha la oportunidad de estrenar esta estupenda vivienda totalmente reformada, su cocina equipada con todos los electrodomésticos nuevos y de primeras marcas, luz natural en todas las estancias, calefacción individual de gas en toda la casa y aire acondicionado con bomba de frio/calor en el salón. La vivienda está ubicada en Alcobendas, una ciudad para vivir situada al norte de la capital. Conectada a través de la A1 en coche, Línea C4 de cercanías Renfe, Línea 10 de Metro y varias líneas de autobuses. Así mismo, esta situada a tan sólo 10 min en coche, 30 min en transporte público, del Aeropuerto Madrid Barajas Adolfo Suarez. En la zona centro de la localidad de Alcobendas puedes encontrar todo tipo de servicios: comercios locales, supermercados, parques infantiles, centros deportivos, colegios, universidad y centros de salud. y esta muy próxima al Hospital Infanta Sofía. Además, la zona industrial y empresarial de Alcobendas permite conciliar la vida laboral y familiar con toda comodidad. Esta vivienda cuenta con todo tipo de comercios en la misma calle: un colegio a escasos metros, parques a menos de 5 minutos y está situada a 7 minutos de la estación de metro Marqués de la Valdavia o la parada de tren de cercanías Alcobendas/S. S. de los Reyes.";919386811;Alcobendas Centro;185000;3;Alcobendas Centro, Alcobendas;Engel & Völkers Madrid;Profesional;-;Alcobendas;Alcobendas Centro;-;3304;56;1;-;No;No;No;Sí;No;No;Sí;No;No
101345689;Piso;Piso;"En venta excelente piso de 3 dormitorios situado en zona centro de Alcobendas CON ASCENSOR. La vivienda destaca por su limosidad y se divide en:  amplio recibidor, salón de 15 m/2, 3 dormitorios de los cuales el principal doble con grande armario empotrado, baño con ducha reformado y cocina con espacio para mesa. Vivienda muy económica con poco gasto de comunidad. Ideal para personas con movilidad reducida. Con gas natural (por ahora instalado solo para el agua caliente) El piso destaca por su distribución, ubicación: metro a 3 min andando y tren a 6 min y es próximo a todo tipo de comercios, centros médicos, urgencias, colegios, parque, parada de bus, etc.  *Aconsejable visitar.  *POSIBILIDAD DE FINANCIACIÓN A 100%.";914840150;Alcobendas Centro;176000;3;Alcobendas Centro, Alcobendas;Comprarcasa APINORTE;Profesional;-;Alcobendas;Alcobendas Centro;-;2794;63;1;3;Sí;No;No;No;No;No;No;No;No
100830201;Ático en Calle de la Granja;Ático;"SERVICHCK IMOBILIARI GESTIONA INMEJORABLE ATICO LOFT DE ESQUINA  agente de gestion Rebeca Cuerda  Se vende loft en planta ático de 170 m2 mas 60 m2 de terraza con orientación U este-norte-oeste independiente actualmente esta como oficina. El edifico esta guardado con videovigilancia y vigilancia física parking exterior e interior, se ubica en el parque empresarial de Alcobendas rodeado tanto de zonas verdes como de comercios y transporte publico con acceso desde carretera A1  si necesitas alguna aclaracion o venir a conocer en inmueble no dudes en contactarme  Rebeca Cuerda.";652671701;Calle de la Granja;485000;1;Valdelacasa, Alcobendas;SERVICHECK Inmobiliaria;Profesional;-;Alcobendas;Valdelacasa;-;2462;197;2;3;Sí;No;No;Sí;Sí;Sí;No;No;No
102380636;Piso en Calle constitucion s/n;Piso;"Piso de tres dormitorios y un baño, ubicado en un edificio plurifamiliar de cuatro alturas sobre rasante sin ascensor, situado en el municipio de Alcobendas, provincia de Madrid. La vivienda se distribuye en cocina exterior amueblada con horno y campana extractora, salon -comedor, tres dormitorios y un baño completo con plato de ducha. Cuenta con puerta de entrada blindada normal, cocina y baños con paredes alicatadas, carpinteria interior en madera. suelos de tarima y gres, ventanas correderas y persianas en PVC. Se encuentra en una zona centrica, bien comunicado, cuenta a escasos metros con paradas de metro, tren y autobus.";984260216;Calle constitucion s/n;172600;3;Alcobendas Centro, Alcobendas;Decasa Gestión Inmobiliaria;Profesional;-;Alcobendas;Alcobendas Centro;-;1918;90;1;4;No;No;No;No;No;No;No;No;No
101694784;Piso;Piso;"INMOHAPPY MADRID NORTE presenta estupendo Lof en la zona de Valdelacasa (Alcobendas). Distribuido en planta de acceso con amplio hall y escaleras que bajan a la zona de salón-comedor-cocina, habitación semi-independiente y baño completo. Aire acondicionado con bomba de frío-calor. Ascensor y plaza de garaje. Gastos de comunidad 90 € (incluida plaza garaje).";919388694;Valdelacasa;222000;1;Valdelacasa, Alcobendas;INMOHAPPY MADRID NORTE;Profesional;-;Alcobendas;Valdelacasa;-;2337;95;1;bj;Sí;No;No;No;Sí;Sí;Sí;No;No
